Name,Link,Price,OldPrice,BestSeller,Stars
"Buteny Rechargeable LED Selfie Light Ring for Smartphones with 3 Brightness Levels, Blue",/-/en/Buteny-Rechargeable-Selfie-Smartphones-Brightness/dp/B078W5LT2S/ref=sr_1_4729?m=A1ZVRGNO5AYLOV&qid=1652830136&refinements=p_6%3AA1ZVRGNO5AYLOV&s=electronics&sr=1-4729,EGP 41.26,EGP 48.00,Limited time deal,
Full curved glass BLACK Tempered screen protector for NOKIA 6,/-/en/curved-glass-Tempered-screen-protector/dp/B091JP37H6/ref=sr_1_4730?m=A1ZVRGNO5AYLOV&qid=1652830136&refinements=p_6%3AA1ZVRGNO5AYLOV&s=electronics&sr=1-4730,EGP 16.49,EGP 18.43,,
Joyroom JR-PGTZ Super Fast Charging Set with Cable for iPhone - Multi Color,/-/en/Joyroom-JR-PGTZ-Super-Charging-iPhone/dp/B093G55W84/ref=sr_1_4731?m=A1ZVRGNO5AYLOV&qid=1652830136&refinements=p_6%3AA1ZVRGNO5AYLOV&s=electronics&sr=1-4731,EGP 336.00,,,
For Xiaomi Mi Note 10 Lite 3D full Curved Glass Screen Protector - Black,/-/en/Xiaomi-Curved-Glass-Screen-Protector/dp/B08X5ZZ72W/ref=sr_1_4732?m=A1ZVRGNO5AYLOV&qid=1652830136&refinements=p_6%3AA1ZVRGNO5AYLOV&s=electronics&sr=1-4732,EGP 73.00,,,
XO L72 EU Quick Charger 2.1A With 3 USB Ports And Micro cable - White,/-/en/XO-Quick-Charger-Ports-Micro/dp/B09FM2PC9P/ref=sr_1_4733?m=A1ZVRGNO5AYLOV&qid=1652830136&refinements=p_6%3AA1ZVRGNO5AYLOV&s=electronics&sr=1-4733,EGP 98.75,,Limited time deal,
For Oppo F11 Pro Case 360 Degree full cover 2 pieces metal frame Magnetic tempered glass back Case - Black,/-/en/Degree-cover-pieces-Magnetic-tempered/dp/B08X64QDCN/ref=sr_1_4734?m=A1ZVRGNO5AYLOV&qid=1652830136&refinements=p_6%3AA1ZVRGNO5AYLOV&s=electronics&sr=1-4734,EGP 88.02,,,
Hoco X65 - Prime Charging And Data Transmittion Cable (2.4A - 1M) - Micro-USB Plug For Samsung Huawei Xiaomi Oppo - Blue,/-/en/Hoco-X65-Charging-Transmittion-Micro-USB/dp/B09HL9RRB9/ref=sr_1_4735?m=A1ZVRGNO5AYLOV&qid=1652830136&refinements=p_6%3AA1ZVRGNO5AYLOV&s=electronics&sr=1-4735,EGP 30.21,,,
"Xiaomi Mi8 Mi 8 ENKAY 3D 0.2mm 9H Anti BLUERAY Tempered Glass, Carbon Fiber Edge Full Screen Protector - Black",/-/en/Xiaomi-BLUERAY-Tempered-Carbon-Protector/dp/B08XRRX8DR/ref=sr_1_4736?m=A1ZVRGNO5AYLOV&qid=1652830136&refinements=p_6%3AA1ZVRGNO5AYLOV&s=electronics&sr=1-4736,EGP 10.00,,,
Samsung Galaxy S20 Plus Anti-Shock 2.5D NANO Curved Polymer Screen Protector Matte Unbreakable Shock and Fingerprint,/-/en/Samsung-Anti-Shock-Protector-Unbreakable-Fingerprint/dp/B09231VKTW/ref=sr_1_4737?m=A1ZVRGNO5AYLOV&qid=1652830136&refinements=p_6%3AA1ZVRGNO5AYLOV&s=electronics&sr=1-4737,EGP 30.26,EGP 35.20,Limited time deal,
HP Z4000 Wireless Mouse (H5N61AA) - Black,/-/en/HP-Z4000-Wireless-Mouse-H5N61AA/dp/B00ECZEB0Y/ref=sr_1_4738?m=A1ZVRGNO5AYLOV&qid=1652830136&refinements=p_6%3AA1ZVRGNO5AYLOV&s=electronics&sr=1-4738,EGP 599.00,,,4.5 out of 5 stars
Boter 3D Hard Back Cover With Silicone Edges For Samsung Galaxy A72 - Multi Color,/-/en/Boter-Cover-Silicone-Samsung-Galaxy/dp/B08ZNTPBSG/ref=sr_1_4739?m=A1ZVRGNO5AYLOV&qid=1652830136&refinements=p_6%3AA1ZVRGNO5AYLOV&s=electronics&sr=1-4739,EGP 17.53,,,
WIWU Unisex Defense Armor Apple Watch Case Military Level Shock Proof 44mm - Silver,/-/en/Unisex-Defense-Armor-Apple-Military/dp/B08VQLTD4L/ref=sr_1_4740?m=A1ZVRGNO5AYLOV&qid=1652830136&refinements=p_6%3AA1ZVRGNO5AYLOV&s=electronics&sr=1-4740,EGP 195.62,,,
"Armor anti-shock screen protector for Nokia XL, Transparent",/-/en/Armor-anti-shock-screen-protector-Transparent/dp/B08Z4BZN5K/ref=sr_1_4741?m=A1ZVRGNO5AYLOV&qid=1652830136&refinements=p_6%3AA1ZVRGNO5AYLOV&s=electronics&sr=1-4741,EGP 10.00,,,
Gelatinous Screen 360 Degree Protector (Front and Back protector) For Samsung Galaxy/S8,/-/en/Gelatinous-Screen-Protector-protector-Samsung/dp/B09237X27H/ref=sr_1_4742?m=A1ZVRGNO5AYLOV&qid=1652830136&refinements=p_6%3AA1ZVRGNO5AYLOV&s=electronics&sr=1-4742,EGP 10.00,,,
Hard Back Cover With Camera Protector For Samsung Galaxy M51 -,/-/en/Cover-Camera-Protector-Samsung-Galaxy/dp/B0994P3924/ref=sr_1_4743?m=A1ZVRGNO5AYLOV&qid=1652830136&refinements=p_6%3AA1ZVRGNO5AYLOV&s=electronics&sr=1-4743,EGP 10.00,,,
"Tempered Glass Back Camera Lens Screen Protector for Xiaomi Mi A2 Lite Mobile Phone, Set of 3 - Clear",/-/en/Tempered-Camera-Screen-Protector-Xiaomi/dp/B09888DD97/ref=sr_1_4744?m=A1ZVRGNO5AYLOV&qid=1652830136&refinements=p_6%3AA1ZVRGNO5AYLOV&s=electronics&sr=1-4744,EGP 10.00,,,
"Tempered Glass Back Camera Lens Screen Protector for Oppo A5 2020, Pack of 3 - Clear",/-/en/Tempered-Glass-Camera-Screen-Protector/dp/B092LMH9J5/ref=sr_1_4745?m=A1ZVRGNO5AYLOV&qid=1652830136&refinements=p_6%3AA1ZVRGNO5AYLOV&s=electronics&sr=1-4745,EGP 10.00,,,
For Iphone 11 Pro Back Full Side Screen Protector Gelatin With Nano Glass Camera Screen - Clear,/-/en/Iphone-Screen-Protector-Gelatin-Camera/dp/B091J74G71/ref=sr_1_4746?m=A1ZVRGNO5AYLOV&qid=1652830136&refinements=p_6%3AA1ZVRGNO5AYLOV&s=electronics&sr=1-4746,EGP 10.00,,,
"Baseus GaN2 Lite Quick Charger Wall Charger (65W) With Type-C and USB-A Ports Travel Charger, Supports PD3.0, QC4+, QC3.0, AFC, MTK Protocols For Samsung Xiaomi Oppo Huawei - White",/-/en/Baseus-Charger-Supports-Protocols-Samsung/dp/B01GLFCNQQ/ref=sr_1_4747?m=A1ZVRGNO5AYLOV&qid=1652830136&refinements=p_6%3AA1ZVRGNO5AYLOV&s=electronics&sr=1-4747,EGP 452.57,EGP 513.00,,
XO NB156 Type-C Cable 2.4A For Mobile Phones 1M - Green,/-/en/XO-NB156-Type-C-Mobile-Phones/dp/B092RGR4D1/ref=sr_1_4748?m=A1ZVRGNO5AYLOV&qid=1652830136&refinements=p_6%3AA1ZVRGNO5AYLOV&s=electronics&sr=1-4748,EGP 23.94,,,
Pavareal PA-CC51 2 inputs Car charger for Mobile Phones - White Black,/-/en/Pavareal-PA-CC51-inputs-charger-Mobile/dp/B093G61W7T/ref=sr_1_4749?m=A1ZVRGNO5AYLOV&qid=1652830136&refinements=p_6%3AA1ZVRGNO5AYLOV&s=electronics&sr=1-4749,EGP 144.00,,,
Back Cover Hard Slim Case with Camera Shield For Xiaomi Poco X3 - Clear,/-/en/Back-Cover-Camera-Shield-Xiaomi/dp/B09P5GZRH9/ref=sr_1_4750?m=A1ZVRGNO5AYLOV&qid=1652830136&refinements=p_6%3AA1ZVRGNO5AYLOV&s=electronics&sr=1-4750,EGP 61.87,EGP 72.00,Limited time deal,4.4 out of 5 stars
Ceramic Matte Screen Protector For Xiaomi Redmi Note 9 Pro Anti Fingerprint,/-/en/Ceramic-Screen-Protector-Xiaomi-Fingerprint/dp/B0922SRJT6/ref=sr_1_4751?m=A1ZVRGNO5AYLOV&qid=1652830136&refinements=p_6%3AA1ZVRGNO5AYLOV&s=electronics&sr=1-4751,EGP 10.00,,,
5D Curve Screen Protector For Samsung Galaxy S10 Plus - Black,/-/en/Curve-Screen-Protector-Samsung-Galaxy/dp/B08X65T3VM/ref=sr_1_4752?m=A1ZVRGNO5AYLOV&qid=1652830136&refinements=p_6%3AA1ZVRGNO5AYLOV&s=electronics&sr=1-4752,EGP 60.31,,,
Razer Kraken Wired Headset Black,/-/en/Razer-Kraken-Wired-Headset-Black/dp/B07MJFZS9V/ref=sr_1_4753?m=A1ZVRGNO5AYLOV&qid=1652830137&refinements=p_6%3AA1ZVRGNO5AYLOV&s=electronics&sr=1-4753,"EGP 2,365.68",,,4.5 out of 5 stars
"Keendex Kx2339 AUX 3.5 mm Male to Female Video Cable for Samsung TV, 20 cm - Black",/-/en/Keendex-Kx2339-Female-Video-Samsung/dp/B092DZCCMJ/ref=sr_1_4754?m=A1ZVRGNO5AYLOV&qid=1652830137&refinements=p_6%3AA1ZVRGNO5AYLOV&s=electronics&sr=1-4754,EGP 48.67,,,
screen protector 9D Samsung Galaxy A7 2018 - Black,/-/en/screen-protector-Samsung-Galaxy-2018/dp/B08Z7S5H69/ref=sr_1_4755?m=A1ZVRGNO5AYLOV&qid=1652830137&refinements=p_6%3AA1ZVRGNO5AYLOV&s=electronics&sr=1-4755,EGP 35.20,,,
Plastic Back cover With Camera Protector And Silicon Edges For iPhone 11 Pro Max - Clear Green,/-/en/Plastic-Camera-Protector-Silicon-iPhone/dp/B091P13XMG/ref=sr_1_4756?m=A1ZVRGNO5AYLOV&qid=1652830137&refinements=p_6%3AA1ZVRGNO5AYLOV&s=electronics&sr=1-4756,EGP 56.25,,,
Keendex 1919 4 Pin to 15 Pin IDE Sata Cable - Multi Color,/-/en/Keendex-1919-Pin-Sata-Cable/dp/B096L7W2SR/ref=sr_1_4757?m=A1ZVRGNO5AYLOV&qid=1652830137&refinements=p_6%3AA1ZVRGNO5AYLOV&s=electronics&sr=1-4757,EGP 51.07,,,
5D Glass Screen Protector for Xiaomi Redmi 9 - Black,/-/en/Glass-Screen-Protector-Xiaomi-Redmi/dp/B08ZNT75SS/ref=sr_1_4758?m=A1ZVRGNO5AYLOV&qid=1652830137&refinements=p_6%3AA1ZVRGNO5AYLOV&s=electronics&sr=1-4758,EGP 34.96,,,
2030 usbKeyboard Multimedia Zero ZR-,/-/en/2030-usbKeyboard-Multimedia-Zero-ZR/dp/B09QMK56NX/ref=sr_1_4759?m=A1ZVRGNO5AYLOV&qid=1652830137&refinements=p_6%3AA1ZVRGNO5AYLOV&s=electronics&sr=1-4759,EGP 95.35,,,
6D Tempered Glass screen protector X Glass for Apple iPhone X,/-/en/Tempered-Glass-screen-protector-iPhone/dp/B08YY19CDD/ref=sr_1_4760?m=A1ZVRGNO5AYLOV&qid=1652830137&refinements=p_6%3AA1ZVRGNO5AYLOV&s=electronics&sr=1-4760,EGP 28.80,,,
Silicone Protective Case For Airpods Pro - Light Purple,/-/en/Silicone-Protective-Case-Airpods-Pro/dp/B09L54S9K7/ref=sr_1_4761?m=A1ZVRGNO5AYLOV&qid=1652830137&refinements=p_6%3AA1ZVRGNO5AYLOV&s=electronics&sr=1-4761,EGP 40.13,,,
KP TECHNOLOGY Galaxy J7 Prime 2 / Galaxy J7 Prime 2018 Premium Quality Genuine Tempered Glass [2 PACK] Explosion & Shatter Proof Screen Protector Guard Cover for Samsung Galaxy J7 Prime 2 (Clear),/-/en/KP-TECHNOLOGY-Tempered-Explosion-Protector/dp/B07D1L84YZ/ref=sr_1_4762?m=A1ZVRGNO5AYLOV&qid=1652830137&refinements=p_6%3AA1ZVRGNO5AYLOV&s=electronics&sr=1-4762,EGP 32.00,,,
Silicone Protective Cases Cover For Apple Watch 44mm iwatch series4 Case TPU Soft Protect Shell Watch -Silver,/-/en/Silicone-Protective-series4-Protect-Silver/dp/B09692LBDR/ref=sr_1_4763?m=A1ZVRGNO5AYLOV&qid=1652830137&refinements=p_6%3AA1ZVRGNO5AYLOV&s=electronics&sr=1-4763,EGP 49.00,EGP 70.73,Save 31%,
Ldnio A1306Q Single Port Fast Wall Charger 18W With 1M Micro Cable - White,/-/en/Ldnio-A1306Q-Single-Charger-Micro/dp/B09DXPGXYY/ref=sr_1_4764?m=A1ZVRGNO5AYLOV&qid=1652830137&refinements=p_6%3AA1ZVRGNO5AYLOV&s=electronics&sr=1-4764,EGP 172.80,,,
Borofone BT21A Power Bank (20000) - White,/-/en/Borofone-BT21A-Power-Bank-20000/dp/B08D6RXRBV/ref=sr_1_4765?m=A1ZVRGNO5AYLOV&qid=1652830137&refinements=p_6%3AA1ZVRGNO5AYLOV&s=electronics&sr=1-4765,EGP 334.28,EGP 374.40,,
"Fujifilm Instax Mini 9 Camera with Gift Box, 7 Pieces - Purple",/-/en/Fujifilm-Instax-Mini-Camera-Pieces/dp/B091NXWCR7/ref=sr_1_4766?m=A1ZVRGNO5AYLOV&qid=1652830137&refinements=p_6%3AA1ZVRGNO5AYLOV&s=electronics&sr=1-4766,"EGP 3,038.48",,,
[2-Pack] Huawei P20 Lite/Nova 3e 9H HD Tempered Glass Screen Protector Scratch Guard,/-/en/2-Pack-9H-Tempered-Protector-Scratch/dp/B091NXPPDM/ref=sr_1_4767?m=A1ZVRGNO5AYLOV&qid=1652830137&refinements=p_6%3AA1ZVRGNO5AYLOV&s=electronics&sr=1-4767,EGP 28.76,,,
Defender Back Cover For iPhone 11 Pro Max - Clear,/-/en/Defender-Back-Cover-iPhone-Pro/dp/B0937HC8MS/ref=sr_1_4768?m=A1ZVRGNO5AYLOV&qid=1652830137&refinements=p_6%3AA1ZVRGNO5AYLOV&s=electronics&sr=1-4768,EGP 121.00,,,4.5 out of 5 stars
"Toshiba 23A BP-1C Alkaline Battery, 12 V, 1 Piece",/-/en/Toshiba-23A-BP-1C-Alkaline-Battery/dp/B0877CZ1L5/ref=sr_1_4769?m=A1ZVRGNO5AYLOV&qid=1652830137&refinements=p_6%3AA1ZVRGNO5AYLOV&s=electronics&sr=1-4769,EGP 38.50,,,4.7 out of 5 stars
for Huawei P30pro Mocolo UV Nano Curved Full Glue Glass Screen Protector Curved - Clear,/-/en/Huawei-P30pro-Mocolo-Curved-Protector/dp/B08X6N3L6J/ref=sr_1_4770?m=A1ZVRGNO5AYLOV&qid=1652830137&refinements=p_6%3AA1ZVRGNO5AYLOV&s=electronics&sr=1-4770,EGP 91.00,,,
Nillkin Super Frosted Shield Hard Back Cover For Samsung Galaxy S21 Ultra - Bright Red,/-/en/Nillkin-Frosted-Shield-Samsung-Galaxy/dp/B08SL92R5N/ref=sr_1_4771?m=A1ZVRGNO5AYLOV&qid=1652830137&refinements=p_6%3AA1ZVRGNO5AYLOV&s=electronics&sr=1-4771,EGP 143.99,,,
"Screen Protector for iPhone 11 Pro Max 6.5-Inch, 5D Tempered Glass Film,Black",/-/en/Screen-Protector-iPhone-6-5-Inch-Tempered/dp/B08Y8YXZJH/ref=sr_1_4772?m=A1ZVRGNO5AYLOV&qid=1652830137&refinements=p_6%3AA1ZVRGNO5AYLOV&s=electronics&sr=1-4772,EGP 28.80,,,
Xiaomi Strap for Mi Smart Band 3/4 - Blue,/-/en/Xiaomi-Strap-Mi-Smart-Band/dp/B09JN5WR48/ref=sr_1_4773?m=A1ZVRGNO5AYLOV&qid=1652830137&refinements=p_6%3AA1ZVRGNO5AYLOV&s=electronics&sr=1-4773,EGP 71.00,EGP 72.00,,
Zero Hdmi Cable 1.2M - Black,/-/en/Zero-Hdmi-Cable-1-2M-Black/dp/B09JT368Z8/ref=sr_1_4774?m=A1ZVRGNO5AYLOV&qid=1652830137&refinements=p_6%3AA1ZVRGNO5AYLOV&s=electronics&sr=1-4774,EGP 20.52,,,
5D Curve Screen Protector For Samsung Galaxy S10 Plus - Black,/-/en/Curve-Screen-Protector-Samsung-Galaxy/dp/B08XRRRBJV/ref=sr_1_4775?m=A1ZVRGNO5AYLOV&qid=1652830137&refinements=p_6%3AA1ZVRGNO5AYLOV&s=electronics&sr=1-4775,EGP 56.30,,,
"Samsung In-Ear Headphones - Black, EO-HS1303",/-/en/Samsung-In-Ear-Headphones-Black-EO-HS1303/dp/B07695GG1L/ref=sr_1_4776?m=A1ZVRGNO5AYLOV&qid=1652830137&refinements=p_6%3AA1ZVRGNO5AYLOV&s=electronics&sr=1-4776,"EGP 1,638.57",,,4.4 out of 5 stars
Joyroom JR-BP858 Crystal Series Protective Phone Case (With Raised Edges) For Iphone 12 - Transparent,/-/en/Joyroom-JR-BP858-Crystal-Protective-Raised/dp/B093TMLF41/ref=sr_1_4777?m=A1ZVRGNO5AYLOV&qid=1652830137&refinements=p_6%3AA1ZVRGNO5AYLOV&s=electronics&sr=1-4777,EGP 112.00,,,
YESIDO Type-C connect EarphoneYH-35 White,/-/en/YESIDO-Type-C-connect-EarphoneYH-35-White/dp/B094JMMR8T/ref=sr_1_4778?m=A1ZVRGNO5AYLOV&qid=1652830137&refinements=p_6%3AA1ZVRGNO5AYLOV&s=electronics&sr=1-4778,EGP 176.80,,,
Spigen 077CS27242 Tough Armor Back Cover for iPhone 11 Pro Mobile Phone - Satin Silver,/-/en/Spigen-077CS27242-Tough-iPhone-Mobile/dp/B07T3PFMK4/ref=sr_1_4779?m=A1ZVRGNO5AYLOV&qid=1652830137&refinements=p_6%3AA1ZVRGNO5AYLOV&s=electronics&sr=1-4779,EGP 255.26,,,4.7 out of 5 stars
CT-66 Cat Ear Wireless Headphones Led-Blue/Orange,/-/en/CT-66-Wireless-Headphones-Led-Blue-Orange/dp/B09VJ2FVD1/ref=sr_1_4780?m=A1ZVRGNO5AYLOV&qid=1652830137&refinements=p_6%3AA1ZVRGNO5AYLOV&s=electronics&sr=1-4780,EGP 343.76,,Limited time deal,
Hard Back Cover With Sillicone Edges And Camera Slider Protector For Samsung Galaxy A72 5G/4G - Clear,/-/en/Sillicone-Camera-Slider-Protector-Samsung/dp/B09BG2Z188/ref=sr_1_4781?m=A1ZVRGNO5AYLOV&qid=1652830137&refinements=p_6%3AA1ZVRGNO5AYLOV&s=electronics&sr=1-4781,EGP 96.00,,,
Borofone BV5 Micro To Lightning adapter - Silver,/-/en/Borofone-BV5-Micro-Lightning-adapter/dp/B08XRYVHRV/ref=sr_1_4782?m=A1ZVRGNO5AYLOV&qid=1652830137&refinements=p_6%3AA1ZVRGNO5AYLOV&s=electronics&sr=1-4782,EGP 30.78,,,4.7 out of 5 stars
TPU Mobile Cover Ultra Thin Phone Case For Realme 5 / Clear,/-/en/Mobile-Cover-Ultra-Phone-Realme/dp/B08YXXDF7B/ref=sr_1_4783?m=A1ZVRGNO5AYLOV&qid=1652830137&refinements=p_6%3AA1ZVRGNO5AYLOV&s=electronics&sr=1-4783,EGP 28.00,EGP 28.80,,
Mocolo Nano optics UV Liquid Tempered Glass Screen Protector For OPPO Reno 4 Pro - Clear,/-/en/Mocolo-optics-Liquid-Tempered-Protector/dp/B092DX3Q6S/ref=sr_1_4784?m=A1ZVRGNO5AYLOV&qid=1652830137&refinements=p_6%3AA1ZVRGNO5AYLOV&s=electronics&sr=1-4784,EGP 100.32,,,
Hoco X51 - High-power charging data cable (5A - 100W- 1M) - Type-C For Samsung Huawei Xiaomi Oppo - White,/-/en/Hoco-X51-High-power-charging-Samsung/dp/B08ZNTNT9V/ref=sr_1_4785?m=A1ZVRGNO5AYLOV&qid=1652830137&refinements=p_6%3AA1ZVRGNO5AYLOV&s=electronics&sr=1-4785,EGP 86.54,,,
Nillkin V+ Anti Blue Light Tempered Glass Screen Protector for Apple iPad Pro 2018/2020-12.9 Inches,/-/en/Nillkin-Tempered-Screen-Protector-2020-12-9/dp/B08HHD1NYN/ref=sr_1_4786?m=A1ZVRGNO5AYLOV&qid=1652830137&refinements=p_6%3AA1ZVRGNO5AYLOV&s=electronics&sr=1-4786,EGP 329.69,,,
"Hoco M82 - La musique Universal Earphones with Mic (Length: 1.2m, Plug: 3.5mm) Compabitle with iPhone Samsung Xiaomi Oppo - White",/-/en/Hoco-M82-Universal-Earphones-Compabitle/dp/B09QYSQ1XQ/ref=sr_1_4787?m=A1ZVRGNO5AYLOV&qid=1652830137&refinements=p_6%3AA1ZVRGNO5AYLOV&s=electronics&sr=1-4787,EGP 45.16,,,
Silicon Back Cover for Oppo Reno 2F - Black,/-/en/Silicon-Back-Cover-Oppo-Reno/dp/B0976DJSBG/ref=sr_1_4788?m=A1ZVRGNO5AYLOV&qid=1652830137&refinements=p_6%3AA1ZVRGNO5AYLOV&s=electronics&sr=1-4788,EGP 41.26,EGP 49.00,Limited time deal,
CASE LOGIC HDD CASE HDC11 BLACK,/-/en/CASE-LOGIC-HDD-HDC11-BLACK/dp/B00WENHF8Q/ref=sr_1_4789?m=A1ZVRGNO5AYLOV&qid=1652830137&refinements=p_6%3AA1ZVRGNO5AYLOV&s=electronics&sr=1-4789,EGP 424.96,,,
Hoco X60 - Honorific Silicone Magnetic Charging Cable (2A - 1M) - Type-C Plug For Samsung Huawei Xiaomi Oppo - Black,/-/en/Hoco-X60-Honorific-Silicone-Magnetic/dp/B09HLBNCHY/ref=sr_1_4790?m=A1ZVRGNO5AYLOV&qid=1652830137&refinements=p_6%3AA1ZVRGNO5AYLOV&s=electronics&sr=1-4790,EGP 78.45,,,
"Raptic Clear Case Compatible with iPhone 13 Pro Case, Anti-Yellow Slim Cover, Shock Absorbing Rubber, Scratch Resistant Protective Case, Fits iPhone 13 Pro, Smoke",/-/en/Compatible-Anti-Yellow-Absorbing-Resistant-Protective/dp/B097B8RMSM/ref=sr_1_4791?m=A1ZVRGNO5AYLOV&qid=1652830137&refinements=p_6%3AA1ZVRGNO5AYLOV&s=electronics&sr=1-4791,EGP 319.20,,,
Camelion Battery For Cameras - A23,/-/en/Camelion-Battery-For-Cameras-A23/dp/B07JZ6Y1SM/ref=sr_1_4792?m=A1ZVRGNO5AYLOV&qid=1652830137&refinements=p_6%3AA1ZVRGNO5AYLOV&s=electronics&sr=1-4792,EGP 30.00,EGP 48.00,,
High Quality Set of 2 Glass Screen Protectors For Samsung Galaxy S10 Plus - Clear Black,/-/en/Quality-Screen-Protectors-Samsung-Galaxy/dp/B09R51WLKL/ref=sr_1_4793?m=A1ZVRGNO5AYLOV&qid=1652830137&refinements=p_6%3AA1ZVRGNO5AYLOV&s=electronics&sr=1-4793,EGP 47.42,,,
18D glass screen protection with anti-shock rubber edges for iPhone 11 Pro,/-/en/screen-protection-anti-shock-rubber-iPhone/dp/B098TZJTH2/ref=sr_1_4794?m=A1ZVRGNO5AYLOV&qid=1652830137&refinements=p_6%3AA1ZVRGNO5AYLOV&s=electronics&sr=1-4794,EGP 42.31,,,
For Oppo Reno 3 5D Full Screen Protector Black Frame Reno3 - By Dl3 Mobailk,/-/en/Screen-Protector-Black-Frame-Reno3/dp/B08X67TJNQ/ref=sr_1_4795?m=A1ZVRGNO5AYLOV&qid=1652830137&refinements=p_6%3AA1ZVRGNO5AYLOV&s=electronics&sr=1-4795,EGP 22.39,EGP 62.00,,
Smart Watch X9 Works with Android & iOS with Rubber Band - Black,/-/en/Smart-Watch-Works-Android-Rubber/dp/B09MJL9T31/ref=sr_1_4796?m=A1ZVRGNO5AYLOV&qid=1652830137&refinements=p_6%3AA1ZVRGNO5AYLOV&s=electronics&sr=1-4796,EGP 355.68,,,
33Ft 1080P 3D Flat Hdmi Cable 1.4 Male To Male For Hdtv Xbox Ps3 10M,/-/en/33Ft-1080P-Flat-Hdmi-Cable/dp/B08YNH7WK4/ref=sr_1_4797?m=A1ZVRGNO5AYLOV&qid=1652830137&refinements=p_6%3AA1ZVRGNO5AYLOV&s=electronics&sr=1-4797,EGP 97.50,,,
privacy screen protector for Apple iphone 11 pro max,/-/en/privacy-screen-protector-Apple-iphone/dp/B08Z47W56W/ref=sr_1_4798?m=A1ZVRGNO5AYLOV&qid=1652830137&refinements=p_6%3AA1ZVRGNO5AYLOV&s=electronics&sr=1-4798,EGP 48.13,EGP 65.00,Limited time deal,4.3 out of 5 stars
Baseus Bullet An on-board Magnetic Bracket,/-/en/Baseus-Bullet-board-Magnetic-Bracket/dp/B017LTBOHA/ref=sr_1_4799?m=A1ZVRGNO5AYLOV&qid=1652830137&refinements=p_6%3AA1ZVRGNO5AYLOV&s=electronics&sr=1-4799,EGP 180.96,,,
X-Level FIBCARD Series 360 Degree Full Protection Flip Leather Cover With Card Wallet For iPhone X & iPhone XS - Pink,/-/en/X-Level-FIBCARD-Degree-Protection-Leather/dp/B08WJLD2JK/ref=sr_1_4800?m=A1ZVRGNO5AYLOV&qid=1652830137&refinements=p_6%3AA1ZVRGNO5AYLOV&s=electronics&sr=1-4800,EGP 19.00,,,
"Turtle Beach Recon 70 Blue Camo Gaming Headset - FLIP-UP To Mute Microphone - Lightweight Comfort - for PlayStation 5, PS4 Pro & PS4, Xbox One & Xbox Series X|S, Nintendo Switch, and Mobile",/-/en/Turtle-Beach-Recon-Gaming-Headset/dp/B08486NP2G/ref=sr_1_4801?m=A1ZVRGNO5AYLOV&qid=1652830138&refinements=p_6%3AA1ZVRGNO5AYLOV&s=electronics&sr=1-4801,EGP 901.00,,,4.4 out of 5 stars
GKK Hard Back Cover for iPhone 7 Plus/iPhone 8 Plus - Black and Silver,/-/en/GKK-Hard-Back-Cover-iPhone/dp/B092FRBS2D/ref=sr_1_4802?m=A1ZVRGNO5AYLOV&qid=1652830138&refinements=p_6%3AA1ZVRGNO5AYLOV&s=electronics&sr=1-4802,EGP 128.02,,,
"Zidwzidwei Screen Protector for Oppo A93 [2 Pack], 9H Hardness Tempered Glass, 2.5D High Definition Film, Bubble Free, Screen Protector Compatible with Oppo A93",/-/en/Zidwzidwei-Protector-Hardness-Definition-Compatible/dp/B08LKQSZVP/ref=sr_1_4803?m=A1ZVRGNO5AYLOV&qid=1652830138&refinements=p_6%3AA1ZVRGNO5AYLOV&s=electronics&sr=1-4803,EGP 27.50,EGP 32.00,Limited time deal,
Apple Iphone X armor iron man case cover with magnetic holder ring stand blue,/-/en/Apple-Iphone-armor-magnetic-holder/dp/B08Z5SX1TN/ref=sr_1_4804?m=A1ZVRGNO5AYLOV&qid=1652830138&refinements=p_6%3AA1ZVRGNO5AYLOV&s=electronics&sr=1-4804,EGP 78.20,,,
Back Cover For Xiaomi Mi 10T Lite - Clear,/-/en/Back-Cover-Xiaomi-10T-Lite/dp/B0922YXYT1/ref=sr_1_4805?m=A1ZVRGNO5AYLOV&qid=1652830138&refinements=p_6%3AA1ZVRGNO5AYLOV&s=electronics&sr=1-4805,EGP 38.49,EGP 42.99,,
Boter 3D Back Cover Hard Slim Protection Case For Oppo Realme 6 - Multi Color,/-/en/Boter-Back-Cover-Protection-Realme/dp/B08X6N2G3T/ref=sr_1_4806?m=A1ZVRGNO5AYLOV&qid=1652830138&refinements=p_6%3AA1ZVRGNO5AYLOV&s=electronics&sr=1-4806,EGP 19.00,,,
"Samsung Galaxy Note 9 Screen Protector,Tempered Glass Screen Protector (Black)",/-/en/Samsung-Galaxy-Screen-Protector-Tempered/dp/B08YY4FBM4/ref=sr_1_4807?m=A1ZVRGNO5AYLOV&qid=1652830138&refinements=p_6%3AA1ZVRGNO5AYLOV&s=electronics&sr=1-4807,EGP 118.74,,,
Iron Man Cover With Metal Ring For Samsung A10 - Black,/-/en/Iron-Cover-Metal-Ring-Samsung/dp/B08YY16KHV/ref=sr_1_4808?m=A1ZVRGNO5AYLOV&qid=1652830138&refinements=p_6%3AA1ZVRGNO5AYLOV&s=electronics&sr=1-4808,EGP 24.74,EGP 43.00,Save 42%,4.5 out of 5 stars
For Huawei Nova 7 SE Back Screen Protector Matte Anti Fingerprint - Clear,/-/en/Huawei-Screen-Protector-Matte-Fingerprint/dp/B091J2V8ZR/ref=sr_1_4809?m=A1ZVRGNO5AYLOV&qid=1652830138&refinements=p_6%3AA1ZVRGNO5AYLOV&s=electronics&sr=1-4809,EGP 16.50,EGP 23.00,Limited time deal,
Dual Layer Hard Back Cover with Stand and Finger Holder for Samsung Galaxy A21S - Red and Black,/-/en/Layer-Finger-Holder-Samsung-Galaxy/dp/B08X6LZDY3/ref=sr_1_4810?m=A1ZVRGNO5AYLOV&qid=1652830138&refinements=p_6%3AA1ZVRGNO5AYLOV&s=electronics&sr=1-4810,EGP 32.00,,,
Glass Screen Protector For iPhone 6 Plus,/-/en/Glass-Screen-Protector-iPhone-Plus/dp/B096QW8PK3/ref=sr_1_4811?m=A1ZVRGNO5AYLOV&qid=1652830138&refinements=p_6%3AA1ZVRGNO5AYLOV&s=electronics&sr=1-4811,EGP 14.59,,,
9D Screen Protector Glass Edge to Edge full Glue for Huawei Y7 Prime 2018 Huawei Enjoy 8 - Black,/-/en/Screen-Protector-Glass-Huawei-Prime/dp/B08Y8Y997J/ref=sr_1_4812?m=A1ZVRGNO5AYLOV&qid=1652830138&refinements=p_6%3AA1ZVRGNO5AYLOV&s=electronics&sr=1-4812,EGP 10.00,EGP 12.00,,
Samsung Galaxy M30s Screen Protector Tempered Glass - wafi,/-/en/Samsung-Galaxy-Screen-Protector-Tempered/dp/B091Q7G6M9/ref=sr_1_4813?m=A1ZVRGNO5AYLOV&qid=1652830138&refinements=p_6%3AA1ZVRGNO5AYLOV&s=electronics&sr=1-4813,EGP 24.00,,,
GOLON RX-F10UR Rechargable Radio With 3 Band - Black/Silver,/-/en/GOLON-RX-F10UR-Rechargable-Radio-Band/dp/B09TQ2CBH3/ref=sr_1_4814?m=A1ZVRGNO5AYLOV&qid=1652830138&refinements=p_6%3AA1ZVRGNO5AYLOV&s=electronics&sr=1-4814,EGP 329.17,,,
Glass Camera Screeen For Samsung Galaxy A71,/-/en/Glass-Camera-Screeen-Samsung-Galaxy/dp/B08X65RNG7/ref=sr_1_4815?m=A1ZVRGNO5AYLOV&qid=1652830138&refinements=p_6%3AA1ZVRGNO5AYLOV&s=electronics&sr=1-4815,EGP 32.00,,,
Boter Printed Hard Back Cover For Xiaomi Redmi Note 10 Pro - Multi Color,/-/en/Boter-Printed-Cover-Xiaomi-Redmi/dp/B08WJNN8ZD/ref=sr_1_4816?m=A1ZVRGNO5AYLOV&qid=1652830138&refinements=p_6%3AA1ZVRGNO5AYLOV&s=electronics&sr=1-4816,EGP 19.00,,,
Mereman JoJo's Bizarre Adventure Mens & Womens Hiking Protective Face Shield Hat Facial Cover Baseball Cap with Isolation Cover Anti-Fog Anti-Saliva Face Black,/-/en/Mereman-Adventure-Protective-Isolation-Anti-Saliva/dp/B087WTTF1M/ref=sr_1_4817?m=A1ZVRGNO5AYLOV&qid=1652830138&refinements=p_6%3AA1ZVRGNO5AYLOV&s=electronics&sr=1-4817,EGP 19.00,,,
Boter 3D Back Cover Hard Slim Protection Case For Samsung Galaxy Note 10 - Multi Color,/-/en/Boter-Cover-Protection-Samsung-Galaxy/dp/B091NYKG7M/ref=sr_1_4818?m=A1ZVRGNO5AYLOV&qid=1652830138&refinements=p_6%3AA1ZVRGNO5AYLOV&s=electronics&sr=1-4818,EGP 19.00,,,
Boter 3D Back Cover Slim Protection Case For Samsung Galaxy Note 10 - Multi Color,/-/en/Boter-Cover-Protection-Samsung-Galaxy/dp/B08X6H7MWK/ref=sr_1_4819?m=A1ZVRGNO5AYLOV&qid=1652830138&refinements=p_6%3AA1ZVRGNO5AYLOV&s=electronics&sr=1-4819,EGP 19.00,,,
"ZCIBN [3 Pieces] Tempered Glass Compatible with Samsung Galaxy Note 10 Lite/A81/A91 [9H Hardness][Anti-Fingerprint] [HD Clear],Galaxy Note 10 Lite/A81/A91",/-/en/Tempered-Compatible-Samsung-Hardness-Anti-Fingerprint/dp/B093625YZN/ref=sr_1_4820?m=A1ZVRGNO5AYLOV&qid=1652830138&refinements=p_6%3AA1ZVRGNO5AYLOV&s=electronics&sr=1-4820,EGP 45.57,,,
"MSOSA Compatible with Screen Protector Samsung Galaxy A30s/A50s,[2 Pack] Ultra Clear /9H Hardness Tempered glass for Samsung Galaxy A30s/A50s",/-/en/MSOSA-Samsung-Galaxy-A30s-A50s/dp/B07ZN5VCVC/ref=sr_1_4821?m=A1ZVRGNO5AYLOV&qid=1652830138&refinements=p_6%3AA1ZVRGNO5AYLOV&s=electronics&sr=1-4821,EGP 32.00,,,
For Huawei P30 Pro Polymer anti-Shock 2.5D NaNO Curved Screen Protector Matte Unbreakable Shock and Fingerprint,/-/en/Polymer-anti-Shock-Protector-Unbreakable-Fingerprint/dp/B08YNSKCWM/ref=sr_1_4822?m=A1ZVRGNO5AYLOV&qid=1652830138&refinements=p_6%3AA1ZVRGNO5AYLOV&s=electronics&sr=1-4822,EGP 72.00,,,
Premium 5D Privacy Tempered Glass Screen Protector for Apple iPhone 8,/-/en/Premium-Privacy-Tempered-Screen-Protector/dp/B08YY2J7VK/ref=sr_1_4823?m=A1ZVRGNO5AYLOV&qid=1652830138&refinements=p_6%3AA1ZVRGNO5AYLOV&s=electronics&sr=1-4823,EGP 61.87,,,
"Fashion Case Back Cover Hard Case For Xiaomi Mi 11i, Pocco F3, Redmi K40, Redmi K40 Pro - Clear Black",/-/en/Fashion-Case-Cover-Xiaomi-Pocco/dp/B09P5HG5NW/ref=sr_1_4824?m=A1ZVRGNO5AYLOV&qid=1652830138&refinements=p_6%3AA1ZVRGNO5AYLOV&s=electronics&sr=1-4824,EGP 56.00,,,
SmallRig Mini Matte Box 3196,/-/en/SmallRig-Mini-Matte-Box-3196/dp/B09N7VQV1S/ref=sr_1_4825?m=A1ZVRGNO5AYLOV&qid=1652830139&refinements=p_6%3AA1ZVRGNO5AYLOV&s=electronics&sr=1-4825,"EGP 3,384.00",,,
Baseus Yiven Cable For iP 1.8m,/-/en/Baseus-Yiven-Cable-iP-1-8m/dp/B01M0H6T66/ref=sr_1_4826?m=A1ZVRGNO5AYLOV&qid=1652830139&refinements=p_6%3AA1ZVRGNO5AYLOV&s=electronics&sr=1-4826,EGP 74.00,,,
