Name,Link,Price,OldPrice,BestSeller,Stars
High Quality Super Strong Glass Tablet Screen Protector For iPad 10.2 - Clear,/-/en/Quality-Strong-Tablet-Screen-Protector/dp/B09R1WGCPR/ref=sr_1_5324?m=A1ZVRGNO5AYLOV&qid=1652830156&refinements=p_6%3AA1ZVRGNO5AYLOV&s=electronics&sr=1-5324,EGP 68.80,,,
2B (CV875) HDMI to HDMI - 20 Meter,/-/en/2B-CV875-HDMI-20-Meter/dp/B096L7467J/ref=sr_1_5325?m=A1ZVRGNO5AYLOV&qid=1652830156&refinements=p_6%3AA1ZVRGNO5AYLOV&s=electronics&sr=1-5325,EGP 630.82,,,
Zero Hdmi Cable 1.2M - Black,/-/en/Zero-Hdmi-Cable-1-2M-Black/dp/B09JT368Z8/ref=sr_1_5326?m=A1ZVRGNO5AYLOV&qid=1652830156&refinements=p_6%3AA1ZVRGNO5AYLOV&s=electronics&sr=1-5326,EGP 20.52,,,
Seagate SkyHawk Surveillance HDD ST4000VX013,/-/en/Seagate-SkyHawk-Surveillance-HDD-ST4000VX013/dp/B08TV9TFPB/ref=sr_1_5327?m=A1ZVRGNO5AYLOV&qid=1652830156&refinements=p_6%3AA1ZVRGNO5AYLOV&s=electronics&sr=1-5327,"EGP 1,845.75",,,4.3 out of 5 stars
Nillkin Super Frosted Shield Hard Back Cover For OnePlus 8 Pro - Golden,/-/en/Nillkin-Super-Frosted-Shield-OnePlus/dp/B08G1NW97G/ref=sr_1_5328?m=A1ZVRGNO5AYLOV&qid=1652830156&refinements=p_6%3AA1ZVRGNO5AYLOV&s=electronics&sr=1-5328,EGP 192.00,,,
Nillkin Brand Qin Series Classic Slim Flip PU Leather Cover Mobile Phone Case For Iphone 12 pro max 6.7 inch - brwon,/-/en/Nillkin-Classic-Leather-Mobile-Iphone/dp/B08L7MYNTW/ref=sr_1_5329?m=A1ZVRGNO5AYLOV&qid=1652830157&refinements=p_6%3AA1ZVRGNO5AYLOV&s=electronics&sr=1-5329,EGP 140.00,EGP 148.90,Save 6%,
Borofone BM24 Milo Universal Earphones with Mic - BLACK,/-/en/Borofone-BM24-Milo-Universal-Earphones/dp/B08BX4BRHS/ref=sr_1_5330?m=A1ZVRGNO5AYLOV&qid=1652830157&refinements=p_6%3AA1ZVRGNO5AYLOV&s=electronics&sr=1-5330,EGP 40.00,,,
Slim Hard Back Cover with Slide Camera Shield for Oppo F11 Pro Blue,/-/en/Slim-Cover-Slide-Camera-Shield/dp/B09F3X7R74/ref=sr_1_5331?m=A1ZVRGNO5AYLOV&qid=1652830157&refinements=p_6%3AA1ZVRGNO5AYLOV&s=electronics&sr=1-5331,EGP 49.02,,,
Tempered Glass Screen Protector For Infinix Note 4 X572 - Black,/-/en/Tempered-Glass-Screen-Protector-Infinix/dp/B08X66LTPX/ref=sr_1_5332?m=A1ZVRGNO5AYLOV&qid=1652830157&refinements=p_6%3AA1ZVRGNO5AYLOV&s=electronics&sr=1-5332,EGP 35.20,,,
X-Doria Defense Trek Headset Case Cover for AirPods Pro - Red,/-/en/X-Doria-Defense-Headset-Cover-AirPods/dp/B089FL2X12/ref=sr_1_5333?m=A1ZVRGNO5AYLOV&qid=1652830157&refinements=p_6%3AA1ZVRGNO5AYLOV&s=electronics&sr=1-5333,EGP 396.97,,,4.4 out of 5 stars
Tembered glass screen protector for samsung galaxy note8 - Black,/-/en/Tembered-screen-protector-samsung-galaxy/dp/B08YY22SBF/ref=sr_1_5334?m=A1ZVRGNO5AYLOV&qid=1652830157&refinements=p_6%3AA1ZVRGNO5AYLOV&s=electronics&sr=1-5334,EGP 33.99,,,
XO NB149-G Converter From USB To Micro - Black,/-/en/XO-NB149-G-Converter-USB-Micro/dp/B09FJ4MQSH/ref=sr_1_5335?m=A1ZVRGNO5AYLOV&qid=1652830157&refinements=p_6%3AA1ZVRGNO5AYLOV&s=electronics&sr=1-5335,EGP 41.90,,,
Kingston DTMC3/64GB Data Traveler Micro USB 3.1 and Type-A USB Compact Flash Drive - 64 GB,/-/en/Kingston-DTMC3-64GB-Traveler-Compact/dp/B019AVUNZ6/ref=sr_1_5336?m=A1ZVRGNO5AYLOV&qid=1652830157&refinements=p_6%3AA1ZVRGNO5AYLOV&s=electronics&sr=1-5336,EGP 222.00,,,
"Powerology Lightning Cable MFi 1.2m/4ft Charge & Sync, for iPhone 11/11 Pro/11 Pro Max/Xs/Xs Max/8/8 Plus and more. (White)",/-/en/Powerology-Lightning-Cable-Charge-iPhone/dp/B07NTT8W66/ref=sr_1_5337?m=A1ZVRGNO5AYLOV&qid=1652830157&refinements=p_6%3AA1ZVRGNO5AYLOV&s=electronics&sr=1-5337,EGP 212.85,,,
HyperX Fury Ultra Gaming Mouse Pad - Black,/-/en/HyperX-Fury-Ultra-Gaming-Mouse/dp/B081VQJ2MN/ref=sr_1_5338?m=A1ZVRGNO5AYLOV&qid=1652830157&refinements=p_6%3AA1ZVRGNO5AYLOV&s=electronics&sr=1-5338,EGP 892.46,"EGP 1,222.64",,4.6 out of 5 stars
Boter 3D Back Cover Hard Slim Protection Case For Honor 9X Pro - Multi Color,/-/en/Boter-Back-Cover-Protection-Honor/dp/B091NYJRNL/ref=sr_1_5339?m=A1ZVRGNO5AYLOV&qid=1652830157&refinements=p_6%3AA1ZVRGNO5AYLOV&s=electronics&sr=1-5339,EGP 19.00,,,
High Quality Set Of 3 Glass Screen Protectors For Samsung Galaxy A52 - Clear Black,/-/en/Quality-Screen-Protectors-Samsung-Galaxy/dp/B09R4ZW1BN/ref=sr_1_5340?m=A1ZVRGNO5AYLOV&qid=1652830157&refinements=p_6%3AA1ZVRGNO5AYLOV&s=electronics&sr=1-5340,EGP 65.66,,,
"ASUS 24"" 1080P Gaming Monitor (VG248QG) - Full HD, 165Hz (Supports 144Hz), 0.5ms, Extreme Low Motion Blur, Speaker, Adaptive-Sync, G-SYNC Compatible, VESA Mountable, DisplayPort, HDMI, DVI-D, Black",/-/en/ASUS-1080P-Gaming-Monitor-VG248QG/dp/B088ZWBTBH/ref=sr_1_5341?m=A1ZVRGNO5AYLOV&qid=1652830157&refinements=p_6%3AA1ZVRGNO5AYLOV&s=electronics&sr=1-5341,"EGP 12,597.18",,,
Sollatek Ultima UPS 650VA - Black,/-/en/Sollatek-Ultima-UPS-650VA-Black/dp/B091NYCZ2C/ref=sr_1_5342?m=A1ZVRGNO5AYLOV&qid=1652830157&refinements=p_6%3AA1ZVRGNO5AYLOV&s=electronics&sr=1-5342,"EGP 1,428.57",,,
"Keendex 1647 Magnetic 3-In-1 Charging Cable, Micro, Type-C and Lightning - Black",/-/en/Keendex-Magnetic-Charging-Type-C-Lightning/dp/B096L5TYDD/ref=sr_1_5343?m=A1ZVRGNO5AYLOV&qid=1652830157&refinements=p_6%3AA1ZVRGNO5AYLOV&s=electronics&sr=1-5343,EGP 165.30,,,
Nillkin Flex Pure Cover for Apple iPhone 12 mini - Black,/-/en/Nillkin-Flex-Cover-Apple-iPhone/dp/B08NGLGQVW/ref=sr_1_5344?m=A1ZVRGNO5AYLOV&qid=1652830157&refinements=p_6%3AA1ZVRGNO5AYLOV&s=electronics&sr=1-5344,EGP 39.00,,,
Silicon Back Cover Slim Case Net Design For Samsung Galaxy A50 - Black,/-/en/Silicon-Cover-Design-Samsung-Galaxy/dp/B09P5HN68J/ref=sr_1_5345?m=A1ZVRGNO5AYLOV&qid=1652830157&refinements=p_6%3AA1ZVRGNO5AYLOV&s=electronics&sr=1-5345,EGP 39.98,,,
Prodigee Safetee Back Cover For iPhone XR - Black,/-/en/Prodigee-Safetee-Back-Cover-iPhone/dp/B07H9JBV1Z/ref=sr_1_5346?m=A1ZVRGNO5AYLOV&qid=1652830157&refinements=p_6%3AA1ZVRGNO5AYLOV&s=electronics&sr=1-5346,EGP 306.25,,,
CASE LOGIC LAPTOP SLEEVE 13 INCHE REFLECT REFMB-113-BK BLACK,/-/en/LOGIC-LAPTOP-SLEEVE-REFLECT-REFMB-113-BK/dp/B07HYXB6KY/ref=sr_1_5347?m=A1ZVRGNO5AYLOV&qid=1652830157&refinements=p_6%3AA1ZVRGNO5AYLOV&s=electronics&sr=1-5347,EGP 950.51,,,
Hoco C12Q - Smart QC3.0 charger EU - Black,/-/en/Hoco-C12Q-Smart-QC3-0-charger/dp/B08ZNTBRGW/ref=sr_1_5348?m=A1ZVRGNO5AYLOV&qid=1652830157&refinements=p_6%3AA1ZVRGNO5AYLOV&s=electronics&sr=1-5348,EGP 76.36,,,
Car Tab Holder - Black,/-/en/Other-Car-Tab-Holder-Black/dp/B08X5Y3P1V/ref=sr_1_5349?m=A1ZVRGNO5AYLOV&qid=1652830157&refinements=p_6%3AA1ZVRGNO5AYLOV&s=electronics&sr=1-5349,EGP 126.30,,,
"Back Cover Strong With Silicone Edges And Camera Protection Cover For Samsung Galaxy S11 / Samsung Galaxy S20 Plus - Transparent, 2725619764331",/-/en/Strong-Silicone-Camera-Protection-Samsung/dp/B09BJSVJQB/ref=sr_1_5350?m=A1ZVRGNO5AYLOV&qid=1652830157&refinements=p_6%3AA1ZVRGNO5AYLOV&s=electronics&sr=1-5350,EGP 96.00,,,
"Hoco M87 - String Wired Earphones with Mic (Length: 1.2m, Plug: 3.5mm) Compabitle with iPhone Samsung Xiaomi Oppo - Red Flame",/-/en/Hoco-M87-Earphones-Compabitle-Samsung/dp/B09QYT624D/ref=sr_1_5351?m=A1ZVRGNO5AYLOV&qid=1652830157&refinements=p_6%3AA1ZVRGNO5AYLOV&s=electronics&sr=1-5351,EGP 58.74,,,
VR Box Virtual Reality 3D Glasses For Smartphones - Black,/-/en/Box-Virtual-Reality-Glasses-Smartphones/dp/B09V5G1J5B/ref=sr_1_5352?m=A1ZVRGNO5AYLOV&qid=1652830157&refinements=p_6%3AA1ZVRGNO5AYLOV&s=electronics&sr=1-5352,EGP 110.35,,,
High Quality Super Strong Glass Tablet Screen Protector For iPad 10.2 - Clear,/-/en/Quality-Strong-Tablet-Screen-Protector/dp/B09R1WGCPR/ref=sr_1_5353?m=A1ZVRGNO5AYLOV&qid=1652830158&refinements=p_6%3AA1ZVRGNO5AYLOV&s=electronics&sr=1-5353,EGP 68.80,,,
Glass Tempered Glass Screen Protector 2 in 1 For Samsung Galaxy A71 - Black,/-/en/Tempered-Screen-Protector-Samsung-Galaxy/dp/B096R1BDMN/ref=sr_1_5354?m=A1ZVRGNO5AYLOV&qid=1652830158&refinements=p_6%3AA1ZVRGNO5AYLOV&s=electronics&sr=1-5354,EGP 32.82,,,
Seagate SkyHawk Surveillance HDD ST4000VX013,/-/en/Seagate-SkyHawk-Surveillance-HDD-ST4000VX013/dp/B08TV9TFPB/ref=sr_1_5355?m=A1ZVRGNO5AYLOV&qid=1652830158&refinements=p_6%3AA1ZVRGNO5AYLOV&s=electronics&sr=1-5355,"EGP 1,845.75",,,4.3 out of 5 stars
Nillkin Super Frosted Shield Hard Back Cover For OnePlus 8 Pro - Golden,/-/en/Nillkin-Super-Frosted-Shield-OnePlus/dp/B08G1NW97G/ref=sr_1_5356?m=A1ZVRGNO5AYLOV&qid=1652830158&refinements=p_6%3AA1ZVRGNO5AYLOV&s=electronics&sr=1-5356,EGP 192.00,,,
For Samsung Note 10 Lite Glass screen Protector By Bingo HD Plus - Black,/-/en/Samsung-screen-Protector-HD-Plus/dp/B0937HZTB6/ref=sr_1_5357?m=A1ZVRGNO5AYLOV&qid=1652830158&refinements=p_6%3AA1ZVRGNO5AYLOV&s=electronics&sr=1-5357,EGP 58.19,,,
Nillkin Qin Leather Case for Samsung Galaxy S10e - White,/-/en/Nillkin-Leather-Case-Samsung-Galaxy/dp/B07PRGVZ7L/ref=sr_1_5358?m=A1ZVRGNO5AYLOV&qid=1652830158&refinements=p_6%3AA1ZVRGNO5AYLOV&s=electronics&sr=1-5358,EGP 191.52,,,
lens protector for camera mobile Oppo f11 pro,/-/en/lens-protector-camera-mobile-Oppo/dp/B08X6LZF4H/ref=sr_1_5359?m=A1ZVRGNO5AYLOV&qid=1652830158&refinements=p_6%3AA1ZVRGNO5AYLOV&s=electronics&sr=1-5359,EGP 40.00,,,
Iron Man Cover With Metal Ring For Realme 6 pro - Black,/-/en/Iron-Cover-Metal-Ring-Realme/dp/B091C6JRLH/ref=sr_1_5360?m=A1ZVRGNO5AYLOV&qid=1652830158&refinements=p_6%3AA1ZVRGNO5AYLOV&s=electronics&sr=1-5360,EGP 60.51,EGP 67.55,Limited time deal,
"Gelatin Screen for Huawei Nova 7i Front and back Flexible Screen Protector with full protection, Clear",/-/en/Gelatin-Screen-Flexible-Protector-protection/dp/B08X6D9MKX/ref=sr_1_5361?m=A1ZVRGNO5AYLOV&qid=1652830158&refinements=p_6%3AA1ZVRGNO5AYLOV&s=electronics&sr=1-5361,EGP 10.00,,,
"UGREEN Toslink Audio Optical Cable Male to Male Optical Audio Adapter Cable Compatible with PS4,VD/CD player,Blu-ray players,Game console (2M)",/-/en/UGREEN-Toslink-Optical-Adapter-Compatible/dp/B088CQGFQ4/ref=sr_1_5362?m=A1ZVRGNO5AYLOV&qid=1652830158&refinements=p_6%3AA1ZVRGNO5AYLOV&s=electronics&sr=1-5362,EGP 99.00,,,4.7 out of 5 stars
For Iphone 12 6.1 / Iphone 12 pro 6.1 6D Screen Clear,/-/en/Iphone-6-1-pro-Screen-Clear/dp/B08YN9YFSQ/ref=sr_1_5363?m=A1ZVRGNO5AYLOV&qid=1652830158&refinements=p_6%3AA1ZVRGNO5AYLOV&s=electronics&sr=1-5363,EGP 17.52,EGP 19.20,,
5D Tempered Glass Screen Protector for Oppo Reno 4 - Black Frame,/-/en/Tempered-Glass-Screen-Protector-Oppo/dp/B092DXF8W2/ref=sr_1_5364?m=A1ZVRGNO5AYLOV&qid=1652830158&refinements=p_6%3AA1ZVRGNO5AYLOV&s=electronics&sr=1-5364,EGP 32.78,,,4.4 out of 5 stars
"2 Pack SANMUGEED Screen Protector, Premium 9H Hardness 2.5D Round Edge Tempered Glass Film For Huawei MatePad Pro (10.8 Inch)",/-/en/SANMUGEED-Protector-Premium-Hardness-Tempered/dp/B09BR3Y3XF/ref=sr_1_5365?m=A1ZVRGNO5AYLOV&qid=1652830158&refinements=p_6%3AA1ZVRGNO5AYLOV&s=electronics&sr=1-5365,EGP 79.83,,,
LCD Writing Tablet 8.5 Inch Doodle Pad Portable Electronic Writer Environmental Writing and Drawing Memo Board with Stylus Gift for Kids adults (Black),/-/en/Writing-Portable-Electronic-Environmental-Drawing/dp/B0972K627P/ref=sr_1_5366?m=A1ZVRGNO5AYLOV&qid=1652830158&refinements=p_6%3AA1ZVRGNO5AYLOV&s=electronics&sr=1-5366,EGP 74.98,,,
Boter 3D Back Cover Hard Slim Case For Oppo Reno 4 - Multi Color,/-/en/Boter-Back-Cover-Hard-Slim/dp/B08X69XYZZ/ref=sr_1_5367?m=A1ZVRGNO5AYLOV&qid=1652830158&refinements=p_6%3AA1ZVRGNO5AYLOV&s=electronics&sr=1-5367,EGP 19.00,,,
XO NB-R172A Converter From Dual Lightning Port To Lightning - White,/-/en/XO-NB-R172A-Converter-Dual-Lightning/dp/B09FJ5ZS59/ref=sr_1_5368?m=A1ZVRGNO5AYLOV&qid=1652830158&refinements=p_6%3AA1ZVRGNO5AYLOV&s=electronics&sr=1-5368,EGP 68.00,,,
For Oppo A52 / A72 / A92 Case Silicone With Camera Protector,/-/en/Oppo-Case-Silicone-Camera-Protector/dp/B08YXWJ65J/ref=sr_1_5369?m=A1ZVRGNO5AYLOV&qid=1652830158&refinements=p_6%3AA1ZVRGNO5AYLOV&s=electronics&sr=1-5369,EGP 31.25,,,
Tempered Glass Screen Protector Set Of 2 Pieces For Lenovo A6000 - Clear,/-/en/Tempered-Screen-Protector-Pieces-Lenovo/dp/B09T4NS57V/ref=sr_1_5370?m=A1ZVRGNO5AYLOV&qid=1652830158&refinements=p_6%3AA1ZVRGNO5AYLOV&s=electronics&sr=1-5370,EGP 47.42,,,
"9D Glass Tempered Screen Protector Laser Cut, Full Glue, 9H Hardness, Easy Installation Scratch Resistant for Realme C3 - Black",/-/en/Tempered-Protector-Hardness-Installation-Resistant/dp/B08X6L4W2W/ref=sr_1_5371?m=A1ZVRGNO5AYLOV&qid=1652830158&refinements=p_6%3AA1ZVRGNO5AYLOV&s=electronics&sr=1-5371,EGP 28.80,,,
For Oppo A52/A72/A92 5D Full Screen Protector Black Frame,/-/en/Oppo-Screen-Protector-Black-Frame/dp/B08X6Q88P4/ref=sr_1_5372?m=A1ZVRGNO5AYLOV&qid=1652830158&refinements=p_6%3AA1ZVRGNO5AYLOV&s=electronics&sr=1-5372,EGP 23.37,,,
GKK Three Stage Splicing Full Coverage PC Case For Samsung Galaxy s21 plus- Black silver,/-/en/GKK-Splicing-Coverage-Samsung-Galaxy/dp/B091J7G893/ref=sr_1_5373?m=A1ZVRGNO5AYLOV&qid=1652830158&refinements=p_6%3AA1ZVRGNO5AYLOV&s=electronics&sr=1-5373,EGP 87.50,,,
CASIM M-R17 white,/-/en/CASIM-M-R17-white/dp/B09888BMJS/ref=sr_1_5374?m=A1ZVRGNO5AYLOV&qid=1652830158&refinements=p_6%3AA1ZVRGNO5AYLOV&s=electronics&sr=1-5374,EGP 17.18,,,
"MSOSA Compatible with Screen Protector Honor 20,[2 Pack] Ultra Clear /9H Hardness Tempered glass for Honor 20",/-/en/MSOSA-Compatible-Protector-Honor-20/dp/B07X9TBMNN/ref=sr_1_5375?m=A1ZVRGNO5AYLOV&qid=1652830158&refinements=p_6%3AA1ZVRGNO5AYLOV&s=electronics&sr=1-5375,EGP 32.00,,,
High Quality Super Strong Glass Tablet Screen Protector For Samsung Galaxy Tab S6 Lite - Clear,/-/en/Quality-Strong-Tablet-Protector-Samsung/dp/B09R1WBNMG/ref=sr_1_5376?m=A1ZVRGNO5AYLOV&qid=1652830158&refinements=p_6%3AA1ZVRGNO5AYLOV&s=electronics&sr=1-5376,EGP 68.80,,,
FULL SCREEN PROTECTOR FOR Realme 5 - BLaCK,/-/en/FULL-SCREEN-PROTECTOR-Realme-BLaCK/dp/B08X5ZYPPL/ref=sr_1_5377?m=A1ZVRGNO5AYLOV&qid=1652830159&refinements=p_6%3AA1ZVRGNO5AYLOV&s=electronics&sr=1-5377,EGP 42.45,,,
Privacy Glass Screen Protector For Samsung Galaxy Note9 Tempered Glass 9H Hardness Full Covered,/-/en/Privacy-Protector-Samsung-Tempered-Hardness/dp/B08Y8VMDC9/ref=sr_1_5378?m=A1ZVRGNO5AYLOV&qid=1652830159&refinements=p_6%3AA1ZVRGNO5AYLOV&s=electronics&sr=1-5378,EGP 120.00,,,
Samsung Galaxy S7 Edge Curved Tempered Glass 0.18mm ultra-thin Screen Protector 9H - Black,/-/en/Samsung-Galaxy-Tempered-ultra-thin-Protector/dp/B092FWPKTP/ref=sr_1_5379?m=A1ZVRGNO5AYLOV&qid=1652830159&refinements=p_6%3AA1ZVRGNO5AYLOV&s=electronics&sr=1-5379,EGP 44.14,EGP 45.00,,
Soft Touch Hard Back Cover With Colored Silicone Edges For Samsung Galaxy J7 Pro - Olive Orange,/-/en/Touch-Colored-Silicone-Samsung-Galaxy/dp/B08X6JRS33/ref=sr_1_5380?m=A1ZVRGNO5AYLOV&qid=1652830159&refinements=p_6%3AA1ZVRGNO5AYLOV&s=electronics&sr=1-5380,EGP 85.38,,,
Baseus Swan Magnetic Desktop Bracket Wireless Charger (suit for IP12),/-/en/Baseus-Magnetic-Desktop-Bracket-Wireless/dp/B00OFOXORI/ref=sr_1_5381?m=A1ZVRGNO5AYLOV&qid=1652830159&refinements=p_6%3AA1ZVRGNO5AYLOV&s=electronics&sr=1-5381,EGP 637.20,,,
Spigen Rugged Armor Designed for iPhone 13 Mini Case (2021) - Matte Black,/-/en/Spigen-Rugged-Armor-Designed-iPhone/dp/B096HSXGCN/ref=sr_1_5382?m=A1ZVRGNO5AYLOV&qid=1652830159&refinements=p_6%3AA1ZVRGNO5AYLOV&s=electronics&sr=1-5382,EGP 330.00,EGP 349.00,Save 5%,4.6 out of 5 stars
Keendex 1087 Silicone Back Cover for Samsung Galaxy S8 - Blue,/-/en/Keendex-Silicone-Cover-Samsung-Galaxy/dp/B096L654KG/ref=sr_1_5383?m=A1ZVRGNO5AYLOV&qid=1652830159&refinements=p_6%3AA1ZVRGNO5AYLOV&s=electronics&sr=1-5383,EGP 78.72,,,
"Cover Flip Clear View , Not Smart And Without Sensor For Oppo Realme 6 - Black",/-/en/Cover-Clear-Without-Sensor-Realme/dp/B08YXZD5RX/ref=sr_1_5384?m=A1ZVRGNO5AYLOV&qid=1652830159&refinements=p_6%3AA1ZVRGNO5AYLOV&s=electronics&sr=1-5384,EGP 77.00,EGP 85.97,Limited time deal,
High Quality Glass Screen Protector For Samsung Galaxy A12 - Clear Black,/-/en/Quality-Screen-Protector-Samsung-Galaxy/dp/B09R51QS66/ref=sr_1_5385?m=A1ZVRGNO5AYLOV&qid=1652830159&refinements=p_6%3AA1ZVRGNO5AYLOV&s=electronics&sr=1-5385,EGP 29.18,,,
Mobile Screen UV Glass 9H Screen Protector Full Curved With Nano liquid Full Glue 2 Pieces Samsung Galaxy S10 - Clear,/-/en/Mobile-Screen-Protector-Curved-Samsung/dp/B08X66LX63/ref=sr_1_5386?m=A1ZVRGNO5AYLOV&qid=1652830159&refinements=p_6%3AA1ZVRGNO5AYLOV&s=electronics&sr=1-5386,EGP 86.08,,,
Virtual 7.1 Steel Series Sound 5Hv2 7.1 External USB2.0 Sound Card Adapter for Laptop PC,/-/en/Virtual-External-USB2-0-Adapter-Laptop/dp/B08YNJWZP9/ref=sr_1_5387?m=A1ZVRGNO5AYLOV&qid=1652830159&refinements=p_6%3AA1ZVRGNO5AYLOV&s=electronics&sr=1-5387,EGP 43.41,EGP 56.96,,
Clear View standing Mirror Cover For Samsung Galaxy S20 FE - Black,/-/en/Clear-standing-Mirror-Samsung-Galaxy/dp/B091J5CZ3R/ref=sr_1_5388?m=A1ZVRGNO5AYLOV&qid=1652830159&refinements=p_6%3AA1ZVRGNO5AYLOV&s=electronics&sr=1-5388,EGP 90.00,EGP 110.53,,
WK Design Y10 Wired Earphones with Microphone - White,/-/en/WK-Design-Y10-Earphones-Microphone/dp/B08WJMT2GQ/ref=sr_1_5389?m=A1ZVRGNO5AYLOV&qid=1652830159&refinements=p_6%3AA1ZVRGNO5AYLOV&s=electronics&sr=1-5389,EGP 25.93,,,
Magnetic Case 360 Full Protection for Huawei P Smart 2019 with Metal Frame - Clear Blue,/-/en/Magnetic-Protection-Huawei-Smart-Metal/dp/B08Y8WMST7/ref=sr_1_5390?m=A1ZVRGNO5AYLOV&qid=1652830159&refinements=p_6%3AA1ZVRGNO5AYLOV&s=electronics&sr=1-5390,EGP 52.80,,,
Iron Man Hard Back Cover With Metal Ring And Kickstand For Oppo A31 - Pink,/-/en/Iron-Hard-Cover-Metal-Kickstand/dp/B08X5Z2H3X/ref=sr_1_5391?m=A1ZVRGNO5AYLOV&qid=1652830159&refinements=p_6%3AA1ZVRGNO5AYLOV&s=electronics&sr=1-5391,EGP 19.00,,,
Oppo A5 2020 Tempered Glass Screen Protector - Clear by Dl3 Mobilk,/-/en/Oppo-Tempered-Glass-Screen-Protector/dp/B08Y8VLYSF/ref=sr_1_5392?m=A1ZVRGNO5AYLOV&qid=1652830159&refinements=p_6%3AA1ZVRGNO5AYLOV&s=electronics&sr=1-5392,EGP 18.75,,,
Ceramic Matte Screen Protector for huawei nova 3i,/-/en/Ceramic-Matte-Screen-Protector-huawei/dp/B08YNPTS7Y/ref=sr_1_5393?m=A1ZVRGNO5AYLOV&qid=1652830159&refinements=p_6%3AA1ZVRGNO5AYLOV&s=electronics&sr=1-5393,EGP 19.20,,,
Aukey EP-T21 True Bluetooth Wireless Earbuds - Black,/-/en/Aukey-EP-T21-Bluetooth-Wireless-Earbuds/dp/B08WJPVMZ7/ref=sr_1_5394?m=A1ZVRGNO5AYLOV&qid=1652830159&refinements=p_6%3AA1ZVRGNO5AYLOV&s=electronics&sr=1-5394,EGP 594.30,,Limited time deal,
Stop Time Leather Card-Slot Flip Wallet Case for Samsung Galaxy Note 10 - Maroon,/-/en/Stop-Time-Leather-Card-Slot-Samsung/dp/B08X66YD63/ref=sr_1_5395?m=A1ZVRGNO5AYLOV&qid=1652830159&refinements=p_6%3AA1ZVRGNO5AYLOV&s=electronics&sr=1-5395,EGP 19.00,,,
High Quality Set of 3 Glass Screen Protectors For Huawei Mate 30 Pro - Clear,/-/en/Quality-Glass-Screen-Protectors-Huawei/dp/B09R4YQ61Z/ref=sr_1_5396?m=A1ZVRGNO5AYLOV&qid=1652830159&refinements=p_6%3AA1ZVRGNO5AYLOV&s=electronics&sr=1-5396,EGP 65.66,,,
"Media Teck Mt-A2 2.0 CH MUL Speaker 1200 W, Black",/-/en/Media-Teck-Mt-A2-Speaker-Black/dp/B098BHNJ7M/ref=sr_1_5397?m=A1ZVRGNO5AYLOV&qid=1652830159&refinements=p_6%3AA1ZVRGNO5AYLOV&s=electronics&sr=1-5397,EGP 224.00,,,
Tempered Glass Screen Protector for HUAWEI Y6 PRO - Clear,/-/en/Tempered-Glass-Screen-Protector-HUAWEI/dp/B08YY4CQ7B/ref=sr_1_5398?m=A1ZVRGNO5AYLOV&qid=1652830159&refinements=p_6%3AA1ZVRGNO5AYLOV&s=electronics&sr=1-5398,EGP 7.50,,Limited time deal,
Nillkin Nature TPU Pro Back Cover For Samsung Galaxy S22 Plus - White,/-/en/Nillkin-Nature-Cover-Samsung-Galaxy/dp/B09P77HX1Z/ref=sr_1_5399?m=A1ZVRGNO5AYLOV&qid=1652830159&refinements=p_6%3AA1ZVRGNO5AYLOV&s=electronics&sr=1-5399,EGP 125.78,EGP 128.02,,
For Samsung Galaxy A02s Full Screen Protector Black,/-/en/Samsung-Galaxy-Screen-Protector-Black/dp/B091J5DH21/ref=sr_1_5400?m=A1ZVRGNO5AYLOV&qid=1652830159&refinements=p_6%3AA1ZVRGNO5AYLOV&s=electronics&sr=1-5400,EGP 31.98,,,4.5 out of 5 stars
Hoco BS34 - Sports Portable Bluetooth Speaker V5.0 with 5W Sound Outage and IPX5 waterproof - Blue,/-/en/Hoco-BS34-Portable-Bluetooth-waterproof/dp/B08TBKP49Z/ref=sr_1_5401?m=A1ZVRGNO5AYLOV&qid=1652830159&refinements=p_6%3AA1ZVRGNO5AYLOV&s=electronics&sr=1-5401,EGP 277.56,,,
"Dragon Polymer Nano Screen Protector for iPhone XR Mobile Phone, Set of 2 - Black",/-/en/Dragon-Polymer-Screen-Protector-iPhone/dp/B092LVS613/ref=sr_1_5402?m=A1ZVRGNO5AYLOV&qid=1652830159&refinements=p_6%3AA1ZVRGNO5AYLOV&s=electronics&sr=1-5402,EGP 82.12,,,
"Fashion Case Silicone Slim Back Cover with Protective Edges and Magnetic Ring Holder for iPhone 7 Plus & iPhone 8 Plus, Grey and Black",/-/en/Fashion-Case-Silicone-Protective-Magnetic/dp/B08X69TS3T/ref=sr_1_5403?m=A1ZVRGNO5AYLOV&qid=1652830159&refinements=p_6%3AA1ZVRGNO5AYLOV&s=electronics&sr=1-5403,EGP 72.00,,,
Case Gear4 Crystal Palace For iPhone 12 / 12 Pro Polycarbonate Caver Magsafe - Clear,/-/en/Gear4-Crystal-Palace-Polycarbonate-Magsafe/dp/B092336KDQ/ref=sr_1_5404?m=A1ZVRGNO5AYLOV&qid=1652830159&refinements=p_6%3AA1ZVRGNO5AYLOV&s=electronics&sr=1-5404,EGP 112.51,,,
GKK case 360 degree full protection 3 in 1 for oppo reno 4 pro Black&red,/-/en/GKK-case-degree-protection-Black/dp/B098BBBJWD/ref=sr_1_5405?m=A1ZVRGNO5AYLOV&qid=1652830159&refinements=p_6%3AA1ZVRGNO5AYLOV&s=electronics&sr=1-5405,EGP 96.00,,,
"for Samsung Galaxy Note 9 5.8 inch Nano Optics Curved Full Coverage Tempered Glass Screen Protector Laser Model UV, Fix the Glass with accompanied Laser, 9H Hardness",/-/en/Coverage-Tempered-Protector-accompanied-Hardness/dp/B091NZWLC3/ref=sr_1_5406?m=A1ZVRGNO5AYLOV&qid=1652830159&refinements=p_6%3AA1ZVRGNO5AYLOV&s=electronics&sr=1-5406,EGP 106.25,,,
Lens Camera Screen Protector Full Protection For Realme Xt,/-/en/Camera-Screen-Protector-Protection-Realme/dp/B08X69S31Q/ref=sr_1_5407?m=A1ZVRGNO5AYLOV&qid=1652830159&refinements=p_6%3AA1ZVRGNO5AYLOV&s=electronics&sr=1-5407,EGP 40.00,,,
Plastic Back cover With Camera Protector And Silicon Edges For iPhone 11 Pro Max - Clear Black,/-/en/Plastic-Camera-Protector-Silicon-iPhone/dp/B092DWBP3T/ref=sr_1_5408?m=A1ZVRGNO5AYLOV&qid=1652830159&refinements=p_6%3AA1ZVRGNO5AYLOV&s=electronics&sr=1-5408,EGP 70.30,,,
JOY ROOM JR-S600 Audio Cable Hifi Transmission USB Port 3.5 MM Armor Series 1000 MM - Black Gold,/-/en/JOY-ROOM-JR-S600-Audio-Transmission/dp/B01D4KAU5C/ref=sr_1_5409?m=A1ZVRGNO5AYLOV&qid=1652830159&refinements=p_6%3AA1ZVRGNO5AYLOV&s=electronics&sr=1-5409,EGP 30.00,,,
Silicone Protective Set Of 3 For Airpods Pro Case With Hook Color White,/-/en/Silicone-Protective-Airpods-Color-White/dp/B09W5SVLC7/ref=sr_1_5410?m=A1ZVRGNO5AYLOV&qid=1652830159&refinements=p_6%3AA1ZVRGNO5AYLOV&s=electronics&sr=1-5410,EGP 87.55,,,
Kaiyue Flip Leather Case Cover For Samsung Galaxy Note 10 Lite - Brown,/-/en/Kaiyue-Leather-Cover-Samsung-Galaxy/dp/B091J7CN1M/ref=sr_1_5411?m=A1ZVRGNO5AYLOV&qid=1652830159&refinements=p_6%3AA1ZVRGNO5AYLOV&s=electronics&sr=1-5411,EGP 72.00,,,
Back Cover For Samsung Galaxy A02 - Clear,/-/en/Back-Cover-Samsung-Galaxy-A02/dp/B096T36L75/ref=sr_1_5412?m=A1ZVRGNO5AYLOV&qid=1652830159&refinements=p_6%3AA1ZVRGNO5AYLOV&s=electronics&sr=1-5412,EGP 27.50,EGP 30.71,,
5D Glass Screen Protector For Samsung Galaxy A52 - Black Frame By Mobi X,/-/en/Glass-Screen-Protector-Samsung-Galaxy/dp/B096XXX3R4/ref=sr_1_5413?m=A1ZVRGNO5AYLOV&qid=1652830159&refinements=p_6%3AA1ZVRGNO5AYLOV&s=electronics&sr=1-5413,EGP 40.00,,,
5D Glass Screen Protector for Oppo A9 2020 - Black,/-/en/Glass-Screen-Protector-Oppo-2020/dp/B0923FK2Y4/ref=sr_1_5414?m=A1ZVRGNO5AYLOV&qid=1652830159&refinements=p_6%3AA1ZVRGNO5AYLOV&s=electronics&sr=1-5414,EGP 28.80,,,
X-Level 360 Degree Full Protection Flip Wallet Cover With Card Wallet For iPhone 11 Pro - Camel Brown,/-/en/X-Level-Degree-Protection-Wallet-iPhone/dp/B08WJMR6NG/ref=sr_1_5415?m=A1ZVRGNO5AYLOV&qid=1652830159&refinements=p_6%3AA1ZVRGNO5AYLOV&s=electronics&sr=1-5415,EGP 19.00,,,
Privacy Anti-spy Glass Screen Protector For iPhone XS MAX 3D Tempered Glass 9H Hardness Full Covered (Black),/-/en/Privacy-Anti-spy-Protector-Tempered-Hardness/dp/B08Y8XN6VF/ref=sr_1_5416?m=A1ZVRGNO5AYLOV&qid=1652830159&refinements=p_6%3AA1ZVRGNO5AYLOV&s=electronics&sr=1-5416,EGP 85.00,,,
Instax Mini Camera (Christmas Box) Flamingo Pink,/-/en/Instax-Camera-Christmas-Flamingo-Pink/dp/B09MTYM93Y/ref=sr_1_5417?m=A1ZVRGNO5AYLOV&qid=1652830159&refinements=p_6%3AA1ZVRGNO5AYLOV&s=electronics&sr=1-5417,"EGP 1,981.00",,,
4 in 1 LED Bluetooth Car FM Transmitter Car Kit MP3 Music Player Radio Adapter with USB Car Charger,/-/en/Bluetooth-Transmitter-Player-Adapter-Charger/dp/B098149142/ref=sr_1_5418?m=A1ZVRGNO5AYLOV&qid=1652830159&refinements=p_6%3AA1ZVRGNO5AYLOV&s=electronics&sr=1-5418,EGP 120.00,,,
Luminous fluorescent bright screen protector 5D iPhone 12 Pro Max,/-/en/Luminous-fluorescent-bright-screen-protector/dp/B09233HLBW/ref=sr_1_5419?m=A1ZVRGNO5AYLOV&qid=1652830159&refinements=p_6%3AA1ZVRGNO5AYLOV&s=electronics&sr=1-5419,EGP 56.25,,,
Bang and Olufsen 1140026 BeoPlay P6 PortaBle Bluetooth Speaker - Black,/-/en/Bang-Olufsen-1140026-PortaBle-Bluetooth/dp/B07B81DRVC/ref=sr_1_5420?m=A1ZVRGNO5AYLOV&qid=1652830159&refinements=p_6%3AA1ZVRGNO5AYLOV&s=electronics&sr=1-5420,"EGP 11,198.88",,,
for Oppo Reno 4 5D Full Screen Protector Black frame- By Dl3 Mobailk,/-/en/Screen-Protector-frame-Dl3-Mobailk/dp/B096DCSZ8C/ref=sr_1_5421?m=A1ZVRGNO5AYLOV&qid=1652830159&refinements=p_6%3AA1ZVRGNO5AYLOV&s=electronics&sr=1-5421,EGP 22.50,EGP 28.80,,
Hard Back Cover With Silicone Edges And Metal Ring For Honor 20 Lite - Black,/-/en/Cover-Silicone-Edges-Metal-Honor/dp/B08Z4BGV7M/ref=sr_1_5422?m=A1ZVRGNO5AYLOV&qid=1652830159&refinements=p_6%3AA1ZVRGNO5AYLOV&s=electronics&sr=1-5422,EGP 19.00,,,
Screen Protector Foils 2.5D Full Glue Full Cover Ceramics Film for iPhone XS Max / 11 Pro Max Tempered film,/-/en/Screen-Protector-Ceramics-iPhone-Tempered/dp/B07ZRDR194/ref=sr_1_5423?m=A1ZVRGNO5AYLOV&qid=1652830159&refinements=p_6%3AA1ZVRGNO5AYLOV&s=electronics&sr=1-5423,EGP 19.20,,,
Back Cover For Samsung Galaxy A5 2017 - Clear,/-/en/Back-Cover-Samsung-Galaxy-2017/dp/B0985C7124/ref=sr_1_5424?m=A1ZVRGNO5AYLOV&qid=1652830159&refinements=p_6%3AA1ZVRGNO5AYLOV&s=electronics&sr=1-5424,EGP 24.20,EGP 27.02,Limited time deal,
