Name,Link,Price,OldPrice,BestSeller,Stars
Car Cassette Stereo Adapter Tape Converter Jack Plug for MP3 CD Player Smart Phone (3.5mm),/-/en/Cassette-Stereo-Adapter-Converter-Player/dp/B0968YC8XP/ref=sr_1_4927?m=A1ZVRGNO5AYLOV&qid=1652830143&refinements=p_6%3AA1ZVRGNO5AYLOV&s=electronics&sr=1-4927,EGP 53.00,,,
Mini USB LED Light for Laptop - Portable and Flexable,/-/en/Mini-USB-LED-Light-Laptop/dp/B091J7CSWF/ref=sr_1_4928?m=A1ZVRGNO5AYLOV&qid=1652830143&refinements=p_6%3AA1ZVRGNO5AYLOV&s=electronics&sr=1-4928,EGP 43.25,,,
king kong Anti-shock Transparent Case Clear For Infinix S5 X652 - Clear,/-/en/king-Anti-shock-Transparent-Clear-Infinix/dp/B08ZY8PK75/ref=sr_1_4929?m=A1ZVRGNO5AYLOV&qid=1652830143&refinements=p_6%3AA1ZVRGNO5AYLOV&s=electronics&sr=1-4929,EGP 31.25,,,
WK Design BD150 Wireless Bluetooth Earphones with Microphone - Black,/-/en/WK-Design-BD150-Bluetooth-Microphone/dp/B07WWCLBPF/ref=sr_1_4930?m=A1ZVRGNO5AYLOV&qid=1652830143&refinements=p_6%3AA1ZVRGNO5AYLOV&s=electronics&sr=1-4930,EGP 107.10,,,
"Wanle D-12 Power Bank with Built-in Video Handheld Gaming Console, 8000mAh - White Red",/-/en/Wanle-Built-Handheld-Console-8000mAh/dp/B09SFB4HCS/ref=sr_1_4931?m=A1ZVRGNO5AYLOV&qid=1652830143&refinements=p_6%3AA1ZVRGNO5AYLOV&s=electronics&sr=1-4931,EGP 300.00,,,
For Samsung Galaxy Buds Bluetooth Sports Headphone Case Carrying Case Shockproof Dropproof Silicone Case Cover-Black,/-/en/Bluetooth-Headphone-Shockproof-Dropproof-Cover-Black/dp/B08ZXBSP7J/ref=sr_1_4932?m=A1ZVRGNO5AYLOV&qid=1652830143&refinements=p_6%3AA1ZVRGNO5AYLOV&s=electronics&sr=1-4932,EGP 64.00,,,
Nillkin Camo Case Hard Back Cover For Apple iPhone 11 Pro Max - Black,/-/en/Nillkin-Camo-Cover-Apple-iPhone/dp/B092FJD6Q6/ref=sr_1_4933?m=A1ZVRGNO5AYLOV&qid=1652830143&refinements=p_6%3AA1ZVRGNO5AYLOV&s=electronics&sr=1-4933,EGP 169.00,,,
18D Glass Screen Protector For Xiaomi Poco X3 - Clear,/-/en/Glass-Screen-Protector-Xiaomi-Poco/dp/B098TZRBBH/ref=sr_1_4934?m=A1ZVRGNO5AYLOV&qid=1652830143&refinements=p_6%3AA1ZVRGNO5AYLOV&s=electronics&sr=1-4934,EGP 22.11,,,
keendex kx1866 4-Ports USB 3.0 PCI Express Card,/-/en/keendex-kx1866-4-Ports-Express-Card/dp/B0966TBKGG/ref=sr_1_4935?m=A1ZVRGNO5AYLOV&qid=1652830143&refinements=p_6%3AA1ZVRGNO5AYLOV&s=electronics&sr=1-4935,EGP 454.05,,,
For Xiaomi Redmi Note 9S / Note 9 Pro/Note 9 Pro Max Case Silicone With Camera Protector - Dark Green,/-/en/Xiaomi-Redmi-Silicone-Camera-Protector/dp/B08YY134GD/ref=sr_1_4936?m=A1ZVRGNO5AYLOV&qid=1652830143&refinements=p_6%3AA1ZVRGNO5AYLOV&s=electronics&sr=1-4936,EGP 34.37,EGP 40.00,Limited time deal,
Hard Back Cover with Strap for iPhone XR - Clear & Dark Green,/-/en/Hard-Back-Cover-Strap-iPhone/dp/B0976F73GL/ref=sr_1_4937?m=A1ZVRGNO5AYLOV&qid=1652830143&refinements=p_6%3AA1ZVRGNO5AYLOV&s=electronics&sr=1-4937,EGP 41.26,EGP 49.00,Limited time deal,
Iphone XS MAX - X-level Knight Series PC Case Cover - Gold,/-/en/Iphone-XS-MAX-X-level-Knight/dp/B08XS39LNR/ref=sr_1_4938?m=A1ZVRGNO5AYLOV&qid=1652830143&refinements=p_6%3AA1ZVRGNO5AYLOV&s=electronics&sr=1-4938,EGP 120.00,,,
HP 200 Pike Silver Wireless Mouse,/-/en/HP-Pike-Silver-Wireless-Mouse/dp/B00HCYTRCY/ref=sr_1_4939?m=A1ZVRGNO5AYLOV&qid=1652830143&refinements=p_6%3AA1ZVRGNO5AYLOV&s=electronics&sr=1-4939,EGP 299.00,,,
Remax TWS-5 Wireless Bluetooth Earphones with Microphone - Green,/-/en/Remax-TWS-5-Bluetooth-Earphones-Microphone/dp/B0882QLRY3/ref=sr_1_4940?m=A1ZVRGNO5AYLOV&qid=1652830143&refinements=p_6%3AA1ZVRGNO5AYLOV&s=electronics&sr=1-4940,EGP 383.94,,,
Nillkin Cam Shield Silky Silicone Case For Apple iPhone 12 / 12 Pro - Orange Pink,/-/en/Nillkin-Shield-Silky-Silicone-iPhone/dp/B093LMCWJJ/ref=sr_1_4941?m=A1ZVRGNO5AYLOV&qid=1652830143&refinements=p_6%3AA1ZVRGNO5AYLOV&s=electronics&sr=1-4941,EGP 208.02,,,
Nillkin CamShield Armor Cover for Apple iPhone SE - Black,/-/en/Nillkin-CamShield-Armor-Cover-iPhone/dp/B08CKH3BZ5/ref=sr_1_4942?m=A1ZVRGNO5AYLOV&qid=1652830143&refinements=p_6%3AA1ZVRGNO5AYLOV&s=electronics&sr=1-4942,EGP 255.50,,,
Recci REB-M02 Kylin Bluetooth Earphone - Red,/-/en/Recci-REB-M02-Kylin-Bluetooth-Earphone/dp/B091NXGKH4/ref=sr_1_4943?m=A1ZVRGNO5AYLOV&qid=1652830143&refinements=p_6%3AA1ZVRGNO5AYLOV&s=electronics&sr=1-4943,EGP 172.20,,,
9D Glass Screen Protector Full Glue for Oppo A15 - Black,/-/en/Glass-Screen-Protector-Full-Glue/dp/B08ZXQFN61/ref=sr_1_4944?m=A1ZVRGNO5AYLOV&qid=1652830143&refinements=p_6%3AA1ZVRGNO5AYLOV&s=electronics&sr=1-4944,EGP 21.00,,,
Keendex Kx2216 DisplayPort Male to DisplayPort Male Cable - Black,/-/en/Keendex-Kx2216-DisplayPort-Male-Cable/dp/B093XDFS79/ref=sr_1_4945?m=A1ZVRGNO5AYLOV&qid=1652830144&refinements=p_6%3AA1ZVRGNO5AYLOV&s=electronics&sr=1-4945,EGP 166.60,,,
"Nikon AF-P DX NIKKOR 18-55mm f/3.5-5.6G VR Lens - 18-55VR, Black",/-/en/Nikon-AF-P-NIKKOR-18-55mm-3-5-5-6G/dp/B01AI8H58I/ref=sr_1_4946?m=A1ZVRGNO5AYLOV&qid=1652830144&refinements=p_6%3AA1ZVRGNO5AYLOV&s=electronics&sr=1-4946,"EGP 2,400.00",,,
"SUPCASE Unicorn Beetle Style Series Case Designed for iPhone 13 Pro (2021 Release) 6.1 Inch, Premium Hybrid Protective Clear Case (Gray)",/-/en/SUPCASE-Unicorn-Designed-Release-Protective/dp/B09MYD4Y9S/ref=sr_1_4947?m=A1ZVRGNO5AYLOV&qid=1652830144&refinements=p_6%3AA1ZVRGNO5AYLOV&s=electronics&sr=1-4947,EGP 299.39,,,4.6 out of 5 stars
Full Glass Screen Protector 5D for iPhone 6 Plus 5.5 - Black,/-/en/Full-Glass-Screen-Protector-iPhone/dp/B091CHR38G/ref=sr_1_4948?m=A1ZVRGNO5AYLOV&qid=1652830144&refinements=p_6%3AA1ZVRGNO5AYLOV&s=electronics&sr=1-4948,EGP 9.00,,,
Spigen Silicone Back Case for Samsung Galaxy S10e - Black,/-/en/Spigen-Silicone-Back-Samsung-Galaxy/dp/B07MK3V6YQ/ref=sr_1_4949?m=A1ZVRGNO5AYLOV&qid=1652830144&refinements=p_6%3AA1ZVRGNO5AYLOV&s=electronics&sr=1-4949,EGP 229.88,,,
Tempered Glass Screen Protector For Huawei Nova 5T - Black 5D,/-/en/Tempered-Glass-Screen-Protector-Huawei/dp/B08XK4LBMX/ref=sr_1_4950?m=A1ZVRGNO5AYLOV&qid=1652830144&refinements=p_6%3AA1ZVRGNO5AYLOV&s=electronics&sr=1-4950,EGP 28.80,,,
"Remax RPP-142 Hunyo Series Power Bank with 4 Charging Ports, 20000 mAh - Black",/-/en/Remax-RPP-142-Hunyo-Power-Charging/dp/B07ZP7667B/ref=sr_1_4951?m=A1ZVRGNO5AYLOV&qid=1652830144&refinements=p_6%3AA1ZVRGNO5AYLOV&s=electronics&sr=1-4951,EGP 243.00,,,
"Mobile Phone 3D Screen Magnifier For All Smartphones, F2",/-/en/Mobile-Phone-Screen-Magnifier-Smartphones/dp/B08YXZ8YL9/ref=sr_1_4952?m=A1ZVRGNO5AYLOV&qid=1652830144&refinements=p_6%3AA1ZVRGNO5AYLOV&s=electronics&sr=1-4952,EGP 59.50,,,
Ironman Back Cover Hard Case For Protection With Magnetic Ring For Huawei Nova 5T - Red Black,/-/en/Ironman-Cover-Protection-Magnetic-Huawei/dp/B08Y8YVN8T/ref=sr_1_4953?m=A1ZVRGNO5AYLOV&qid=1652830144&refinements=p_6%3AA1ZVRGNO5AYLOV&s=electronics&sr=1-4953,EGP 88.02,,,
Clear View Stand Mirror Cover Shockproof Flip Case For Samsung Galaxy Note 8 - Black,/-/en/Clear-Mirror-Shockproof-Samsung-Galaxy/dp/B091D1QPCW/ref=sr_1_4954?m=A1ZVRGNO5AYLOV&qid=1652830144&refinements=p_6%3AA1ZVRGNO5AYLOV&s=electronics&sr=1-4954,EGP 70.00,EGP 85.97,,
"Dragon Ceramic Anti-Fingerprint Screen Protector for Huawei Nova 5T, 6.2 inches, Pack of 3 - Black",/-/en/Dragon-Ceramic-Anti-Fingerprint-Screen-Protector/dp/B08ZPL76D3/ref=sr_1_4955?m=A1ZVRGNO5AYLOV&qid=1652830144&refinements=p_6%3AA1ZVRGNO5AYLOV&s=electronics&sr=1-4955,EGP 53.00,,,
Spigen Thin Fit designed for iPhone 12 Mini case cover - Navy Blue,/-/en/Spigen-Thin-designed-iPhone-cover/dp/B08KTW46XD/ref=sr_1_4956?m=A1ZVRGNO5AYLOV&qid=1652830144&refinements=p_6%3AA1ZVRGNO5AYLOV&s=electronics&sr=1-4956,EGP 452.74,,,4.6 out of 5 stars
Silicon Back Cover Slim Case Net Design For Huawei Nova 7i - Black,/-/en/Silicon-Back-Cover-Design-Huawei/dp/B09P5H6L1K/ref=sr_1_4957?m=A1ZVRGNO5AYLOV&qid=1652830144&refinements=p_6%3AA1ZVRGNO5AYLOV&s=electronics&sr=1-4957,EGP 39.98,,,
Headset With Mic- model : Celebrat D1-Black,/-/en/Headset-Mic-model-Celebrat-D1-Black/dp/B096L7S2R1/ref=sr_1_4958?m=A1ZVRGNO5AYLOV&qid=1652830144&refinements=p_6%3AA1ZVRGNO5AYLOV&s=electronics&sr=1-4958,EGP 44.63,,,
Crush Foldable Laptop 4 Fans Multi Color 4000C for Laptop and Notebook,/-/en/Crush-Foldable-Laptop-Multi-Notebook/dp/B09QQK1H28/ref=sr_1_4959?m=A1ZVRGNO5AYLOV&qid=1652830144&refinements=p_6%3AA1ZVRGNO5AYLOV&s=electronics&sr=1-4959,EGP 342.00,,,
9D Curve Glass Screen Protector For Samsung Galaxy S21 Ultra High Protection - Black frame,/-/en/Screen-Protector-Samsung-Galaxy-Protection/dp/B0922Z63LR/ref=sr_1_4960?m=A1ZVRGNO5AYLOV&qid=1652830144&refinements=p_6%3AA1ZVRGNO5AYLOV&s=electronics&sr=1-4960,EGP 116.87,EGP 124.10,Limited time deal,
"Cover Flip Clear View, Not Smart And Without Sensor For Oppo Reno 3 - Black",/-/en/Cover-Clear-Smart-Without-Sensor/dp/B08YXY34LS/ref=sr_1_4961?m=A1ZVRGNO5AYLOV&qid=1652830144&refinements=p_6%3AA1ZVRGNO5AYLOV&s=electronics&sr=1-4961,EGP 71.48,EGP 83.20,,
Back Cover Hard Slim Case with Camera Shield For Samsung Galaxy A32 - Clear,/-/en/Cover-Camera-Shield-Samsung-Galaxy/dp/B09P5HLTL5/ref=sr_1_4962?m=A1ZVRGNO5AYLOV&qid=1652830144&refinements=p_6%3AA1ZVRGNO5AYLOV&s=electronics&sr=1-4962,EGP 61.87,EGP 72.00,Limited time deal,
"Silicone Watch strap band 22mm, For Samsung Galaxy 46mm, Huami sports and 2S, Gear S3 Classic and Frontier, MOTO 360 second generation, Garmin Vivomove",/-/en/Silicone-Samsung-Frontier-generation-Vivomove/dp/B098TWCT2J/ref=sr_1_4963?m=A1ZVRGNO5AYLOV&qid=1652830144&refinements=p_6%3AA1ZVRGNO5AYLOV&s=electronics&sr=1-4963,EGP 93.61,,,
CASE LOGIC HDD CASE LECTRO SHELL LAC-102 BLACK,/-/en/LOGIC-LECTRO-SHELL-LAC-102-BLACK/dp/B08F41PGQ2/ref=sr_1_4964?m=A1ZVRGNO5AYLOV&qid=1652830144&refinements=p_6%3AA1ZVRGNO5AYLOV&s=electronics&sr=1-4964,EGP 548.46,,,
Screen Privacy Protector for Iphone 12 Mini 5.4,/-/en/Screen-Privacy-Protector-Iphone-Mini/dp/B08YNLYC13/ref=sr_1_4965?m=A1ZVRGNO5AYLOV&qid=1652830144&refinements=p_6%3AA1ZVRGNO5AYLOV&s=electronics&sr=1-4965,EGP 78.30,EGP 88.02,,
Dual Layer Hard Back Cover with Stand and Finger Holder for Oppo A31 - Black,/-/en/Layer-Cover-Stand-Finger-Holder/dp/B08X5XZP9F/ref=sr_1_4966?m=A1ZVRGNO5AYLOV&qid=1652830144&refinements=p_6%3AA1ZVRGNO5AYLOV&s=electronics&sr=1-4966,EGP 31.25,,,
Rich Boss Leather Flip Wallet Case For Infinix Smart 2 Pro X5514D - Camel,/-/en/Rich-Boss-Leather-Wallet-Infinix/dp/B07LH79C9M/ref=sr_1_4967?m=A1ZVRGNO5AYLOV&qid=1652830144&refinements=p_6%3AA1ZVRGNO5AYLOV&s=electronics&sr=1-4967,EGP 19.00,,,
Iron Man Hard Back Cover With Metal Ring And Kickstand For Samsung Galaxy S10 - Blue Black,/-/en/Cover-Metal-Kickstand-Samsung-Galaxy/dp/B0937J9LMZ/ref=sr_1_4968?m=A1ZVRGNO5AYLOV&qid=1652830144&refinements=p_6%3AA1ZVRGNO5AYLOV&s=electronics&sr=1-4968,EGP 10.00,,,
5D Screen protector full Glue for Xiaomi Mi A1 - Black,/-/en/Screen-protector-full-Glue-Xiaomi/dp/B091NX7XG6/ref=sr_1_4969?m=A1ZVRGNO5AYLOV&qid=1652830144&refinements=p_6%3AA1ZVRGNO5AYLOV&s=electronics&sr=1-4969,EGP 25.00,,,
High Quality Set of 2 Glass Screen Protectors For Samsung Galaxy Note20 Ultra - Clear Black,/-/en/Quality-Screen-Protectors-Samsung-Galaxy/dp/B09R4ZCXVJ/ref=sr_1_4970?m=A1ZVRGNO5AYLOV&qid=1652830144&refinements=p_6%3AA1ZVRGNO5AYLOV&s=electronics&sr=1-4970,EGP 47.42,,,
For Samsung Galaxy S21 Ultra 2-in-1 screen protector nanotechnology with hardened gelatin back protector,/-/en/Samsung-protector-nanotechnology-hardened-gelatin/dp/B0922YLYVQ/ref=sr_1_4971?m=A1ZVRGNO5AYLOV&qid=1652830144&refinements=p_6%3AA1ZVRGNO5AYLOV&s=electronics&sr=1-4971,EGP 56.00,,,
"Dragon Ceramic Anti-Fingerprint Screen Protector for Huawei Nova 5T, 6.2 inches, Pack of 3 - Black",/-/en/Dragon-Ceramic-Anti-Fingerprint-Screen-Protector/dp/B08ZPL76D3/ref=sr_1_4972?m=A1ZVRGNO5AYLOV&qid=1652830144&refinements=p_6%3AA1ZVRGNO5AYLOV&s=electronics&sr=1-4972,EGP 53.00,,,
Beats Studio3 Wireless Over-Ear Headphones - Matte Black,/-/en/Beats-Studio3-Wireless-Over-Ear-Headphones/dp/B075G56GZD/ref=sr_1_4973?m=A1ZVRGNO5AYLOV&qid=1652830144&refinements=p_6%3AA1ZVRGNO5AYLOV&s=electronics&sr=1-4973,"EGP 7,751.94",,,
Personality case with Kickstand and holder TPU PC For Samsung Galaxy A31 - Navy,/-/en/Personality-Kickstand-holder-Samsung-Galaxy/dp/B091Q7RK3D/ref=sr_1_4974?m=A1ZVRGNO5AYLOV&qid=1652830144&refinements=p_6%3AA1ZVRGNO5AYLOV&s=electronics&sr=1-4974,EGP 10.00,,,
Crush Foldable Laptop 4 Fans Multi Color 4000C for Laptop and Notebook,/-/en/Crush-Foldable-Laptop-Multi-Notebook/dp/B09QQK1H28/ref=sr_1_4975?m=A1ZVRGNO5AYLOV&qid=1652830144&refinements=p_6%3AA1ZVRGNO5AYLOV&s=electronics&sr=1-4975,EGP 342.00,,,
9D Curve Glass Screen Protector For Samsung Galaxy S21 Ultra High Protection - Black frame,/-/en/Screen-Protector-Samsung-Galaxy-Protection/dp/B0922Z63LR/ref=sr_1_4976?m=A1ZVRGNO5AYLOV&qid=1652830144&refinements=p_6%3AA1ZVRGNO5AYLOV&s=electronics&sr=1-4976,EGP 116.87,EGP 124.10,Limited time deal,
"Cover Flip Clear View, Not Smart And Without Sensor For Oppo Reno 3 - Black",/-/en/Cover-Clear-Smart-Without-Sensor/dp/B08YXY34LS/ref=sr_1_4977?m=A1ZVRGNO5AYLOV&qid=1652830144&refinements=p_6%3AA1ZVRGNO5AYLOV&s=electronics&sr=1-4977,EGP 71.48,EGP 83.20,,
Back Cover Hard Slim Case with Camera Shield For Samsung Galaxy A32 - Clear,/-/en/Cover-Camera-Shield-Samsung-Galaxy/dp/B09P5HLTL5/ref=sr_1_4978?m=A1ZVRGNO5AYLOV&qid=1652830144&refinements=p_6%3AA1ZVRGNO5AYLOV&s=electronics&sr=1-4978,EGP 61.87,EGP 72.00,Limited time deal,
CA-45 Super Fast Type-C Data Cable-Black,/-/en/CA-45-Super-Fast-Type-C-Cable-Black/dp/B091CX2P3J/ref=sr_1_4979?m=A1ZVRGNO5AYLOV&qid=1652830144&refinements=p_6%3AA1ZVRGNO5AYLOV&s=electronics&sr=1-4979,EGP 114.30,,,
"Silicone Watch strap band 22mm, For Samsung Galaxy 46mm, Huami sports and 2S, Gear S3 Classic and Frontier, MOTO 360 second generation, Garmin Vivomove",/-/en/Silicone-Samsung-Frontier-generation-Vivomove/dp/B098TWCT2J/ref=sr_1_4980?m=A1ZVRGNO5AYLOV&qid=1652830144&refinements=p_6%3AA1ZVRGNO5AYLOV&s=electronics&sr=1-4980,EGP 93.61,,,
5D Glass Screen Protector Full Glue for Huawei Y9 2019 - Black,/-/en/Glass-Screen-Protector-Full-Huawei/dp/B08XRRYTTT/ref=sr_1_4981?m=A1ZVRGNO5AYLOV&qid=1652830144&refinements=p_6%3AA1ZVRGNO5AYLOV&s=electronics&sr=1-4981,EGP 27.51,,,
Screen Privacy Protector for Iphone 12 Mini 5.4,/-/en/Screen-Privacy-Protector-Iphone-Mini/dp/B08YNLYC13/ref=sr_1_4982?m=A1ZVRGNO5AYLOV&qid=1652830144&refinements=p_6%3AA1ZVRGNO5AYLOV&s=electronics&sr=1-4982,EGP 78.30,EGP 88.02,,
Keendex KX1875 Power Supply Tester IV (20/24 Pin ATX BTX ITX TFX SATA HDD) - Black,/-/en/Keendex-KX1875-Power-Supply-Tester/dp/B093WYN4DV/ref=sr_1_4983?m=A1ZVRGNO5AYLOV&qid=1652830144&refinements=p_6%3AA1ZVRGNO5AYLOV&s=electronics&sr=1-4983,EGP 184.59,,,
Rich Boss Leather Flip Wallet Case For Infinix Smart 2 Pro X5514D - Camel,/-/en/Rich-Boss-Leather-Wallet-Infinix/dp/B07LH79C9M/ref=sr_1_4984?m=A1ZVRGNO5AYLOV&qid=1652830144&refinements=p_6%3AA1ZVRGNO5AYLOV&s=electronics&sr=1-4984,EGP 19.00,,,
Nano Ceramic Screen Protector Anti Shock Anti Fingerprint For Xiaomi Mi 10T Pro - Clear,/-/en/Ceramic-Screen-Protector-Fingerprint-Xiaomi/dp/B091J8LC9V/ref=sr_1_4985?m=A1ZVRGNO5AYLOV&qid=1652830144&refinements=p_6%3AA1ZVRGNO5AYLOV&s=electronics&sr=1-4985,EGP 14.74,,,
Nillkin Striker Case for iPhone 12 mini - Multi Color,/-/en/Nillkin-Striker-Case-iPhone-mini/dp/B08Y8Z1H36/ref=sr_1_4986?m=A1ZVRGNO5AYLOV&qid=1652830144&refinements=p_6%3AA1ZVRGNO5AYLOV&s=electronics&sr=1-4986,EGP 39.00,EGP 60.00,,
Xiaomi Note 9s / Note 9 Pro/Note 9 Pro Max Tempered Glass screen Protector - Clear by Dl3 Mobilk,/-/en/Xiaomi-Tempered-Glass-screen-Protector/dp/B08XS1C9HF/ref=sr_1_4987?m=A1ZVRGNO5AYLOV&qid=1652830144&refinements=p_6%3AA1ZVRGNO5AYLOV&s=electronics&sr=1-4987,EGP 18.00,,,
5D Tempered Glass for Nokia 6.1 Plus (X6) Full Screen Protector - Black Frame,/-/en/Tempered-Glass-Nokia-Screen-Protector/dp/B08Y8YKVMT/ref=sr_1_4988?m=A1ZVRGNO5AYLOV&qid=1652830144&refinements=p_6%3AA1ZVRGNO5AYLOV&s=electronics&sr=1-4988,EGP 35.19,,,
Apple MRGC2ZM/a Leather Back Cover For iPhone 7 Plus and iPhone 8 Plus - Spring Yellow,/-/en/Apple-MRGC2ZM-Leather-Cover-iPhone/dp/B07BRD47XK/ref=sr_1_4989?m=A1ZVRGNO5AYLOV&qid=1652830144&refinements=p_6%3AA1ZVRGNO5AYLOV&s=electronics&sr=1-4989,EGP 444.00,,,
G-H13 Wireless Portable Bluetooth Speaker With High Performance Sound - Black,/-/en/Wireless-Portable-Bluetooth-Speaker-Performance/dp/B09VT1XRWL/ref=sr_1_4990?m=A1ZVRGNO5AYLOV&qid=1652830144&refinements=p_6%3AA1ZVRGNO5AYLOV&s=electronics&sr=1-4990,EGP 140.80,,,
"Keendex 2369 USB 3.0 Printer Cable, 80 cm - Black",/-/en/Keendex-2369-USB-Printer-Cable/dp/B092DXWNK4/ref=sr_1_4991?m=A1ZVRGNO5AYLOV&qid=1652830144&refinements=p_6%3AA1ZVRGNO5AYLOV&s=electronics&sr=1-4991,EGP 83.62,,,
"UGREEN Guitar Cable 6.35mm Mono Jack 1/4 Inch TS Unbalanced Patch Speaker Cable Braided Instrument Male to Male Amp Cord Zinc Alloy Casing Compatible with Electric Bass Guitar Keyboard Pro Audio, 10FT",/-/en/UGREEN-Unbalanced-Instrument-Compatible-Electric/dp/B00Y44AAR6/ref=sr_1_4992?m=A1ZVRGNO5AYLOV&qid=1652830144&refinements=p_6%3AA1ZVRGNO5AYLOV&s=electronics&sr=1-4992,EGP 145.09,EGP 149.30,,4.4 out of 5 stars
High Quality Glass Screen Protector For Samsung Galaxy S20 Plus - Clear Black,/-/en/Quality-Screen-Protector-Samsung-Galaxy/dp/B09R4YLMBN/ref=sr_1_4993?m=A1ZVRGNO5AYLOV&qid=1652830145&refinements=p_6%3AA1ZVRGNO5AYLOV&s=electronics&sr=1-4993,EGP 29.18,,,
2B (MO33P) 2.4G Wireless Mouse - Pink With White Cover,/-/en/2B-MO33P-2-4G-Wireless-Mouse/dp/B09585VPQ4/ref=sr_1_4994?m=A1ZVRGNO5AYLOV&qid=1652830145&refinements=p_6%3AA1ZVRGNO5AYLOV&s=electronics&sr=1-4994,EGP 159.89,,,
XO L61 Wall Charger 2 USB Ports 2.4A - white,/-/en/XO-Wall-Charger-Ports-2-4A/dp/B09FM4L7DB/ref=sr_1_4995?m=A1ZVRGNO5AYLOV&qid=1652830145&refinements=p_6%3AA1ZVRGNO5AYLOV&s=electronics&sr=1-4995,EGP 59.57,EGP 69.31,Limited time deal,
Fashion Anti-Shock Hard Back Cover with Silicon Edges for Oppo Reno Ace and Oppo Realme X2 Pro Mobile Phone - Clear,/-/en/Fashion-Anti-Shock-Silicon-Realme-Mobile/dp/B0994QJXWM/ref=sr_1_4996?m=A1ZVRGNO5AYLOV&qid=1652830145&refinements=p_6%3AA1ZVRGNO5AYLOV&s=electronics&sr=1-4996,EGP 72.00,,,
21D Screen Ceramic Matte screen protector For Samsung Galaxy A51 - Black,/-/en/Screen-Ceramic-screen-protector-Samsung/dp/B08X6261VR/ref=sr_1_4997?m=A1ZVRGNO5AYLOV&qid=1652830145&refinements=p_6%3AA1ZVRGNO5AYLOV&s=electronics&sr=1-4997,EGP 24.00,,,
Arctic Hunter XB00121 Waterproof Anti Theft Single Shoulder Sling Crossbody Bag With USB Charging Port - Black,/-/en/Arctic-Hunter-Waterproof-Shoulder-Crossbody/dp/B09KZ5G6SJ/ref=sr_1_4998?m=A1ZVRGNO5AYLOV&qid=1652830145&refinements=p_6%3AA1ZVRGNO5AYLOV&s=electronics&sr=1-4998,EGP 706.00,,Best Seller,
HOCO C73A - Glorious Dual Port Charger Set (Lightning) (EU) - White,/-/en/HOCO-C73A-Glorious-Charger-Lightning/dp/B092TX25GM/ref=sr_1_4999?m=A1ZVRGNO5AYLOV&qid=1652830145&refinements=p_6%3AA1ZVRGNO5AYLOV&s=electronics&sr=1-4999,EGP 54.24,,,
Domani Tv unite brown - T080,/-/en/Domani-Tv-unite-brown-T080/dp/B099PQJ13F/ref=sr_1_5000?m=A1ZVRGNO5AYLOV&qid=1652830145&refinements=p_6%3AA1ZVRGNO5AYLOV&s=electronics&sr=1-5000,"EGP 1,199.65","EGP 1,540.00",,
Yesido 20000mAh Power Bank YP-16 18W-Black,/-/en/Yesido-20000mAh-Power-YP-16-18W-Black/dp/B08PKHK1SX/ref=sr_1_5001?m=A1ZVRGNO5AYLOV&qid=1652830145&refinements=p_6%3AA1ZVRGNO5AYLOV&s=electronics&sr=1-5001,EGP 758.40,,,
Oraimo OEP-E23 Wired Earphones with Microphone - White,/-/en/Oraimo-OEP-E23-Wired-Earphones-Microphone/dp/B08B6BJV9T/ref=sr_1_5002?m=A1ZVRGNO5AYLOV&qid=1652830145&refinements=p_6%3AA1ZVRGNO5AYLOV&s=electronics&sr=1-5002,EGP 123.47,EGP 134.40,,
Baseus Waterproof Case with Neck Strap - Blue,/-/en/Baseus-Waterproof-Case-Neck-Strap/dp/B00Y33YZ1U/ref=sr_1_5003?m=A1ZVRGNO5AYLOV&qid=1652830145&refinements=p_6%3AA1ZVRGNO5AYLOV&s=electronics&sr=1-5003,EGP 150.00,EGP 153.60,,
Meetion K9520 - RGB Magnetic Wrist Rest Gaming Keyboard - Black,/-/en/Meetion-K9520-Magnetic-Gaming-Keyboard/dp/B09459ZRV4/ref=sr_1_5004?m=A1ZVRGNO5AYLOV&qid=1652830145&refinements=p_6%3AA1ZVRGNO5AYLOV&s=electronics&sr=1-5004,EGP 375.44,,,
21D Ceramic Matte Anti-Blue Ray Screen Protector - Samsung Galaxy a71 - Black,/-/en/Ceramic-Matte-Anti-Blue-Screen-Protector/dp/B093FTMD34/ref=sr_1_5005?m=A1ZVRGNO5AYLOV&qid=1652830145&refinements=p_6%3AA1ZVRGNO5AYLOV&s=electronics&sr=1-5005,EGP 27.36,,,
"SWIDO Screen Protector for Xiaomi Poco F2 Pro [Pack of 2] Crystal Clear, High Hardness, Protection Against Oil, Dust and Scratches, Glass Film, Screen Protector, Tempered Glass Film",/-/en/Protector-Hardness-Protection-Scratches-Tempered/dp/B08NPNSHB3/ref=sr_1_5006?m=A1ZVRGNO5AYLOV&qid=1652830145&refinements=p_6%3AA1ZVRGNO5AYLOV&s=electronics&sr=1-5006,EGP 32.00,,,
Moxom MX-EP28 Wired In Ear Earphone With Microphone - Black,/-/en/Moxom-MX-EP28-Wired-Earphone-Microphone/dp/B0976H35JP/ref=sr_1_5007?m=A1ZVRGNO5AYLOV&qid=1652830145&refinements=p_6%3AA1ZVRGNO5AYLOV&s=electronics&sr=1-5007,EGP 67.20,,,
Boter Printed TPU Silicon Back Cover For Huawei Mate 30 Pro - Multi Color,/-/en/Boter-Printed-Silicon-Cover-Huawei/dp/B08X5XFC14/ref=sr_1_5008?m=A1ZVRGNO5AYLOV&qid=1652830145&refinements=p_6%3AA1ZVRGNO5AYLOV&s=electronics&sr=1-5008,EGP 51.10,,,
Auto Focus Silicone Back Cover Slim Case with 5D Anti-Fingerprint Screen Protector for Samsung Galaxy S10 Lite 2020 - Black,/-/en/Auto-Focus-Silicone-Anti-Fingerprint-Protector/dp/B08ZNW8HTV/ref=sr_1_5009?m=A1ZVRGNO5AYLOV&qid=1652830145&refinements=p_6%3AA1ZVRGNO5AYLOV&s=electronics&sr=1-5009,EGP 34.00,,,
"EXTREME ® 2 Pack Screen Protector for iPhone 12 mini 5.4 Inch Tempered Glass Screen Protector Anti-Scratch with Alignment Frame, Scratch Resistant Compatible with Apple iPhone 12 mini, Bubble Free",/-/en/Protector-Anti-Scratch-Alignment-Resistant-Compatible/dp/B08M6D14VL/ref=sr_1_5010?m=A1ZVRGNO5AYLOV&qid=1652830145&refinements=p_6%3AA1ZVRGNO5AYLOV&s=electronics&sr=1-5010,EGP 32.00,,,
XO BE8 Bluetooth 5.0 Wireless Headset - Black,/-/en/XO-BE8-Bluetooth-Wireless-Headset/dp/B08WJPPYPZ/ref=sr_1_5011?m=A1ZVRGNO5AYLOV&qid=1652830145&refinements=p_6%3AA1ZVRGNO5AYLOV&s=electronics&sr=1-5011,EGP 218.49,,,
High Quality Set Of 3 Glass Screen Protectors For Samsung Galaxy A12/M12 - Clear Black,/-/en/Quality-Screen-Protectors-Samsung-Galaxy/dp/B09R51RSL3/ref=sr_1_5012?m=A1ZVRGNO5AYLOV&qid=1652830145&refinements=p_6%3AA1ZVRGNO5AYLOV&s=electronics&sr=1-5012,EGP 56.43,,Limited time deal,
Symphony 4.3 inch SY-MR430 Car Display Screen with Support Camera for Park Sensor,/-/en/Symphony-SY-MR430-Display-Screen-Support/dp/B0992Y1LVG/ref=sr_1_5013?m=A1ZVRGNO5AYLOV&qid=1652830145&refinements=p_6%3AA1ZVRGNO5AYLOV&s=electronics&sr=1-5013,"EGP 1,092.63",,,
20 PCs mini push button 2 pin,/-/en/PCs-mini-push-button-pin/dp/B098TYG83H/ref=sr_1_5014?m=A1ZVRGNO5AYLOV&qid=1652830145&refinements=p_6%3AA1ZVRGNO5AYLOV&s=electronics&sr=1-5014,EGP 23.71,,,
Nillkin Textured Nylon Fiber case For Xiaomi Mix 4 - Black,/-/en/Nillkin-Textured-Nylon-Fiber-Xiaomi/dp/B09GP6Z5N4/ref=sr_1_5015?m=A1ZVRGNO5AYLOV&qid=1652830145&refinements=p_6%3AA1ZVRGNO5AYLOV&s=electronics&sr=1-5015,EGP 160.51,,,
Yookie K335 Wireless In Ear Headphones Premeuim Quality With Microphone - White,/-/en/Yookie-K335-Wireless-Headphones-Premeuim-Microphone/dp/B0968XVKHX/ref=sr_1_5016?m=A1ZVRGNO5AYLOV&qid=1652830145&refinements=p_6%3AA1ZVRGNO5AYLOV&s=electronics&sr=1-5016,EGP 272.00,,,
Tempered Glass Privacy Screen Protector For Iphone 8 Plus / 7 Plus,/-/en/Tempered-Privacy-Screen-Protector-Iphone/dp/B08YY257LW/ref=sr_1_5017?m=A1ZVRGNO5AYLOV&qid=1652830146&refinements=p_6%3AA1ZVRGNO5AYLOV&s=electronics&sr=1-5017,EGP 73.00,,,
"Keendex 1797 Converter Cable, aUX 2.5 mm to RJ9, 10 cm - Black",/-/en/Keendex-1797-Converter-Cable-aUX/dp/B096L5PLL4/ref=sr_1_5018?m=A1ZVRGNO5AYLOV&qid=1652830146&refinements=p_6%3AA1ZVRGNO5AYLOV&s=electronics&sr=1-5018,EGP 26.00,,Limited time deal,
Huawei P20 Lite Case 360 degree full cover 2 pieces metal frame Magnetic tempered glass back case - Black,/-/en/Huawei-degree-pieces-Magnetic-tempered/dp/B091Q7453W/ref=sr_1_5019?m=A1ZVRGNO5AYLOV&qid=1652830146&refinements=p_6%3AA1ZVRGNO5AYLOV&s=electronics&sr=1-5019,EGP 104.00,,,
TP-LINK TL-SG1048 48-Port Gigabit Switch,/-/en/TP-LINK-TL-SG1048-48-Port-Gigabit-Switch/dp/B004UBUJZG/ref=sr_1_5020?m=A1ZVRGNO5AYLOV&qid=1652830146&refinements=p_6%3AA1ZVRGNO5AYLOV&s=electronics&sr=1-5020,"EGP 4,887.51",,,
For Xiaomi Redmi Note 8 Pro Cover Personality TPU plus Pc Dual Layer With Stand and Finger Holder Back Cover - Red,/-/en/Xiaomi-Redmi-Personality-Finger-Holder/dp/B08XS39K5L/ref=sr_1_5021?m=A1ZVRGNO5AYLOV&qid=1652830146&refinements=p_6%3AA1ZVRGNO5AYLOV&s=electronics&sr=1-5021,EGP 40.00,,,4.5 out of 5 stars
"Onikuma G26+CW905 RGB Combo Gaming Mechanical Keyboard and Optical Mouse, Set Wired Mechanical Keyboard + Mouse",/-/en/Onikuma-Gaming-Mechanical-Keyboard-Optical/dp/B09FQCPP77/ref=sr_1_5022?m=A1ZVRGNO5AYLOV&qid=1652830146&refinements=p_6%3AA1ZVRGNO5AYLOV&s=electronics&sr=1-5022,EGP 556.88,EGP 588.60,,
Celebrat D1 Wired Vacuum Headphones With Microphone - Blue,/-/en/Celebrat-D1-Vacuum-Headphones-Microphone/dp/B06XBJFFVR/ref=sr_1_5023?m=A1ZVRGNO5AYLOV&qid=1652830146&refinements=p_6%3AA1ZVRGNO5AYLOV&s=electronics&sr=1-5023,EGP 38.30,,,
UGREEN AV119-3.5MM Male To 3.5MM Male 1.5M Audio Cable,/-/en/UGREEN-AV119-3-5MM-3-5MM-Audio-Cable/dp/B07Z54NHLG/ref=sr_1_5024?m=A1ZVRGNO5AYLOV&qid=1652830146&refinements=p_6%3AA1ZVRGNO5AYLOV&s=electronics&sr=1-5024,EGP 61.00,,,
WIWU GD-100 USB Compatible Lightning 18K 20W Data Cable 2M - Gold,/-/en/WIWU-GD-100-Compatible-Lightning-Cable/dp/B08ZLYWKN6/ref=sr_1_5025?m=A1ZVRGNO5AYLOV&qid=1652830146&refinements=p_6%3AA1ZVRGNO5AYLOV&s=electronics&sr=1-5025,EGP 91.93,,Limited time deal,
5D Full Screen Protector By Dl3 Mobilak For Nokia 8.3 5G - Black,/-/en/Screen-Protector-Dl3-Mobilak-Nokia/dp/B09232P7SF/ref=sr_1_5026?m=A1ZVRGNO5AYLOV&qid=1652830146&refinements=p_6%3AA1ZVRGNO5AYLOV&s=electronics&sr=1-5026,EGP 24.20,EGP 27.02,Limited time deal,
