Name,Link,Price,OldPrice,BestSeller,Stars
WK Design W150 Wired Earphones with Microphone - White,/-/en/WK-Design-W150-Earphones-Microphone/dp/B08WJMZHG7/ref=sr_1_5125?m=A1ZVRGNO5AYLOV&qid=1652830149&refinements=p_6%3AA1ZVRGNO5AYLOV&s=electronics&sr=1-5125,EGP 22.63,,,
Back Cover Hard iRon Man For Huawei Mate 20 Lite - Blue,/-/en/Back-Cover-Hard-iRon-Huawei/dp/B08XRRYC8T/ref=sr_1_5126?m=A1ZVRGNO5AYLOV&qid=1652830149&refinements=p_6%3AA1ZVRGNO5AYLOV&s=electronics&sr=1-5126,EGP 61.87,,Limited time deal,
"Energizer DC2CLLIM Dual USB Car Charger with Lightning Cable, 3.4 A - Black",/-/en/Energizer-DC2CLLIM-Charger-Lightning-Cable/dp/B07MVLKW7P/ref=sr_1_5127?m=A1ZVRGNO5AYLOV&qid=1652830149&refinements=p_6%3AA1ZVRGNO5AYLOV&s=electronics&sr=1-5127,EGP 259.00,,,
VR Shinecon Wireless Remote Control - White,/-/en/VR-Shinecon-Wireless-Remote-Control/dp/B098TXKBVP/ref=sr_1_5128?m=A1ZVRGNO5AYLOV&qid=1652830149&refinements=p_6%3AA1ZVRGNO5AYLOV&s=electronics&sr=1-5128,EGP 80.00,,,
AG 9H Screen Protector Curved Anti-Blue Matte Glass Anti-scratch For Xiaomi Note 7 - Black,/-/en/Screen-Protector-Curved-Anti-Blue-Anti-scratch/dp/B08X6KDRTS/ref=sr_1_5129?m=A1ZVRGNO5AYLOV&qid=1652830149&refinements=p_6%3AA1ZVRGNO5AYLOV&s=electronics&sr=1-5129,EGP 25.00,,,
For Infinix Note 8 Nano Ceramic Screen Protector Anti Shock Anti Fingerprint - Clear,/-/en/Infinix-Ceramic-Screen-Protector-Fingerprint/dp/B091J5MWWR/ref=sr_1_5130?m=A1ZVRGNO5AYLOV&qid=1652830149&refinements=p_6%3AA1ZVRGNO5AYLOV&s=electronics&sr=1-5130,EGP 27.36,,,
Back Case TPU For Samsung J6 Plus 2018 - Clear,/-/en/Back-Case-Samsung-Plus-2018/dp/B096R15BDG/ref=sr_1_5131?m=A1ZVRGNO5AYLOV&qid=1652830149&refinements=p_6%3AA1ZVRGNO5AYLOV&s=electronics&sr=1-5131,EGP 30.71,,,
Screen Protector for For Xiaomi Mi 9 Anti-Scratch Anti-Fingerprint Bubble Free Tempered Glass Screen Protector (Black),/-/en/Screen-Protector-Anti-Scratch-Anti-Fingerprint-Tempered/dp/B08Y8Y4YJY/ref=sr_1_5132?m=A1ZVRGNO5AYLOV&qid=1652830149&refinements=p_6%3AA1ZVRGNO5AYLOV&s=electronics&sr=1-5132,EGP 31.25,,,
"RawLink universal tablet holder for car, headrest mount for iPad, Samsung Tab and all tablets from 7-10.5 inches, easy to install and practical to use",/-/en/RawLink-universal-headrest-Samsung-practical/dp/B09GMV3D32/ref=sr_1_5133?m=A1ZVRGNO5AYLOV&qid=1652830149&refinements=p_6%3AA1ZVRGNO5AYLOV&s=electronics&sr=1-5133,EGP 256.00,,,
"UGREEN 3.5MM Male to 2 RCA Female Jack Stereo Audio Cable Y Adapter Gold Plated Compatible for iPhone,iPod,iPad,MP3,Tablets,HiFi Stereo System,Computer Sound, Speaker - 0.2Meter",/-/en/UGREEN-Adapter-Compatible-Tablets-Computer/dp/B00B2HP1MW/ref=sr_1_5134?m=A1ZVRGNO5AYLOV&qid=1652830149&refinements=p_6%3AA1ZVRGNO5AYLOV&s=electronics&sr=1-5134,EGP 60.00,,,
"5D Tempered Glass screen protector for Samsung Galaxy A51 Glass Screen 5D Smsung A51, Black",/-/en/Tempered-screen-protector-Samsung-Galaxy/dp/B08Y8ZCX7H/ref=sr_1_5135?m=A1ZVRGNO5AYLOV&qid=1652830149&refinements=p_6%3AA1ZVRGNO5AYLOV&s=electronics&sr=1-5135,EGP 18.00,,,
Slim Hard Back Cover with Slide Camera Shield for Oppo A52 Green,/-/en/Cover-Slide-Camera-Shield-Green/dp/B09FKCDF11/ref=sr_1_5136?m=A1ZVRGNO5AYLOV&qid=1652830149&refinements=p_6%3AA1ZVRGNO5AYLOV&s=electronics&sr=1-5136,EGP 62.75,,,
Spigen Quartz Hybrid Designed for iPhone 13 Case (2021) - Crystal Clear,/-/en/Spigen-Quartz-Hybrid-Designed-iPhone/dp/B096HL1NDM/ref=sr_1_5137?m=A1ZVRGNO5AYLOV&qid=1652830150&refinements=p_6%3AA1ZVRGNO5AYLOV&s=electronics&sr=1-5137,EGP 480.00,EGP 704.75,,4.3 out of 5 stars
For Apple iPhone 12 Pro / 12 Pro Max Camera Lens Screen Protector Tempered Glass - clear,/-/en/iPhone-Camera-Screen-Protector-Tempered/dp/B0924ZXKW2/ref=sr_1_5138?m=A1ZVRGNO5AYLOV&qid=1652830150&refinements=p_6%3AA1ZVRGNO5AYLOV&s=electronics&sr=1-5138,EGP 25.00,,,
Dragon Bingo Tempered Glass Screen Protector with Black Edges for iPhone 11 Pro Mobile Phone - Black,/-/en/Dragon-Tempered-Screen-Protector-iPhone/dp/B093WYYHQH/ref=sr_1_5139?m=A1ZVRGNO5AYLOV&qid=1652830150&refinements=p_6%3AA1ZVRGNO5AYLOV&s=electronics&sr=1-5139,EGP 43.81,,,
For Samsung Galaxy S21 Ultra 5G screen Protector Front And Back And lens Gelatin Matte Anti Fingerprint 20 August By Whats MoB,/-/en/Samsung-Protector-Fingerprint-Whats-MoB/dp/B091J5JTKD/ref=sr_1_5140?m=A1ZVRGNO5AYLOV&qid=1652830150&refinements=p_6%3AA1ZVRGNO5AYLOV&s=electronics&sr=1-5140,EGP 88.02,,,
CABLE 300 AMPER,/-/en/El-Youser-CABLE-300-AMPER/dp/B08WJLDHXV/ref=sr_1_5141?m=A1ZVRGNO5AYLOV&qid=1652830150&refinements=p_6%3AA1ZVRGNO5AYLOV&s=electronics&sr=1-5141,EGP 240.22,,,
Huawei Y6 2019 / Honor 8A Soft TPU Back Cover Auto Focus - Red,/-/en/Huawei-Honor-Cover-Auto-Focus/dp/B091J7MF3Q/ref=sr_1_5142?m=A1ZVRGNO5AYLOV&qid=1652830150&refinements=p_6%3AA1ZVRGNO5AYLOV&s=electronics&sr=1-5142,EGP 31.25,EGP 40.00,,
9D Glass Screen Protector Full Glue For Realme 5 - Black,/-/en/Glass-Screen-Protector-Full-Realme/dp/B08X68QBQX/ref=sr_1_5143?m=A1ZVRGNO5AYLOV&qid=1652830150&refinements=p_6%3AA1ZVRGNO5AYLOV&s=electronics&sr=1-5143,EGP 16.50,,,
glass screen protector for samsung galaxy A71 -clear,/-/en/screen-protector-samsung-galaxy-clear/dp/B08XRYQ1DK/ref=sr_1_5144?m=A1ZVRGNO5AYLOV&qid=1652830150&refinements=p_6%3AA1ZVRGNO5AYLOV&s=electronics&sr=1-5144,EGP 23.36,,,
High Quality Glass Screen Protector For Samsung Galaxy A52 - Clear Black,/-/en/Quality-Screen-Protector-Samsung-Galaxy/dp/B09R4ZQHZ1/ref=sr_1_5145?m=A1ZVRGNO5AYLOV&qid=1652830150&refinements=p_6%3AA1ZVRGNO5AYLOV&s=electronics&sr=1-5145,EGP 29.18,,,
"For Apple iPhone XS Max Iron Man II Hard PC, Soft rubber side liner, with Kickstand - Navy",/-/en/Apple-iPhone-rubber-liner-Kickstand/dp/B091J71PNH/ref=sr_1_5146?m=A1ZVRGNO5AYLOV&qid=1652830150&refinements=p_6%3AA1ZVRGNO5AYLOV&s=electronics&sr=1-5146,EGP 60.80,,,
"Dragon Tinted Glass Curved Screen Protector for Samsung Galaxy S20 Plus Mobile Phone, Set of 3 - Black",/-/en/Dragon-Tinted-Curved-Protector-Samsung/dp/B091Q6YBCP/ref=sr_1_5147?m=A1ZVRGNO5AYLOV&qid=1652830150&refinements=p_6%3AA1ZVRGNO5AYLOV&s=electronics&sr=1-5147,EGP 320.00,,,
Silicone Back Cover for Honor 10i - Black,/-/en/Silicone-Back-Cover-Honor-10i/dp/B0976FJCLY/ref=sr_1_5148?m=A1ZVRGNO5AYLOV&qid=1652830150&refinements=p_6%3AA1ZVRGNO5AYLOV&s=electronics&sr=1-5148,EGP 49.00,,,
"Privacy Screen Protector Compatible for iPhone 12 Pro Screen Protector, Anty- Spy Tempered Glass 9H Hardness Tempered Glass Film Easy Install (for iPhone 12/12 pro 2Pack)",/-/en/Privacy-Protector-Compatible-Tempered-Hardness/dp/B08VDVMDMK/ref=sr_1_5149?m=A1ZVRGNO5AYLOV&qid=1652830150&refinements=p_6%3AA1ZVRGNO5AYLOV&s=electronics&sr=1-5149,EGP 109.43,,,
Kaiyue Flip Leather Case Cover For Oppo Reno 3 / F15 - Pink,/-/en/Kaiyue-Flip-Leather-Case-Cover/dp/B091J64BG2/ref=sr_1_5150?m=A1ZVRGNO5AYLOV&qid=1652830150&refinements=p_6%3AA1ZVRGNO5AYLOV&s=electronics&sr=1-5150,EGP 61.14,,,
XO EP37 Music Earphone TPE + ABS 1.15m - White,/-/en/EP37-Music-Earphone-TPE-1-15m/dp/B09VFY4RTH/ref=sr_1_5151?m=A1ZVRGNO5AYLOV&qid=1652830150&refinements=p_6%3AA1ZVRGNO5AYLOV&s=electronics&sr=1-5151,EGP 27.32,,,
"For Huawei Y9 Prime 2019 Case GKK 360 Degree 3 pieces - a piece on top,a piece down and in the middle With Out Screen - Black",/-/en/Huawei-Prime-GKK-Degree-pieces/dp/B0854KFXF9/ref=sr_1_5152?m=A1ZVRGNO5AYLOV&qid=1652830150&refinements=p_6%3AA1ZVRGNO5AYLOV&s=electronics&sr=1-5152,EGP 118.64,,,
"Hoco PH39 - Daring Desktop Holder Stand For Magsafe, Compatible with iPhone 12/13 - Silver",/-/en/Hoco-PH39-Desktop-Magsafe-Compatible/dp/B09BM4S957/ref=sr_1_5153?m=A1ZVRGNO5AYLOV&qid=1652830150&refinements=p_6%3AA1ZVRGNO5AYLOV&s=electronics&sr=1-5153,EGP 266.96,,,
Clear View Standing mirror With Out Sensor Not Smart For Oppo F7 - Black,/-/en/Clear-Standing-mirror-Sensor-Smart/dp/B093FSYQLJ/ref=sr_1_5154?m=A1ZVRGNO5AYLOV&qid=1652830150&refinements=p_6%3AA1ZVRGNO5AYLOV&s=electronics&sr=1-5154,EGP 125.00,,,
Mobile Screen 9D Ceramic Matte screen protector For Xiaomi Redmi Note 8  - Black,/-/en/Mobile-Screen-Ceramic-screen-protector/dp/B08X6DYYQG/ref=sr_1_5155?m=A1ZVRGNO5AYLOV&qid=1652830150&refinements=p_6%3AA1ZVRGNO5AYLOV&s=electronics&sr=1-5155,EGP 32.86,,,
High Quality Glass Screen Protector For Huawei Y6p - Clear Black,/-/en/Quality-Glass-Screen-Protector-Huawei/dp/B09R525MMH/ref=sr_1_5156?m=A1ZVRGNO5AYLOV&qid=1652830150&refinements=p_6%3AA1ZVRGNO5AYLOV&s=electronics&sr=1-5156,EGP 29.18,,,
Screen protector nano ceramic anti-fingerprint and anti-breakage for Samsung A12,/-/en/protector-ceramic-anti-fingerprint-anti-breakage-Samsung/dp/B096L8F7DW/ref=sr_1_5157?m=A1ZVRGNO5AYLOV&qid=1652830150&refinements=p_6%3AA1ZVRGNO5AYLOV&s=electronics&sr=1-5157,EGP 24.00,,,
"Gelatin Full Cover Screen Protector For Sony Xperia XA1 Ultra, Clear",/-/en/Gelatin-Cover-Screen-Protector-Xperia/dp/B08YXX4BFS/ref=sr_1_5158?m=A1ZVRGNO5AYLOV&qid=1652830150&refinements=p_6%3AA1ZVRGNO5AYLOV&s=electronics&sr=1-5158,EGP 40.14,,,
Laptop Adaptor Charger Fujitsu 20v/3.25A (5.5 * 2.2) - Admin,/-/en/Laptop-Adaptor-Charger-Fujitsu-3-25A/dp/B09QT4WB53/ref=sr_1_5159?m=A1ZVRGNO5AYLOV&qid=1652830150&refinements=p_6%3AA1ZVRGNO5AYLOV&s=electronics&sr=1-5159,EGP 164.16,,,
screen protection mobile samsung A52,/-/en/screen-protection-mobile-samsung-A52/dp/B096R2358C/ref=sr_1_5160?m=A1ZVRGNO5AYLOV&qid=1652830150&refinements=p_6%3AA1ZVRGNO5AYLOV&s=electronics&sr=1-5160,EGP 24.00,,,
For Realme 7 pro Clear View Stand Mirro Case Flip Phone Cover Not Smart - Black,/-/en/Realme-Clear-Stand-Mirro-Phone/dp/B08Y8XC8DK/ref=sr_1_5161?m=A1ZVRGNO5AYLOV&qid=1652830151&refinements=p_6%3AA1ZVRGNO5AYLOV&s=electronics&sr=1-5161,EGP 70.00,,,
RINCO FULL TEMPERED GLASS SCREEN PROTECTOR FOR HUAWEI GR3 2017 (P8 LITE/HONOR 8 LITE) GOLD,/-/en/RINCO-TEMPERED-SCREEN-PROTECTOR-HUAWEI/dp/B08YY36RKK/ref=sr_1_5162?m=A1ZVRGNO5AYLOV&qid=1652830151&refinements=p_6%3AA1ZVRGNO5AYLOV&s=electronics&sr=1-5162,EGP 21.00,,,
Redmi Note 9s / Note 9 Pro High Qulity 10D Unicorn Tempered Glass Screen Protector - Black,/-/en/Qulity-Unicorn-Tempered-Screen-Protector/dp/B08Y8YYV5F/ref=sr_1_5163?m=A1ZVRGNO5AYLOV&qid=1652830151&refinements=p_6%3AA1ZVRGNO5AYLOV&s=electronics&sr=1-5163,EGP 40.00,,,
Full Body iPhone 7 Screen Protector 360 Degree Jelatin - Clear anti scratch,/-/en/iPhone-Screen-Protector-Degree-Jelatin/dp/B08YY3TSN5/ref=sr_1_5164?m=A1ZVRGNO5AYLOV&qid=1652830151&refinements=p_6%3AA1ZVRGNO5AYLOV&s=electronics&sr=1-5164,EGP 35.20,,,
"Hoco NZ2 - Link PD 30W USB-A & Type-C Ports Fast Car Charger Set With Type-C Cable (1m), Support QC3.0 AFC FCP SCP Fast Charing Protocols, Compatible With iPhone Samsung Xiaomi Oppo Huawei - White",/-/en/Hoco-NZ2-USB-Protocols-Compatible/dp/B09QJS9WFV/ref=sr_1_5165?m=A1ZVRGNO5AYLOV&qid=1652830151&refinements=p_6%3AA1ZVRGNO5AYLOV&s=electronics&sr=1-5165,EGP 159.00,EGP 174.82,,
Clear View Standing Mirror For Samsung Note A71 Without Sensor - Black,/-/en/Standing-Mirror-Samsung-Without-Sensor/dp/B08ZXHP8D3/ref=sr_1_5166?m=A1ZVRGNO5AYLOV&qid=1652830151&refinements=p_6%3AA1ZVRGNO5AYLOV&s=electronics&sr=1-5166,EGP 64.99,,,
Great Case Apple Stainless Steel Watch Band 38/40 mm For Apple Watch-Rose Gold,/-/en/Great-Case-Apple-Stainless-Watch-Rose/dp/B09P5JK3XJ/ref=sr_1_5167?m=A1ZVRGNO5AYLOV&qid=1652830151&refinements=p_6%3AA1ZVRGNO5AYLOV&s=electronics&sr=1-5167,EGP 176.00,,,
Lens Camera Screen Protecor Glass Flexable With Nano Technology For Samsung Galaxy S20 Ultra - Clear,/-/en/Camera-Protecor-Flexable-Technology-Samsung/dp/B091J68H79/ref=sr_1_5168?m=A1ZVRGNO5AYLOV&qid=1652830151&refinements=p_6%3AA1ZVRGNO5AYLOV&s=electronics&sr=1-5168,EGP 16.50,EGP 18.43,Limited time deal,
Anti Shock Four Angles Protection Transparent Hard Back Cover With Colored Silicone Edges For iPhone 7 & iPhone 8 - Clear & Blue,/-/en/Angles-Protection-Transparent-Colored-Silicone/dp/B08X64T5J6/ref=sr_1_5169?m=A1ZVRGNO5AYLOV&qid=1652830151&refinements=p_6%3AA1ZVRGNO5AYLOV&s=electronics&sr=1-5169,EGP 48.00,,,
Tempered Glass Screen Protector For Oppo Find X / 5D - Black,/-/en/Tempered-Glass-Screen-Protector-Oppo/dp/B08YY2T5SY/ref=sr_1_5170?m=A1ZVRGNO5AYLOV&qid=1652830151&refinements=p_6%3AA1ZVRGNO5AYLOV&s=electronics&sr=1-5170,EGP 16.50,EGP 18.43,Limited time deal,
"SP Portable Hard Drive Armor A30_Shockproof, 2TB USB 3.1-White, Cable carry desing, Anti-scratching and slip",/-/en/SP-Portable-A30_Shockproof-3-1-White-Anti-scratching/dp/B00KQ137CG/ref=sr_1_5171?m=A1ZVRGNO5AYLOV&qid=1652830151&refinements=p_6%3AA1ZVRGNO5AYLOV&s=electronics&sr=1-5171,"EGP 1,332.16",,,
iPaky Bundle Of 360 Degree Full Protection Front & Back Cover With Plastic Screen Protector For Samsung Galaxy Note 4 - Black,/-/en/iPaky-Protection-Plastic-Protector-Samsung/dp/B08WJNHQW4/ref=sr_1_5172?m=A1ZVRGNO5AYLOV&qid=1652830151&refinements=p_6%3AA1ZVRGNO5AYLOV&s=electronics&sr=1-5172,EGP 64.00,,,
"Glass Screen Protector for Samsung Galaxy S8 Plus, Black",/-/en/Glass-Screen-Protector-Samsung-Galaxy/dp/B08YY2Q4KL/ref=sr_1_5173?m=A1ZVRGNO5AYLOV&qid=1652830151&refinements=p_6%3AA1ZVRGNO5AYLOV&s=electronics&sr=1-5173,EGP 10.00,,,
Back Cover for Sony Xperia XA Ultra,/-/en/Back-Cover-Sony-Xperia-Ultra/dp/B08ZY1V1NL/ref=sr_1_5174?m=A1ZVRGNO5AYLOV&qid=1652830151&refinements=p_6%3AA1ZVRGNO5AYLOV&s=electronics&sr=1-5174,EGP 43.49,,,
Spigen Ultra Hybrid Mag Case Compatible with iPhone 13 - White,/-/en/Spigen-Ultra-Hybrid-Compatible-iPhone/dp/B096J4N95B/ref=sr_1_5175?m=A1ZVRGNO5AYLOV&qid=1652830151&refinements=p_6%3AA1ZVRGNO5AYLOV&s=electronics&sr=1-5175,"EGP 1,060.49",,,4.5 out of 5 stars
For Apple iPhone 12/12 Pro 6.1 Flip Slim Case Leather Smart Clear View S Window internal PU cover - Black,/-/en/Apple-iPhone-Leather-Window-internal/dp/B091J6P8X8/ref=sr_1_5176?m=A1ZVRGNO5AYLOV&qid=1652830151&refinements=p_6%3AA1ZVRGNO5AYLOV&s=electronics&sr=1-5176,EGP 83.20,,,
Clear View Standing mirror With Out Sensor Not Smart For Huawei Nova 7 - Black,/-/en/Clear-Standing-mirror-Sensor-Huawei/dp/B08ZXWP8GW/ref=sr_1_5177?m=A1ZVRGNO5AYLOV&qid=1652830151&refinements=p_6%3AA1ZVRGNO5AYLOV&s=electronics&sr=1-5177,EGP 112.30,,,
Privacy screen For For Samsung galaxy a71,/-/en/Privacy-screen-Samsung-galaxy-a71/dp/B08X68Q985/ref=sr_1_5178?m=A1ZVRGNO5AYLOV&qid=1652830151&refinements=p_6%3AA1ZVRGNO5AYLOV&s=electronics&sr=1-5178,EGP 54.85,EGP 63.82,,
"iPad Screen Protector, Tempered Glass Screen Protector Film for Apple iPad 2/3/4",/-/en/Screen-Protector-Tempered-Glass-Apple/dp/B0922X77QM/ref=sr_1_5179?m=A1ZVRGNO5AYLOV&qid=1652830151&refinements=p_6%3AA1ZVRGNO5AYLOV&s=electronics&sr=1-5179,EGP 40.00,,,
"9D Glass Tempered Screen Protector Laser Cut, Full Glue, 9H Hardness, Easy Installation Scratch Resistant for Oppo Reno 2F - Black",/-/en/Tempered-Protector-Hardness-Installation-Resistant/dp/B08X5Z2HCJ/ref=sr_1_5180?m=A1ZVRGNO5AYLOV&qid=1652830151&refinements=p_6%3AA1ZVRGNO5AYLOV&s=electronics&sr=1-5180,EGP 21.25,,,
Kisonli T-007 USB Computer Speaker,/-/en/Kisonli-T-007-USB-Computer-Speaker/dp/B09SLVZGNZ/ref=sr_1_5181?m=A1ZVRGNO5AYLOV&qid=1652830151&refinements=p_6%3AA1ZVRGNO5AYLOV&s=electronics&sr=1-5181,EGP 205.64,,,
Bingo 9H Screen Protector For Samsung Galaxy S10 5G (6.7 inches) - Clear,/-/en/Bingo-Screen-Protector-Samsung-Galaxy/dp/B0994Q2LMN/ref=sr_1_5182?m=A1ZVRGNO5AYLOV&qid=1652830151&refinements=p_6%3AA1ZVRGNO5AYLOV&s=electronics&sr=1-5182,EGP 41.26,,Limited time deal,
House Of Marley Em-Je041-Fi Smile Jamaica Wired In-Ear Headphones with In-Line Microphone - Multicolor,/-/en/Marley-Em-Je041-Fi-Jamaica-Headphones-Microphone/dp/B00LFPIKCY/ref=sr_1_5183?m=A1ZVRGNO5AYLOV&qid=1652830151&refinements=p_6%3AA1ZVRGNO5AYLOV&s=electronics&sr=1-5183,EGP 584.22,,,
ِAnker Soundcore Flare 360 sound,/-/en/%D9%90Anker-Soundcore-Flare-360-sound/dp/B07RRVRJHF/ref=sr_1_5184?m=A1ZVRGNO5AYLOV&qid=1652830151&refinements=p_6%3AA1ZVRGNO5AYLOV&s=electronics&sr=1-5184,"EGP 1,302.57",,,
5D Screen Protector For Huawei P30 Lite - Black,/-/en/Screen-Protector-Huawei-P30-Lite/dp/B08X6N44J5/ref=sr_1_5185?m=A1ZVRGNO5AYLOV&qid=1652830152&refinements=p_6%3AA1ZVRGNO5AYLOV&s=electronics&sr=1-5185,EGP 27.64,,,
samsung Galaxy s7 edge - Anti-Burst case king kong armor protection - clear,/-/en/samsung-Galaxy-edge-Anti-Burst-protection/dp/B08XRRVX51/ref=sr_1_5186?m=A1ZVRGNO5AYLOV&qid=1652830152&refinements=p_6%3AA1ZVRGNO5AYLOV&s=electronics&sr=1-5186,EGP 39.94,,,
UGREEN CM101 Micro HDMI to HDMI VGA Converter,/-/en/UGREEN-CM101-Micro-HDMI-Converter/dp/B096ZR6Y2T/ref=sr_1_5187?m=A1ZVRGNO5AYLOV&qid=1652830152&refinements=p_6%3AA1ZVRGNO5AYLOV&s=electronics&sr=1-5187,EGP 434.78,,,
WIFI TP-LINK Archer T600U Nano,/-/en/WIFI-TP-LINK-Archer-T600U-Nano/dp/B07ZL4M5JJ/ref=sr_1_5188?m=A1ZVRGNO5AYLOV&qid=1652830152&refinements=p_6%3AA1ZVRGNO5AYLOV&s=electronics&sr=1-5188,EGP 296.00,,,
Pikachu Charger Protector With Cable Bite Silicone (USB Type C - Charger Size: 27x42mm) - Multi Color,/-/en/Pikachu-Charger-Protector-Cable-Silicone/dp/B09TCV7RN2/ref=sr_1_5189?m=A1ZVRGNO5AYLOV&qid=1652830152&refinements=p_6%3AA1ZVRGNO5AYLOV&s=electronics&sr=1-5189,EGP 92.85,,,
Case Logic CECS-102 Era DSLR/Mirrorless Camera Bag - Grey and Black,/-/en/Case-Logic-CECS-102-Mirrorless-Camera/dp/B09BSQTXB9/ref=sr_1_5190?m=A1ZVRGNO5AYLOV&qid=1652830152&refinements=p_6%3AA1ZVRGNO5AYLOV&s=electronics&sr=1-5190,EGP 704.01,,,4.5 out of 5 stars
Dragon Anti Fingerprint 5D Tempered Glass Screen Protector for Samsung Galaxy A6 Plus - Black and Clear,/-/en/Dragon-Fingerprint-Tempered-Protector-Samsung/dp/B08WJMQ577/ref=sr_1_5191?m=A1ZVRGNO5AYLOV&qid=1652830152&refinements=p_6%3AA1ZVRGNO5AYLOV&s=electronics&sr=1-5191,EGP 41.26,EGP 48.00,Limited time deal,
Back Cover Hard Slim Case with Camera Shield For Iphone 11 - Clear,/-/en/Back-Cover-Camera-Shield-Iphone/dp/B09P5HSL27/ref=sr_1_5192?m=A1ZVRGNO5AYLOV&qid=1652830152&refinements=p_6%3AA1ZVRGNO5AYLOV&s=electronics&sr=1-5192,EGP 72.00,,,
Moxom MX-WL04 In Ear Single Bluetooth Sport TWS Wireless Earphone - White,/-/en/Moxom-MX-WL04-Bluetooth-Wireless-Earphone/dp/B0976H8H6D/ref=sr_1_5193?m=A1ZVRGNO5AYLOV&qid=1652830152&refinements=p_6%3AA1ZVRGNO5AYLOV&s=electronics&sr=1-5193,EGP 240.00,,,
"Fashion Case Back Cover Hard Case For Xiaomi Redmi Note 10s, Xiaomi Redmi Note 10 - Clear Blue",/-/en/Fashion-Case-Cover-Xiaomi-Redmi/dp/B09P5FCGDC/ref=sr_1_5194?m=A1ZVRGNO5AYLOV&qid=1652830152&refinements=p_6%3AA1ZVRGNO5AYLOV&s=electronics&sr=1-5194,EGP 56.00,,,
"Arctic Hunter XB00115 One Strap BackPack With USB Charging Port, Combination Lock And Rain Protection - Grey",/-/en/Arctic-Hunter-BackPack-Combination-Protection/dp/B09RZ89SSR/ref=sr_1_5195?m=A1ZVRGNO5AYLOV&qid=1652830152&refinements=p_6%3AA1ZVRGNO5AYLOV&s=electronics&sr=1-5195,EGP 668.17,,,
HP 2HU82AA Wireless Mouse - Black,/-/en/HP-2HU82AA-Wireless-Mouse-Black/dp/B07NF9JGGZ/ref=sr_1_5196?m=A1ZVRGNO5AYLOV&qid=1652830152&refinements=p_6%3AA1ZVRGNO5AYLOV&s=electronics&sr=1-5196,EGP 326.86,,,
Bingo 9D Full Covered Tempered Glass Screen Protector 5.8 Inches For iPhone X & iPhone XS - Clear Black,/-/en/Bingo-Covered-Tempered-Screen-Protector/dp/B08YY2W9N4/ref=sr_1_5197?m=A1ZVRGNO5AYLOV&qid=1652830152&refinements=p_6%3AA1ZVRGNO5AYLOV&s=electronics&sr=1-5197,EGP 82.12,,,
Clear View Standing mirror Cover For Samsung a7-2018 / a750 - Blue,/-/en/Clear-Standing-mirror-Samsung-a7-2018/dp/B096QZ9CSY/ref=sr_1_5198?m=A1ZVRGNO5AYLOV&qid=1652830152&refinements=p_6%3AA1ZVRGNO5AYLOV&s=electronics&sr=1-5198,EGP 85.97,,,
Camera Lens Protector for Huawie nova 7 HD Clear 9H Glass Lens Screen Protector for huawei nova7,/-/en/Camera-Protector-Huawie-Screen-huawei/dp/B091NYFNF9/ref=sr_1_5199?m=A1ZVRGNO5AYLOV&qid=1652830152&refinements=p_6%3AA1ZVRGNO5AYLOV&s=electronics&sr=1-5199,EGP 31.57,,,
2 in 1 Nillkin High-technology Wireless Phone Charger Table Lamp for Samsung IPhone,/-/en/Nillkin-High-technology-Wireless-Charger-Samsung/dp/B00PKF3D2C/ref=sr_1_5200?m=A1ZVRGNO5AYLOV&qid=1652830152&refinements=p_6%3AA1ZVRGNO5AYLOV&s=electronics&sr=1-5200,EGP 640.01,,,
Moxom MX-EP16 Wired In Ear Earphone With Microphone - Black,/-/en/Moxom-MX-EP16-Wired-Earphone-Microphone/dp/B0976F2D6W/ref=sr_1_5201?m=A1ZVRGNO5AYLOV&qid=1652830152&refinements=p_6%3AA1ZVRGNO5AYLOV&s=electronics&sr=1-5201,EGP 40.00,,,
stretchable Professional Mobile Phone Finger Pubg Gaming Gloves Touch Screen Thumb Sleeve for Fortnite Breathable Finger Controller ( 1 Set ) Grey color,/-/en/stretchable-Professional-Fortnite-Breathable-Controller/dp/B08YNSLMW6/ref=sr_1_5202?m=A1ZVRGNO5AYLOV&qid=1652830152&refinements=p_6%3AA1ZVRGNO5AYLOV&s=electronics&sr=1-5202,EGP 25.00,,,
"Keendex Kx2253 6.35 mm Male to 6.35 mm Male Audio Cable, 4.2 m - Gray",/-/en/Keendex-Kx2253-6-35-Audio-Cable/dp/B095Q1DCF5/ref=sr_1_5203?m=A1ZVRGNO5AYLOV&qid=1652830152&refinements=p_6%3AA1ZVRGNO5AYLOV&s=electronics&sr=1-5203,EGP 398.40,,,
Gorilla Cover from BASEUS for Samsung Galaxy S8 Plus - Clear,/-/en/Gorilla-Cover-BASEUS-Samsung-Galaxy/dp/B0937GVY3G/ref=sr_1_5204?m=A1ZVRGNO5AYLOV&qid=1652830152&refinements=p_6%3AA1ZVRGNO5AYLOV&s=electronics&sr=1-5204,EGP 25.61,,,
Hikvision microSDHC UHS-I 92 MB/s Card with Adapter 32GB,/-/en/Hikvision-microSDHC-UHS-I-Card-Adapter/dp/B086CH21GM/ref=sr_1_5205?m=A1ZVRGNO5AYLOV&qid=1652830152&refinements=p_6%3AA1ZVRGNO5AYLOV&s=electronics&sr=1-5205,EGP 74.96,EGP 75.34,,
iPhone 7 Anti-Spy Privacy Tempered GLASS Screen Protector,/-/en/iPhone-Anti-Spy-Privacy-Tempered-Protector/dp/B08Y8VMRFY/ref=sr_1_5206?m=A1ZVRGNO5AYLOV&qid=1652830152&refinements=p_6%3AA1ZVRGNO5AYLOV&s=electronics&sr=1-5206,EGP 51.00,,,
GKK 360 Degree Protection Back Cover for iPhone 8 Plus - Black and Blue,/-/en/GKK-Degree-Protection-Cover-iPhone/dp/B08X6T4QYY/ref=sr_1_5207?m=A1ZVRGNO5AYLOV&qid=1652830152&refinements=p_6%3AA1ZVRGNO5AYLOV&s=electronics&sr=1-5207,EGP 97.19,,Limited time deal,
Clear screen protector For realme X2 pro,/-/en/Clear-screen-protector-realme-pro/dp/B08X6CGFBK/ref=sr_1_5208?m=A1ZVRGNO5AYLOV&qid=1652830152&refinements=p_6%3AA1ZVRGNO5AYLOV&s=electronics&sr=1-5208,EGP 28.80,,,
Auto Focus TPU Silicone Back Cover For Realme 6 - Navy,/-/en/Auto-Focus-Silicone-Cover-Realme/dp/B08X6HF4CV/ref=sr_1_5209?m=A1ZVRGNO5AYLOV&qid=1652830153&refinements=p_6%3AA1ZVRGNO5AYLOV&s=electronics&sr=1-5209,EGP 20.63,,,
"Full Coverage Galaxy S8 Plus Screen Protector, Tempered Glass Screen (Black)",/-/en/Coverage-Galaxy-Screen-Protector-Tempered/dp/B08Z4B4Q1W/ref=sr_1_5210?m=A1ZVRGNO5AYLOV&qid=1652830153&refinements=p_6%3AA1ZVRGNO5AYLOV&s=electronics&sr=1-5210,EGP 48.00,,,
Nokia 6.1 Plus (X6) Tempered Glass Screen Protector,/-/en/Nokia-Tempered-Glass-Screen-Protector/dp/B08Y8YXZC2/ref=sr_1_5211?m=A1ZVRGNO5AYLOV&qid=1652830153&refinements=p_6%3AA1ZVRGNO5AYLOV&s=electronics&sr=1-5211,EGP 24.00,,,
Boter 3D Back Cover Hard Slim Protection Case For Oppo Realme 6i - Multi Color,/-/en/Boter-Back-Cover-Protection-Realme/dp/B08ZXJKJXP/ref=sr_1_5212?m=A1ZVRGNO5AYLOV&qid=1652830153&refinements=p_6%3AA1ZVRGNO5AYLOV&s=electronics&sr=1-5212,EGP 19.00,,,
"9D Glass Tempered Screen Protector Laser Cut, Full Glue, 9H Hardness, Easy Installation Scratch Resistant for Realme 6i - Black",/-/en/Tempered-Protector-Hardness-Installation-Resistant/dp/B08X5XDPSR/ref=sr_1_5213?m=A1ZVRGNO5AYLOV&qid=1652830153&refinements=p_6%3AA1ZVRGNO5AYLOV&s=electronics&sr=1-5213,EGP 21.25,,,
Tempered Glass Screen Protector for SAMSUNG GALAXY A70 (2 PACK),/-/en/Tempered-Screen-Protector-SAMSUNG-GALAXY/dp/B091J83LDM/ref=sr_1_5214?m=A1ZVRGNO5AYLOV&qid=1652830153&refinements=p_6%3AA1ZVRGNO5AYLOV&s=electronics&sr=1-5214,EGP 48.00,,,
High Quality Glass Screen Protector For Realme X50 Pro - Clear Black,/-/en/Quality-Glass-Screen-Protector-Realme/dp/B09R51TQ8P/ref=sr_1_5215?m=A1ZVRGNO5AYLOV&qid=1652830153&refinements=p_6%3AA1ZVRGNO5AYLOV&s=electronics&sr=1-5215,EGP 29.18,,,
Screen Protector 9D for Nokia 3.2 Plus Full cover with Black Edge,/-/en/Screen-Protector-Nokia-cover-Black/dp/B091D7Q6B4/ref=sr_1_5216?m=A1ZVRGNO5AYLOV&qid=1652830153&refinements=p_6%3AA1ZVRGNO5AYLOV&s=electronics&sr=1-5216,EGP 28.80,,,
"UGREEN USB C Cable 1M USB A to Type C Cable Nylon Braided Fast Charger Compatible with Samsung Galaxy S21, Note 20, MacBook Pro, Nintendo Switch, Huawei, iPad mini 6, GoPro Hero 7,PS5 Controller, etc",/-/en/UGREEN-Braided-Compatible-Nintendo-Controller/dp/B07RZK1ZV4/ref=sr_1_5217?m=A1ZVRGNO5AYLOV&qid=1652830153&refinements=p_6%3AA1ZVRGNO5AYLOV&s=electronics&sr=1-5217,EGP 94.37,,,4.4 out of 5 stars
Anti Burst And Scratch Professional Protection Transparent Back Cover For Xiaomi Redmi 8 - Clear,/-/en/Scratch-Professional-Protection-Transparent-Xiaomi/dp/B08X65RMVD/ref=sr_1_5218?m=A1ZVRGNO5AYLOV&qid=1652830153&refinements=p_6%3AA1ZVRGNO5AYLOV&s=electronics&sr=1-5218,EGP 48.13,EGP 51.10,Limited time deal,
Manhattan 179607 In-Ear Sport Wired Headphones with Built-in Microphone - noise-isolating Earphone - Black,/-/en/Manhattan-179607-Headphones-Built-Microphone/dp/B098164N22/ref=sr_1_5219?m=A1ZVRGNO5AYLOV&qid=1652830153&refinements=p_6%3AA1ZVRGNO5AYLOV&s=electronics&sr=1-5219,EGP 76.82,,,
Hoco N9 - Especial single port charger and cable (2.1A - 1M) - Micro-USB For Samsung Huawei Xiaomi Oppo - White,/-/en/Hoco-N9-Especial-charger-Micro-USB/dp/B0979W4CWS/ref=sr_1_5220?m=A1ZVRGNO5AYLOV&qid=1652830153&refinements=p_6%3AA1ZVRGNO5AYLOV&s=electronics&sr=1-5220,EGP 95.25,,,
Apple Iphone XS Max Anti-peep Full Screen Tempered Glass Protector -Black,/-/en/Iphone-Anti-peep-Screen-Tempered-Protector/dp/B08Y8XMSZ2/ref=sr_1_5221?m=A1ZVRGNO5AYLOV&qid=1652830153&refinements=p_6%3AA1ZVRGNO5AYLOV&s=electronics&sr=1-5221,EGP 25.62,,,
King Kong Armor Cover For Huawei P40 Pro - Clear,/-/en/King-Kong-Armor-Cover-Huawei/dp/B098172273/ref=sr_1_5222?m=A1ZVRGNO5AYLOV&qid=1652830153&refinements=p_6%3AA1ZVRGNO5AYLOV&s=electronics&sr=1-5222,EGP 28.00,,,
Nillkin Flex Pure Case for Samsung Galaxy S20 - Red,/-/en/Nillkin-Flex-Pure-Samsung-Galaxy/dp/B085N2JTBV/ref=sr_1_5223?m=A1ZVRGNO5AYLOV&qid=1652830153&refinements=p_6%3AA1ZVRGNO5AYLOV&s=electronics&sr=1-5223,EGP 39.00,,,
