Name,Link,Price,OldPrice,BestSeller,Stars
Baseus Flash Series One-for-three Fast Charging Data Cable USB to M+L+C 66W 1.2m - Green,/-/en/Baseus-Flash-three-Charging-Cable/dp/B00KUWKDK0/ref=sr_1_9385?m=A1ZVRGNO5AYLOV&qid=1653130348&refinements=p_6%3AA1ZVRGNO5AYLOV&s=electronics&sr=1-9385,EGP 183.55,,,
"Yesido YSW-02 Wireless Bluetooth Speaker, 10 w - Black",/-/en/Yesido-YSW-02-Wireless-Bluetooth-Speaker/dp/B08X5Y3RCQ/ref=sr_1_9386?m=A1ZVRGNO5AYLOV&qid=1653130348&refinements=p_6%3AA1ZVRGNO5AYLOV&s=electronics&sr=1-9386,EGP 352.00,,,
"360 Degree Full Cover Gelatin Screen Protector for Infinix Zero 8 Mobile Phone, Set of 2 - Clear",/-/en/Degree-Gelatin-Screen-Protector-Infinix/dp/B095Q11XQW/ref=sr_1_9387?m=A1ZVRGNO5AYLOV&qid=1653130348&refinements=p_6%3AA1ZVRGNO5AYLOV&s=electronics&sr=1-9387,EGP 72.00,,,
Screen Gelatin 360 degree protection for iPhone 12 phones - Transparent,/-/en/Screen-Gelatin-degree-protection-iPhone/dp/B08ZXZBWK3/ref=sr_1_9388?m=A1ZVRGNO5AYLOV&qid=1653130348&refinements=p_6%3AA1ZVRGNO5AYLOV&s=electronics&sr=1-9388,EGP 56.00,,,
Hoco X61 - Ultimate Silicone Charging And Data Transmittion Cable (3A - 1M) - Type-C Plug For Samsung Huawei Xiaomi Oppo - Black,/-/en/Hoco-X61-Ultimate-Silicone-Transmittion/dp/B09HL7YJ6Q/ref=sr_1_9389?m=A1ZVRGNO5AYLOV&qid=1653130348&refinements=p_6%3AA1ZVRGNO5AYLOV&s=electronics&sr=1-9389,EGP 52.86,,,
X-level Metalic Back Cover For Huawei Y9 2018 - Black,/-/en/X-level-Metalic-Back-Cover-Huawei/dp/B091NYW7F4/ref=sr_1_9390?m=A1ZVRGNO5AYLOV&qid=1653130348&refinements=p_6%3AA1ZVRGNO5AYLOV&s=electronics&sr=1-9390,EGP 28.09,,,
Armor Anti Shock Screen Protector For Sony Xperia L1,/-/en/Armor-Shock-Screen-Protector-Xperia/dp/B08Z49LP4P/ref=sr_1_9391?m=A1ZVRGNO5AYLOV&qid=1653130348&refinements=p_6%3AA1ZVRGNO5AYLOV&s=electronics&sr=1-9391,EGP 91.20,,,
Huawei Honor 7 Tempered Glass Screen Protector Film 0.3mm,/-/en/Huawei-Honor-Tempered-Screen-Protector/dp/B08Y8YXZ5K/ref=sr_1_9392?m=A1ZVRGNO5AYLOV&qid=1653130348&refinements=p_6%3AA1ZVRGNO5AYLOV&s=electronics&sr=1-9392,EGP 26.74,,,
Auto Focus Rubber Back Cover Slim Case For Nokia 2.3 - Black,/-/en/Auto-Focus-Rubber-Cover-Nokia/dp/B091NZ5THK/ref=sr_1_9393?m=A1ZVRGNO5AYLOV&qid=1653130348&refinements=p_6%3AA1ZVRGNO5AYLOV&s=electronics&sr=1-9393,EGP 25.79,,,
"Dragon Glass 10D Screen Protector for iPhone XS Max and iPhone 11 Pro Max Mobile Phones, Set of 3 - Black",/-/en/Dragon-Screen-Protector-iPhone-Mobile/dp/B091Q7BYCX/ref=sr_1_9394?m=A1ZVRGNO5AYLOV&qid=1653130348&refinements=p_6%3AA1ZVRGNO5AYLOV&s=electronics&sr=1-9394,EGP 96.00,,,
Silicon Back Cover Slim Case Net Design For Huawei Y9 2019 - Blue,/-/en/Silicon-Back-Cover-Design-Huawei/dp/B09P5H8VG4/ref=sr_1_9395?m=A1ZVRGNO5AYLOV&qid=1653130348&refinements=p_6%3AA1ZVRGNO5AYLOV&s=electronics&sr=1-9395,EGP 39.98,,,
2Pack Tempered Glass Screen Protector For Samsung Galaxy M30S,/-/en/Tempered-Glass-Screen-Protector-Samsung/dp/B091Q6V78N/ref=sr_1_9396?m=A1ZVRGNO5AYLOV&qid=1653130348&refinements=p_6%3AA1ZVRGNO5AYLOV&s=electronics&sr=1-9396,EGP 40.13,,,
9D Ceramics Screen Protection For Huawei P20 Lite & Huawei Nova 3e,/-/en/Ceramics-Screen-Protection-Huawei-Lite/dp/B09BDFX9QQ/ref=sr_1_9397?m=A1ZVRGNO5AYLOV&qid=1653130348&refinements=p_6%3AA1ZVRGNO5AYLOV&s=electronics&sr=1-9397,EGP 13.20,EGP 14.74,Limited time deal,
For OnePlus 7 Mocolo Screen Protector,/-/en/OnePlus-Mocolo-Screen-Protector/dp/B0966S3X9M/ref=sr_1_9398?m=A1ZVRGNO5AYLOV&qid=1653130348&refinements=p_6%3AA1ZVRGNO5AYLOV&s=electronics&sr=1-9398,EGP 29.73,,,
UGREEN HDMI to DVI Cable Bi Directional DVI-D 24+1 Male to HDMI Male High Speed Adapter Cable Support,/-/en/UGREEN-Cable-Directional-Adapter-Support/dp/B00B2HOKCY/ref=sr_1_9399?m=A1ZVRGNO5AYLOV&qid=1653130348&refinements=p_6%3AA1ZVRGNO5AYLOV&s=electronics&sr=1-9399,EGP 152.77,,,4.5 out of 5 stars
Mobile Screen 9H Nano Screen Protector For Xiaomi Mi A3 - Clear,/-/en/Mobile-Screen-Nano-Protector-Xiaomi/dp/B08X6J5HMY/ref=sr_1_9400?m=A1ZVRGNO5AYLOV&qid=1653130348&refinements=p_6%3AA1ZVRGNO5AYLOV&s=electronics&sr=1-9400,EGP 23.36,,,
For Oppo Reno 4 HoneyComb Shockproof Frame TPU hard PC Clear Case Cover-Red,/-/en/HoneyComb-Shockproof-Frame-Clear-Cover-Red/dp/B08YXXWH6F/ref=sr_1_9401?m=A1ZVRGNO5AYLOV&qid=1653130348&refinements=p_6%3AA1ZVRGNO5AYLOV&s=electronics&sr=1-9401,EGP 35.21,EGP 40.00,,
Temax Tempered Glass Screen Protector for Oppo A59 / F1S,/-/en/Temax-Tempered-Glass-Screen-Protector/dp/B08YY1RD7N/ref=sr_1_9402?m=A1ZVRGNO5AYLOV&qid=1653130348&refinements=p_6%3AA1ZVRGNO5AYLOV&s=electronics&sr=1-9402,EGP 19.20,,,
High Quality Set Of 3 Glass Screen Protectors For Nokia 8 - Clear Black,/-/en/Quality-Glass-Screen-Protectors-Nokia/dp/B09R52CZNP/ref=sr_1_9403?m=A1ZVRGNO5AYLOV&qid=1653130348&refinements=p_6%3AA1ZVRGNO5AYLOV&s=electronics&sr=1-9403,EGP 65.66,,,
Screen Nano ceramic anti-fingerprint Realme C15,/-/en/Screen-Nano-ceramic-anti-fingerprint-Realme/dp/B08YNMV1G6/ref=sr_1_9404?m=A1ZVRGNO5AYLOV&qid=1653130348&refinements=p_6%3AA1ZVRGNO5AYLOV&s=electronics&sr=1-9404,EGP 21.90,,,
"Outbox Charger with Dual USB Port, 36 Watt - Black",/-/en/Outbox-Charger-Dual-Port-Watt/dp/B08YY279VM/ref=sr_1_9405?m=A1ZVRGNO5AYLOV&qid=1653130348&refinements=p_6%3AA1ZVRGNO5AYLOV&s=electronics&sr=1-9405,EGP 306.18,,,
Slim Hard Back Cover with Slide Camera Shield for Huawei Nova7i/Nova6 SE/P40 Lite4G Turquoise,/-/en/Camera-Shield-Huawei-Nova7i-Turquoise/dp/B09F3SJD34/ref=sr_1_9406?m=A1ZVRGNO5AYLOV&qid=1653130348&refinements=p_6%3AA1ZVRGNO5AYLOV&s=electronics&sr=1-9406,EGP 62.75,,,
Anti Shock Four Angles Protection Transparent Hard Back Cover With Colored Silicone Edges For Samsung Galaxy S10e - Clear & Red & Black,/-/en/Protection-Transparent-Colored-Silicone-Samsung/dp/B08X6V6LLD/ref=sr_1_9407?m=A1ZVRGNO5AYLOV&qid=1653130348&refinements=p_6%3AA1ZVRGNO5AYLOV&s=electronics&sr=1-9407,EGP 19.00,,,
Screen Protectors Glass Gazelle brand w Screen Carbon Back For Samsung Galaxy M51,/-/en/Screen-Protectors-Gazelle-Carbon-Samsung/dp/B0923FK1JT/ref=sr_1_9408?m=A1ZVRGNO5AYLOV&qid=1653130348&refinements=p_6%3AA1ZVRGNO5AYLOV&s=electronics&sr=1-9408,EGP 42.99,,,
Smart Leather Full Protective Tablet Cover Hard Case With Stand For Apple Ipad Air 2019 10.5 Inches - Yellow,/-/en/Smart-Leather-Protective-Tablet-Inches/dp/B09R1WBD2J/ref=sr_1_9409?m=A1ZVRGNO5AYLOV&qid=1653130354&refinements=p_6%3AA1ZVRGNO5AYLOV&s=electronics&sr=1-9409,EGP 247.98,,,
Iron Man Hard Back Cover With Metal Ring And Kickstand For Xiaomi Mi 6 - Blue,/-/en/Iron-Cover-Metal-Kickstand-Xiaomi/dp/B091NZKVF6/ref=sr_1_9410?m=A1ZVRGNO5AYLOV&qid=1653130354&refinements=p_6%3AA1ZVRGNO5AYLOV&s=electronics&sr=1-9410,EGP 72.00,,,
9D Tempeard Ceramic Screen Protector Set Of 2 Pieces For Xiaomi Redmi Note 7 Pro - Black,/-/en/Tempeard-Ceramic-Screen-Protector-Pieces/dp/B09XXX3XYM/ref=sr_1_9411?m=A1ZVRGNO5AYLOV&qid=1653130354&refinements=p_6%3AA1ZVRGNO5AYLOV&s=electronics&sr=1-9411,EGP 38.50,,Limited time deal,
"Guess Glitter Hard Case Hearts For iPhone 11 Pro,Clear & Gold",/-/en/Guess-Glitter-Hearts-iPhone-Clear/dp/B07XT4QC1J/ref=sr_1_9412?m=A1ZVRGNO5AYLOV&qid=1653130354&refinements=p_6%3AA1ZVRGNO5AYLOV&s=electronics&sr=1-9412,EGP 182.50,,,4.4 out of 5 stars
Baseus Flash Series One-for-three Fast Charging Data Cable USB to M+L+C 66W 1.2m - Green,/-/en/Baseus-Flash-three-Charging-Cable/dp/B00KUWKDK0/ref=sr_1_9413?m=A1ZVRGNO5AYLOV&qid=1653130354&refinements=p_6%3AA1ZVRGNO5AYLOV&s=electronics&sr=1-9413,EGP 183.55,,,
"Yesido YSW-02 Wireless Bluetooth Speaker, 10 w - Black",/-/en/Yesido-YSW-02-Wireless-Bluetooth-Speaker/dp/B08X5Y3RCQ/ref=sr_1_9414?m=A1ZVRGNO5AYLOV&qid=1653130354&refinements=p_6%3AA1ZVRGNO5AYLOV&s=electronics&sr=1-9414,EGP 352.00,,,
Screen Gelatin 360 degree protection for iPhone 12 phones - Transparent,/-/en/Screen-Gelatin-degree-protection-iPhone/dp/B08ZXZBWK3/ref=sr_1_9415?m=A1ZVRGNO5AYLOV&qid=1653130354&refinements=p_6%3AA1ZVRGNO5AYLOV&s=electronics&sr=1-9415,EGP 56.00,,,
"For Huwaei Y6 Prime 2019 Case Iron Man Design 2 in 1 Hybrid Heavy Duty Hard Back Case Cover with Ring Holder, Black",/-/en/Huwaei-Prime-Design-Hybrid-Holder/dp/B08XRYX1N8/ref=sr_1_9416?m=A1ZVRGNO5AYLOV&qid=1653130354&refinements=p_6%3AA1ZVRGNO5AYLOV&s=electronics&sr=1-9416,EGP 47.99,,,
Hoco X61 - Ultimate Silicone Charging And Data Transmittion Cable (3A - 1M) - Type-C Plug For Samsung Huawei Xiaomi Oppo - Black,/-/en/Hoco-X61-Ultimate-Silicone-Transmittion/dp/B09HL7YJ6Q/ref=sr_1_9417?m=A1ZVRGNO5AYLOV&qid=1653130354&refinements=p_6%3AA1ZVRGNO5AYLOV&s=electronics&sr=1-9417,EGP 52.86,,,
X-level Metalic Back Cover For Huawei Y9 2018 - Black,/-/en/X-level-Metalic-Back-Cover-Huawei/dp/B091NYW7F4/ref=sr_1_9418?m=A1ZVRGNO5AYLOV&qid=1653130354&refinements=p_6%3AA1ZVRGNO5AYLOV&s=electronics&sr=1-9418,EGP 28.09,,,
Armor Anti Shock Screen Protector For Sony Xperia L1,/-/en/Armor-Shock-Screen-Protector-Xperia/dp/B08Z49LP4P/ref=sr_1_9419?m=A1ZVRGNO5AYLOV&qid=1653130354&refinements=p_6%3AA1ZVRGNO5AYLOV&s=electronics&sr=1-9419,EGP 91.20,,,
Huawei Honor 7 Tempered Glass Screen Protector Film 0.3mm,/-/en/Huawei-Honor-Tempered-Screen-Protector/dp/B08Y8YXZ5K/ref=sr_1_9420?m=A1ZVRGNO5AYLOV&qid=1653130354&refinements=p_6%3AA1ZVRGNO5AYLOV&s=electronics&sr=1-9420,EGP 26.74,,,
Auto Focus Rubber Back Cover Slim Case For Nokia 2.3 - Black,/-/en/Auto-Focus-Rubber-Cover-Nokia/dp/B091NZ5THK/ref=sr_1_9421?m=A1ZVRGNO5AYLOV&qid=1653130354&refinements=p_6%3AA1ZVRGNO5AYLOV&s=electronics&sr=1-9421,EGP 25.79,,,
Nillkin H Plus Tempered Glass Screen Protector for Samsung Galaxy Tab S7 Plus,/-/en/Nillkin-Tempered-Screen-Protector-Samsung/dp/B08JJ8G6LV/ref=sr_1_9422?m=A1ZVRGNO5AYLOV&qid=1653130354&refinements=p_6%3AA1ZVRGNO5AYLOV&s=electronics&sr=1-9422,EGP 402.57,,,
9D Ceramics Screen Protection For Huawei P20 Lite & Huawei Nova 3e,/-/en/Ceramics-Screen-Protection-Huawei-Lite/dp/B09BDFX9QQ/ref=sr_1_9423?m=A1ZVRGNO5AYLOV&qid=1653130354&refinements=p_6%3AA1ZVRGNO5AYLOV&s=electronics&sr=1-9423,EGP 13.20,EGP 14.74,Limited time deal,
For OnePlus 7 Mocolo Screen Protector,/-/en/OnePlus-Mocolo-Screen-Protector/dp/B0966S3X9M/ref=sr_1_9424?m=A1ZVRGNO5AYLOV&qid=1653130354&refinements=p_6%3AA1ZVRGNO5AYLOV&s=electronics&sr=1-9424,EGP 29.73,,,
UGREEN HDMI to DVI Cable Bi Directional DVI-D 24+1 Male to HDMI Male High Speed Adapter Cable Support,/-/en/UGREEN-Cable-Directional-Adapter-Support/dp/B00B2HOKCY/ref=sr_1_9425?m=A1ZVRGNO5AYLOV&qid=1653130354&refinements=p_6%3AA1ZVRGNO5AYLOV&s=electronics&sr=1-9425,EGP 152.77,,,4.5 out of 5 stars
Mobile Screen 9H Nano Screen Protector For Xiaomi Mi A3 - Clear,/-/en/Mobile-Screen-Nano-Protector-Xiaomi/dp/B08X6J5HMY/ref=sr_1_9426?m=A1ZVRGNO5AYLOV&qid=1653130354&refinements=p_6%3AA1ZVRGNO5AYLOV&s=electronics&sr=1-9426,EGP 23.36,,,
For Oppo Reno 4 HoneyComb Shockproof Frame TPU hard PC Clear Case Cover-Red,/-/en/HoneyComb-Shockproof-Frame-Clear-Cover-Red/dp/B08YXXWH6F/ref=sr_1_9427?m=A1ZVRGNO5AYLOV&qid=1653130354&refinements=p_6%3AA1ZVRGNO5AYLOV&s=electronics&sr=1-9427,EGP 35.21,EGP 40.00,,
Screen Nano ceramic anti-fingerprint Realme C15,/-/en/Screen-Nano-ceramic-anti-fingerprint-Realme/dp/B08YNMV1G6/ref=sr_1_9428?m=A1ZVRGNO5AYLOV&qid=1653130354&refinements=p_6%3AA1ZVRGNO5AYLOV&s=electronics&sr=1-9428,EGP 21.90,,,
"Dragon Ceramic Anti-Fingerprint Screen Protector for Huawei Nova 3i, 6.3 inches, Pack of 3 - Black",/-/en/Dragon-Ceramic-Anti-Fingerprint-Screen-Protector/dp/B08ZNS4WKX/ref=sr_1_9429?m=A1ZVRGNO5AYLOV&qid=1653130354&refinements=p_6%3AA1ZVRGNO5AYLOV&s=electronics&sr=1-9429,EGP 40.16,,,
"Outbox Charger with Dual USB Port, 36 Watt - Black",/-/en/Outbox-Charger-Dual-Port-Watt/dp/B08YY279VM/ref=sr_1_9430?m=A1ZVRGNO5AYLOV&qid=1653130354&refinements=p_6%3AA1ZVRGNO5AYLOV&s=electronics&sr=1-9430,EGP 306.18,,,
Slim Hard Back Cover with Slide Camera Shield for Huawei Nova7i/Nova6 SE/P40 Lite4G Turquoise,/-/en/Camera-Shield-Huawei-Nova7i-Turquoise/dp/B09F3SJD34/ref=sr_1_9431?m=A1ZVRGNO5AYLOV&qid=1653130354&refinements=p_6%3AA1ZVRGNO5AYLOV&s=electronics&sr=1-9431,EGP 62.75,,,
Anti Shock Four Angles Protection Transparent Hard Back Cover With Colored Silicone Edges For Samsung Galaxy S10e - Clear & Red & Black,/-/en/Protection-Transparent-Colored-Silicone-Samsung/dp/B08X6V6LLD/ref=sr_1_9432?m=A1ZVRGNO5AYLOV&qid=1653130354&refinements=p_6%3AA1ZVRGNO5AYLOV&s=electronics&sr=1-9432,EGP 19.00,,,
Boter Back Cover Hard Slim Protection Case Flowers Design For Oppo Reno 2F - Multi Color,/-/en/Boter-Cover-Protection-Flowers-Design/dp/B08X66YG8F/ref=sr_1_9433?m=A1ZVRGNO5AYLOV&qid=1653130357&refinements=p_6%3AA1ZVRGNO5AYLOV&s=electronics&sr=1-9433,EGP 87.60,,,
High Quality Set of 2 Glass Screen Protectors For Huawei Nova 7 SE - Clear Black,/-/en/Quality-Glass-Screen-Protectors-Huawei/dp/B09R5121W1/ref=sr_1_9434?m=A1ZVRGNO5AYLOV&qid=1653130357&refinements=p_6%3AA1ZVRGNO5AYLOV&s=electronics&sr=1-9434,EGP 47.42,,,
Ceramic Matte Film Screen Protector For Realme C11,/-/en/Ceramic-Matte-Screen-Protector-Realme/dp/B08X67TJRD/ref=sr_1_9435?m=A1ZVRGNO5AYLOV&qid=1653130357&refinements=p_6%3AA1ZVRGNO5AYLOV&s=electronics&sr=1-9435,EGP 32.00,,,
Joyroom JR-PF607 Gaming Screen Protector Full Screen Gaming-HD For iPhone 12 Mini - Clear Black,/-/en/Joyroom-JR-PF607-Gaming-Protector-Gaming-HD/dp/B08ZNVL6YM/ref=sr_1_9436?m=A1ZVRGNO5AYLOV&qid=1653130357&refinements=p_6%3AA1ZVRGNO5AYLOV&s=electronics&sr=1-9436,EGP 176.00,,,
Transparent Hard Back Cover With Silicone Edges For Samsung Galaxy A10 - Clear Red,/-/en/Transparent-Cover-Silicone-Samsung-Galaxy/dp/B08X5ZV6J6/ref=sr_1_9437?m=A1ZVRGNO5AYLOV&qid=1653130357&refinements=p_6%3AA1ZVRGNO5AYLOV&s=electronics&sr=1-9437,EGP 19.00,,,
K&F 55mm Variable Fader Lens Filter ND2-400,/-/en/55mm-Variable-Fader-Filter-ND2-400/dp/B0966TQD57/ref=sr_1_9438?m=A1ZVRGNO5AYLOV&qid=1653130357&refinements=p_6%3AA1ZVRGNO5AYLOV&s=electronics&sr=1-9438,EGP 349.00,,,
Guess 4G Circle Logo PC/TPU Glitter Case for iPhone 11 Pro - Kaki,/-/en/Guess-Circle-Logo-Glitter-iPhone/dp/B083TP7PCL/ref=sr_1_9439?m=A1ZVRGNO5AYLOV&qid=1653130357&refinements=p_6%3AA1ZVRGNO5AYLOV&s=electronics&sr=1-9439,EGP 183.00,EGP 200.00,,
Cover iron man with metal ring For Oneplus 8 pro -Black,/-/en/Cover-iron-metal-Oneplus-Black/dp/B08YXYTWQD/ref=sr_1_9440?m=A1ZVRGNO5AYLOV&qid=1653130357&refinements=p_6%3AA1ZVRGNO5AYLOV&s=electronics&sr=1-9440,EGP 67.20,,,
KSIX Extreme 2.5D 9H Tempered Glass Protector for Realme X2 Black (1 Unit),/-/en/Extreme-Tempered-Glass-Protector-Realme/dp/B084SRTVSK/ref=sr_1_9441?m=A1ZVRGNO5AYLOV&qid=1653130357&refinements=p_6%3AA1ZVRGNO5AYLOV&s=electronics&sr=1-9441,EGP 28.80,,,
Xiaomi Redmi Note 4X Official Screen Protector - Clear,/-/en/Xiaomi-Redmi-Official-Screen-Protector/dp/B08Z4BH6J6/ref=sr_1_9442?m=A1ZVRGNO5AYLOV&qid=1653130357&refinements=p_6%3AA1ZVRGNO5AYLOV&s=electronics&sr=1-9442,EGP 24.00,,,
"NEW'C Pack of 2 Tempered Glass Screen Protectors for Samsung Galaxy A01 Core, M01 Core, Free from Scratches, 9H Hardness, HD Screen Protector, 0.33 mm Ultra Clear, Ultra Resistant",/-/en/Tempered-Protectors-Scratches-Protector-Resistant/dp/B08HDJGD3G/ref=sr_1_9443?m=A1ZVRGNO5AYLOV&qid=1653130357&refinements=p_6%3AA1ZVRGNO5AYLOV&s=electronics&sr=1-9443,EGP 32.00,,,
Dragon Anti-Fingerprint Glass Screen Protector for Huawei P30 Lite - Clear,/-/en/Dragon-Anti-Fingerprint-Screen-Protector-Huawei/dp/B08WJJMKM3/ref=sr_1_9444?m=A1ZVRGNO5AYLOV&qid=1653130357&refinements=p_6%3AA1ZVRGNO5AYLOV&s=electronics&sr=1-9444,EGP 32.00,,,
Flexible Braid Rope Watch Band 42/44 mm For Apple Watch-Black,/-/en/Flexible-Braid-Watch-Band-Watch-Black/dp/B09P5HLLKL/ref=sr_1_9445?m=A1ZVRGNO5AYLOV&qid=1653130357&refinements=p_6%3AA1ZVRGNO5AYLOV&s=electronics&sr=1-9445,EGP 103.98,,,
"360 Degrees Full Cover Gelatin Screen Protector for Huawei P20 Lite, 5.84 inches - Clear",/-/en/Degrees-Gelatin-Screen-Protector-Huawei/dp/B095PYS82W/ref=sr_1_9446?m=A1ZVRGNO5AYLOV&qid=1653130357&refinements=p_6%3AA1ZVRGNO5AYLOV&s=electronics&sr=1-9446,EGP 34.37,EGP 40.00,Limited time deal,
"For OnePlus 7 Pro and 7T Pro , Orzero Screen Protector , Edge to Edge , Clear Film , 3 Pack",/-/en/OnePlus-Orzero-Screen-Protector-Clear/dp/B091JS8QYM/ref=sr_1_9447?m=A1ZVRGNO5AYLOV&qid=1653130357&refinements=p_6%3AA1ZVRGNO5AYLOV&s=electronics&sr=1-9447,EGP 136.00,,,
Nillkin Frosted Shield Hard Back Shockproof Cover for Xiaomi Redmi K30 Ultra - Peacock Blue,/-/en/Nillkin-Frosted-Shield-Shockproof-Xiaomi/dp/B08ZNVLCGH/ref=sr_1_9448?m=A1ZVRGNO5AYLOV&qid=1653130357&refinements=p_6%3AA1ZVRGNO5AYLOV&s=electronics&sr=1-9448,EGP 39.00,,,
Camera Lens Screen Protector For Samsung Note 10 Plus - Transparent,/-/en/Camera-Lens-Screen-Protector-Samsung/dp/B091P62G5Z/ref=sr_1_9449?m=A1ZVRGNO5AYLOV&qid=1653130357&refinements=p_6%3AA1ZVRGNO5AYLOV&s=electronics&sr=1-9449,EGP 32.00,,,
FULL SCREEN PROTECTOR FOR XIAOMI MI 9T / MI 9T PRO/k20/k20pro - BLACK,/-/en/FULL-SCREEN-PROTECTOR-XIAOMI-k20pro/dp/B08XRYPZYC/ref=sr_1_9450?m=A1ZVRGNO5AYLOV&qid=1653130357&refinements=p_6%3AA1ZVRGNO5AYLOV&s=electronics&sr=1-9450,EGP 30.26,EGP 35.20,Limited time deal,
Meetion M990S - Mechanical Programmable Gaming Mouse (4000 DPI) – For PC & Laptop – Black,/-/en/Meetion-M990S-Mechanical-Programmable-Gaming/dp/B07N7BBQTT/ref=sr_1_9451?m=A1ZVRGNO5AYLOV&qid=1653130357&refinements=p_6%3AA1ZVRGNO5AYLOV&s=electronics&sr=1-9451,EGP 482.83,,,
Pioneer TS-6965V3 Champion Series 3 Way Speaker,/-/en/Pioneer-TS-6965V3-Champion-Way-Speaker/dp/B07KT7H7YX/ref=sr_1_9452?m=A1ZVRGNO5AYLOV&qid=1653130357&refinements=p_6%3AA1ZVRGNO5AYLOV&s=electronics&sr=1-9452,"EGP 2,123.30",,,4.7 out of 5 stars
Hoco X29 Superior Style Charging and Data Transfer Lightning Cable - Black,/-/en/Hoco-X29-Superior-Charging-Lightning/dp/B07Z4T68TP/ref=sr_1_9453?m=A1ZVRGNO5AYLOV&qid=1653130357&refinements=p_6%3AA1ZVRGNO5AYLOV&s=electronics&sr=1-9453,EGP 44.64,,,
Crush Foldable Laptop 1 big Fan Multi Color 1000C for Laptop and Notebook,/-/en/Crush-Foldable-Laptop-Multi-Notebook/dp/B09QQK9DSX/ref=sr_1_9454?m=A1ZVRGNO5AYLOV&qid=1653130357&refinements=p_6%3AA1ZVRGNO5AYLOV&s=electronics&sr=1-9454,EGP 203.06,,,
Magnetic Case 360 Full Protection for Samsung Galaxy A8 Plus with Metal Frame - Clear Black,/-/en/Magnetic-Protection-Samsung-Galaxy-Metal/dp/B08Y98SJ5J/ref=sr_1_9455?m=A1ZVRGNO5AYLOV&qid=1653130357&refinements=p_6%3AA1ZVRGNO5AYLOV&s=electronics&sr=1-9455,EGP 19.00,,,
Tembered Glass screen protector for Samsung Galaxy J2 Prime/Grand Prime (2016) - Clear by hunch,/-/en/Tembered-screen-protector-Samsung-Galaxy/dp/B0976CSY53/ref=sr_1_9456?m=A1ZVRGNO5AYLOV&qid=1653130357&refinements=p_6%3AA1ZVRGNO5AYLOV&s=electronics&sr=1-9456,EGP 24.00,,,
Baseus Superior USB Type C - USB Type C cable Quick Charge/Power Delivery/FCP 100W 5A 20V 1m black (CATYS-B01),/-/en/Baseus-Superior-USB-Type-CATYS-B01/dp/B00C87ACII/ref=sr_1_9457?m=A1ZVRGNO5AYLOV&qid=1653130358&refinements=p_6%3AA1ZVRGNO5AYLOV&s=electronics&sr=1-9457,EGP 91.00,,,4.6 out of 5 stars
Boter Back Cover Hard Slim Protection Case Flowers Design For Oppo Reno 2F - Multi Color,/-/en/Boter-Cover-Protection-Flowers-Design/dp/B08X66YG8F/ref=sr_1_9458?m=A1ZVRGNO5AYLOV&qid=1653130358&refinements=p_6%3AA1ZVRGNO5AYLOV&s=electronics&sr=1-9458,EGP 87.60,,,
K&F 55mm Variable Fader Lens Filter ND2-400,/-/en/55mm-Variable-Fader-Filter-ND2-400/dp/B0966TQD57/ref=sr_1_9459?m=A1ZVRGNO5AYLOV&qid=1653130358&refinements=p_6%3AA1ZVRGNO5AYLOV&s=electronics&sr=1-9459,EGP 349.00,,,
Guess 4G Circle Logo PC/TPU Glitter Case for iPhone 11 Pro - Kaki,/-/en/Guess-Circle-Logo-Glitter-iPhone/dp/B083TP7PCL/ref=sr_1_9460?m=A1ZVRGNO5AYLOV&qid=1653130358&refinements=p_6%3AA1ZVRGNO5AYLOV&s=electronics&sr=1-9460,EGP 183.00,EGP 200.00,,
WK Design V11 Wireless Bluetooth Earphones with Microphone - Red,/-/en/WK-Design-V11-Bluetooth-Microphone/dp/B07WLCWBS4/ref=sr_1_9461?m=A1ZVRGNO5AYLOV&qid=1653130358&refinements=p_6%3AA1ZVRGNO5AYLOV&s=electronics&sr=1-9461,EGP 670.40,,,
KSIX Extreme 2.5D 9H Tempered Glass Protector for Realme X2 Black (1 Unit),/-/en/Extreme-Tempered-Glass-Protector-Realme/dp/B084SRTVSK/ref=sr_1_9462?m=A1ZVRGNO5AYLOV&qid=1653130358&refinements=p_6%3AA1ZVRGNO5AYLOV&s=electronics&sr=1-9462,EGP 28.80,,,
Dragon Anti-Fingerprint Glass Screen Protector for Huawei P30 Lite - Clear,/-/en/Dragon-Anti-Fingerprint-Screen-Protector-Huawei/dp/B08WJJMKM3/ref=sr_1_9463?m=A1ZVRGNO5AYLOV&qid=1653130358&refinements=p_6%3AA1ZVRGNO5AYLOV&s=electronics&sr=1-9463,EGP 32.00,,,
"360 Degrees Full Cover Gelatin Screen Protector for Huawei P20 Lite, 5.84 inches - Clear",/-/en/Degrees-Gelatin-Screen-Protector-Huawei/dp/B095PYS82W/ref=sr_1_9464?m=A1ZVRGNO5AYLOV&qid=1653130358&refinements=p_6%3AA1ZVRGNO5AYLOV&s=electronics&sr=1-9464,EGP 34.37,EGP 40.00,Limited time deal,
Nillkin Frosted Shield Hard Back Shockproof Cover for Xiaomi Redmi K30 Ultra - Peacock Blue,/-/en/Nillkin-Frosted-Shield-Shockproof-Xiaomi/dp/B08ZNVLCGH/ref=sr_1_9465?m=A1ZVRGNO5AYLOV&qid=1653130358&refinements=p_6%3AA1ZVRGNO5AYLOV&s=electronics&sr=1-9465,EGP 39.00,,,
2B For Multi - Audio Cable,/-/en/2B-For-Multi-Audio-Cable/dp/B0968WVG6Y/ref=sr_1_9466?m=A1ZVRGNO5AYLOV&qid=1653130358&refinements=p_6%3AA1ZVRGNO5AYLOV&s=electronics&sr=1-9466,EGP 17.23,EGP 17.98,,
Camera Lens Screen Protector For Samsung Note 10 Plus - Transparent,/-/en/Camera-Lens-Screen-Protector-Samsung/dp/B091P62G5Z/ref=sr_1_9467?m=A1ZVRGNO5AYLOV&qid=1653130358&refinements=p_6%3AA1ZVRGNO5AYLOV&s=electronics&sr=1-9467,EGP 32.00,,,
FULL SCREEN PROTECTOR FOR XIAOMI MI 9T / MI 9T PRO/k20/k20pro - BLACK,/-/en/FULL-SCREEN-PROTECTOR-XIAOMI-k20pro/dp/B08XRYPZYC/ref=sr_1_9468?m=A1ZVRGNO5AYLOV&qid=1653130358&refinements=p_6%3AA1ZVRGNO5AYLOV&s=electronics&sr=1-9468,EGP 30.26,EGP 35.20,Limited time deal,
Pioneer TS-6965V3 Champion Series 3 Way Speaker,/-/en/Pioneer-TS-6965V3-Champion-Way-Speaker/dp/B07KT7H7YX/ref=sr_1_9469?m=A1ZVRGNO5AYLOV&qid=1653130358&refinements=p_6%3AA1ZVRGNO5AYLOV&s=electronics&sr=1-9469,"EGP 2,123.30",,,4.7 out of 5 stars
"CAR REAR VIEW LCD MONITOR, PARKING SENSOR, INDICATOR AND CAMERA",/-/en/MONITOR-PARKING-SENSOR-INDICATOR-CAMERA/dp/B08YNDRLQ2/ref=sr_1_9470?m=A1ZVRGNO5AYLOV&qid=1653130358&refinements=p_6%3AA1ZVRGNO5AYLOV&s=electronics&sr=1-9470,"EGP 1,030.28",,,
Momax Apple iPhone 13 Hybrid Case Magnet compatible Black,/-/en/Momax-iPhone-Hybrid-Magnet-compatible/dp/B09P6NK8TZ/ref=sr_1_9471?m=A1ZVRGNO5AYLOV&qid=1653130358&refinements=p_6%3AA1ZVRGNO5AYLOV&s=electronics&sr=1-9471,EGP 421.00,,,
Magnetic Case 360 Full Protection for Samsung Galaxy A8 Plus with Metal Frame - Clear Black,/-/en/Magnetic-Protection-Samsung-Galaxy-Metal/dp/B08Y98SJ5J/ref=sr_1_9472?m=A1ZVRGNO5AYLOV&qid=1653130358&refinements=p_6%3AA1ZVRGNO5AYLOV&s=electronics&sr=1-9472,EGP 19.00,,,
Tembered Glass screen protector for Samsung Galaxy J2 Prime/Grand Prime (2016) - Clear by hunch,/-/en/Tembered-screen-protector-Samsung-Galaxy/dp/B0976CSY53/ref=sr_1_9473?m=A1ZVRGNO5AYLOV&qid=1653130358&refinements=p_6%3AA1ZVRGNO5AYLOV&s=electronics&sr=1-9473,EGP 24.00,,,
Keendex 1994 3.5 mm Male to 2.5 mm Female Audio Adapter - Black and Gold,/-/en/Keendex-1994-Female-Audio-Adapter/dp/B096L5P352/ref=sr_1_9474?m=A1ZVRGNO5AYLOV&qid=1653130358&refinements=p_6%3AA1ZVRGNO5AYLOV&s=electronics&sr=1-9474,EGP 38.30,,,
Celebrat  Speaker FLY-3-Black,/-/en/Celebrat-Celebrat-Speaker-FLY-3-Black/dp/B09GYLBQ8K/ref=sr_1_9475?m=A1ZVRGNO5AYLOV&qid=1653130358&refinements=p_6%3AA1ZVRGNO5AYLOV&s=electronics&sr=1-9475,EGP 251.41,,,
For Apple iPhone 12 mini 5.4 inch Case Clear TPU Bumper Anti shock with round corners,/-/en/Apple-iPhone-Clear-Bumper-corners/dp/B096QZLYJR/ref=sr_1_9476?m=A1ZVRGNO5AYLOV&qid=1653130358&refinements=p_6%3AA1ZVRGNO5AYLOV&s=electronics&sr=1-9476,EGP 20.93,,,
"[2 Packs] Redmi 7A Screen Protector, Redmi 7A Tempered Glass Screen Protector,Anti-Scratch HD Clear Screen Guard for 5.45'' Xiaomi Redmi 7A",/-/en/Screen-Protector-Tempered-Anti-Scratch-Xiaomi/dp/B07TNJNS3T/ref=sr_1_9477?m=A1ZVRGNO5AYLOV&qid=1653130358&refinements=p_6%3AA1ZVRGNO5AYLOV&s=electronics&sr=1-9477,EGP 32.00,,,
Plastic Back cover With Camera Protector And Silicon Edges For iPhone 11 Pro Max - Clear & Purple,/-/en/Plastic-Camera-Protector-Silicon-iPhone/dp/B0922YNQ6D/ref=sr_1_9478?m=A1ZVRGNO5AYLOV&qid=1653130358&refinements=p_6%3AA1ZVRGNO5AYLOV&s=electronics&sr=1-9478,EGP 56.00,,,
Godox LED 500 Video Lamp Light changeable version 3300-5600k,/-/en/Godox-Video-changeable-version-3300-5600k/dp/B098WJSLC9/ref=sr_1_9479?m=A1ZVRGNO5AYLOV&qid=1653130358&refinements=p_6%3AA1ZVRGNO5AYLOV&s=electronics&sr=1-9479,"EGP 3,512.00",,,
High Quality Set of 3 Glass Screen Protectors For Huawei P30 - Clear Black,/-/en/Quality-Glass-Screen-Protectors-Huawei/dp/B09R4ZPRKJ/ref=sr_1_9480?m=A1ZVRGNO5AYLOV&qid=1653130358&refinements=p_6%3AA1ZVRGNO5AYLOV&s=electronics&sr=1-9480,EGP 65.66,,,
Stitch Charger Protector With Cable Bite Silicone (USB Type C - Charger Size: 27x42mm) - Multi Color,/-/en/Stitch-Charger-Protector-Cable-Silicone/dp/B09TCV8FDD/ref=sr_1_9481?m=A1ZVRGNO5AYLOV&qid=1653130359&refinements=p_6%3AA1ZVRGNO5AYLOV&s=electronics&sr=1-9481,EGP 92.85,,,
Mi A1 (5X) Curved Tempered Glass By JBQ - Clear,/-/en/Mi-Curved-Tempered-Glass-JBQ/dp/B08Z4BB98D/ref=sr_1_9482?m=A1ZVRGNO5AYLOV&qid=1653130359&refinements=p_6%3AA1ZVRGNO5AYLOV&s=electronics&sr=1-9482,EGP 24.00,,,
Joyroom JR-PF627 Knight Series Gaming Glass Screen Protector (HD) For iPhone 12 Pro Max - Clear,/-/en/Joyroom-JR-PF627-Knight-Gaming-Protector/dp/B095Q28QM6/ref=sr_1_9483?m=A1ZVRGNO5AYLOV&qid=1653130359&refinements=p_6%3AA1ZVRGNO5AYLOV&s=electronics&sr=1-9483,EGP 124.85,,,
Boter Printed TPU Silicon Back Cover For Xiaomi Mi A2 - Multi Color,/-/en/Boter-Printed-Silicon-Cover-Xiaomi/dp/B08X63H6J2/ref=sr_1_9484?m=A1ZVRGNO5AYLOV&qid=1653130359&refinements=p_6%3AA1ZVRGNO5AYLOV&s=electronics&sr=1-9484,EGP 40.00,,,
Elago Silicone Case for iPhone 11 Pro - Midnight Green,/-/en/Elago-Silicone-Case-iPhone-Pro/dp/B0811G6G6P/ref=sr_1_9485?m=A1ZVRGNO5AYLOV&qid=1653130359&refinements=p_6%3AA1ZVRGNO5AYLOV&s=electronics&sr=1-9485,EGP 440.00,,,
