Name,Link,Price,OldPrice,BestSeller,Stars
Anker SoundCore Liberty 2 Pro Bluetooth Earphones Waterproof 4 Microphones With Uplink Noise Cancellation Wireless Charging,/-/en/Anker-SoundCore-Waterproof-Microphones-Cancellation/dp/B07XYYCXJW/ref=sr_1_9486?m=A1ZVRGNO5AYLOV&qid=1653130359&refinements=p_6%3AA1ZVRGNO5AYLOV&s=electronics&sr=1-9486,"EGP 2,400.00",,,4.6 out of 5 stars
Reno RL-22 Quick Charging Data Cable Micro USB 3A - Black,/-/en/Reno-RL-22-Quick-Charging-Cable/dp/B09LHRXJR2/ref=sr_1_9487?m=A1ZVRGNO5AYLOV&qid=1653130359&refinements=p_6%3AA1ZVRGNO5AYLOV&s=electronics&sr=1-9487,EGP 43.20,,,
Tempered Glass Screen Protector By Ineix For Xiaomi Mi Mix 2,/-/en/Tempered-Screen-Protector-Ineix-Xiaomi/dp/B091Q7F7LB/ref=sr_1_9488?m=A1ZVRGNO5AYLOV&qid=1653130359&refinements=p_6%3AA1ZVRGNO5AYLOV&s=electronics&sr=1-9488,EGP 24.00,,,
Screen Protector for Huawei P30 Pro Tempered Glass Shockproof Curved Full Screen Protection 9H Hardness,/-/en/Protector-Tempered-Shockproof-Protection-Hardness/dp/B08YY36YYJ/ref=sr_1_9489?m=A1ZVRGNO5AYLOV&qid=1653130359&refinements=p_6%3AA1ZVRGNO5AYLOV&s=electronics&sr=1-9489,EGP 33.01,EGP 47.99,Limited time deal,
Realme 5 Pro Tempered Glass Screen Protector - Clear,/-/en/Realme-Tempered-Glass-Screen-Protector/dp/B08X67VJRL/ref=sr_1_9490?m=A1ZVRGNO5AYLOV&qid=1653130359&refinements=p_6%3AA1ZVRGNO5AYLOV&s=electronics&sr=1-9490,EGP 15.00,,,
Power Bank REMAX JONSHON LCD RPP-153 10 000MAH White,/-/en/Power-REMAX-JONSHON-RPP-153-000MAH/dp/B07ZNPLYGL/ref=sr_1_9491?m=A1ZVRGNO5AYLOV&qid=1653130359&refinements=p_6%3AA1ZVRGNO5AYLOV&s=electronics&sr=1-9491,EGP 272.00,,,
For Samsung Galaxy M31 Privacy Glass Screen Protector by Dl3 Mobilk,/-/en/Samsung-Privacy-Protector-Dl3-Mobilk/dp/B093FVMDJ5/ref=sr_1_9492?m=A1ZVRGNO5AYLOV&qid=1653130359&refinements=p_6%3AA1ZVRGNO5AYLOV&s=electronics&sr=1-9492,EGP 35.63,,,
AG 9H Screen Protector Curved Blue Glass Anti-scratch For Apple iphone XS Max 6.5 Inch - Black,/-/en/AG-Screen-Protector-Curved-Anti-scratch/dp/B08Y8YQZKB/ref=sr_1_9493?m=A1ZVRGNO5AYLOV&qid=1653130359&refinements=p_6%3AA1ZVRGNO5AYLOV&s=electronics&sr=1-9493,EGP 24.20,EGP 27.02,Limited time deal,
Bluedio TMS Bluetooth On-Ear Wireless Headphones - Black,/-/en/Bluedio-Bluetooth-Ear-Wireless-Headphones/dp/B07RRYVCGV/ref=sr_1_9494?m=A1ZVRGNO5AYLOV&qid=1653130359&refinements=p_6%3AA1ZVRGNO5AYLOV&s=electronics&sr=1-9494,"EGP 1,168.00",,,
Baseus Legend Series Elbow Fast Charging Data Cable Type-C to Type-C 100W 1m,/-/en/Baseus-Legend-Elbow-Charging-Type-C/dp/B00GHQLP9Q/ref=sr_1_9495?m=A1ZVRGNO5AYLOV&qid=1653130359&refinements=p_6%3AA1ZVRGNO5AYLOV&s=electronics&sr=1-9495,EGP 142.87,,,
X-LEVEL Vintage Design Leather Hard Slim Back Cover With Anti Finger Print Ceramic Screen Protector for iPhone 11 - Red,/-/en/X-LEVEL-Vintage-Leather-Ceramic-Protector/dp/B091NZF4N1/ref=sr_1_9496?m=A1ZVRGNO5AYLOV&qid=1653130359&refinements=p_6%3AA1ZVRGNO5AYLOV&s=electronics&sr=1-9496,EGP 19.00,,,
5D Curved Glass Screen Protector for Samsung Galaxy Grand Prime Pro / J2 Pro 2018 - Black,/-/en/Curved-Screen-Protector-Samsung-Galaxy/dp/B08YY2G65B/ref=sr_1_9497?m=A1ZVRGNO5AYLOV&qid=1653130359&refinements=p_6%3AA1ZVRGNO5AYLOV&s=electronics&sr=1-9497,EGP 31.25,,,
"Dragon Ceramic Anti-Fingerprint Screen Protector for Huawei Y7 Prime 2019, 6.2 Inches, Pack of 3 - Black",/-/en/Dragon-Ceramic-Anti-Fingerprint-Screen-Protector/dp/B08ZNRKPXD/ref=sr_1_9498?m=A1ZVRGNO5AYLOV&qid=1653130359&refinements=p_6%3AA1ZVRGNO5AYLOV&s=electronics&sr=1-9498,EGP 35.20,,,
Soft Touch Hard Back Cover With Colored Silicone Edges For Samsung Galaxy S20 / Samsung Galaxy S11E - Black Orange,/-/en/Touch-Colored-Silicone-Samsung-Galaxy/dp/B08X6JSMWF/ref=sr_1_9499?m=A1ZVRGNO5AYLOV&qid=1653130359&refinements=p_6%3AA1ZVRGNO5AYLOV&s=electronics&sr=1-9499,EGP 56.00,,,
"Ultra Protective Armored Anti Shock Back Cover With Kickstand Ring For iPhone 7 Plus, iPhone 8 Plus - Black",/-/en/Ultra-Protective-Armored-Kickstand-iPhone/dp/B09P5FYVDQ/ref=sr_1_9500?m=A1ZVRGNO5AYLOV&qid=1653130359&refinements=p_6%3AA1ZVRGNO5AYLOV&s=electronics&sr=1-9500,EGP 72.00,,,4.5 out of 5 stars
"9H Screen Protector for Huawei Mate 10 Lite - Clear Transparent, Against Fingerprints",/-/en/9H-Screen-Protector-Huawei-Mate/dp/B08X5Y6N7T/ref=sr_1_9501?m=A1ZVRGNO5AYLOV&qid=1653130359&refinements=p_6%3AA1ZVRGNO5AYLOV&s=electronics&sr=1-9501,EGP 26.00,,,
Domani Tv unite white - T0111,/-/en/Domani-Tv-unite-white-T0111/dp/B099PP6RX3/ref=sr_1_9502?m=A1ZVRGNO5AYLOV&qid=1653130359&refinements=p_6%3AA1ZVRGNO5AYLOV&s=electronics&sr=1-9502,EGP 743.55,EGP 825.00,Limited time deal,
Boter 3D Glass Hard Back Cover With Silicone Edges For Oppo Find X2 Pro - Multi Color,/-/en/Boter-Glass-Cover-Silicone-Edges/dp/B093WYMKT1/ref=sr_1_9503?m=A1ZVRGNO5AYLOV&qid=1653130359&refinements=p_6%3AA1ZVRGNO5AYLOV&s=electronics&sr=1-9503,EGP 56.00,,,
Boter 3D Back Cover Glass Hard Slim Case For Samsung Galaxy S20 Plus - Multi Color,/-/en/Boter-Cover-Glass-Samsung-Galaxy/dp/B08X5YYWP3/ref=sr_1_9504?m=A1ZVRGNO5AYLOV&qid=1653130359&refinements=p_6%3AA1ZVRGNO5AYLOV&s=electronics&sr=1-9504,EGP 19.00,,,
"WK Design WP-C19 Sigee Series Car Charger, 2 Ports - Black",/-/en/WK-Design-WP-C19-Sigee-Charger/dp/B082TPJH9N/ref=sr_1_9505?m=A1ZVRGNO5AYLOV&qid=1653130360&refinements=p_6%3AA1ZVRGNO5AYLOV&s=electronics&sr=1-9505,EGP 39.40,,,4.5 out of 5 stars
"Hoco X20 Flash Charging Micro Cable, 2 m - White",/-/en/Hoco-Flash-Charging-Micro-Cable/dp/B07TKF12M6/ref=sr_1_9506?m=A1ZVRGNO5AYLOV&qid=1653130360&refinements=p_6%3AA1ZVRGNO5AYLOV&s=electronics&sr=1-9506,EGP 37.39,,,
UGREEN HDMI to DVI Cable Bi Directional DVI-D 24 1 Male to HDMI Male High Speed Adapter Cable 1080P Full HD Compatible for Raspberry Pi Roku Xbox One PS4 PS3 Graphics Card Nintendo Switch 6FT,/-/en/UGREEN-Directional-Compatible-Raspberry-Graphics/dp/B00B2HOJK2/ref=sr_1_9507?m=A1ZVRGNO5AYLOV&qid=1653130360&refinements=p_6%3AA1ZVRGNO5AYLOV&s=electronics&sr=1-9507,EGP 119.90,EGP 138.38,,
screen glass protect for sony Xperia XA1 from glass clear,/-/en/screen-glass-protect-Xperia-clear/dp/B097F357Y1/ref=sr_1_9508?m=A1ZVRGNO5AYLOV&qid=1653130360&refinements=p_6%3AA1ZVRGNO5AYLOV&s=electronics&sr=1-9508,EGP 7.50,,,
Moxom MX-SK18 Wireless Bluetooth Speakers - Red,/-/en/Moxom-MX-SK18-Wireless-Bluetooth-Speakers/dp/B09BG3D3RD/ref=sr_1_9509?m=A1ZVRGNO5AYLOV&qid=1653130360&refinements=p_6%3AA1ZVRGNO5AYLOV&s=electronics&sr=1-9509,EGP 229.00,,,
Belkin CAA001BT3MWH BOOSTCHARGE Lightning To USb-A Cable 3m White,/-/en/Belkin-CAA001BT3MWH-BOOSTCHARGE-Lightning-Cable/dp/B08558JKGD/ref=sr_1_9510?m=A1ZVRGNO5AYLOV&qid=1653130360&refinements=p_6%3AA1ZVRGNO5AYLOV&s=electronics&sr=1-9510,EGP 554.53,,,
Hoco C86A - Illustrious Dual Ports Charger With Digital Display (2.4A - 5V) Compatible with iPhone Samsung Xiaomi Huawei Oppo - White,/-/en/Hoco-C86A-Illustrious-Charger-Compatible/dp/B09R4KKZJD/ref=sr_1_9511?m=A1ZVRGNO5AYLOV&qid=1653130360&refinements=p_6%3AA1ZVRGNO5AYLOV&s=electronics&sr=1-9511,EGP 70.00,,,
X-Level Back Cover For Honor 9 Lite - Red,/-/en/X-Level-Back-Cover-Honor-Lite/dp/B098TWPC6V/ref=sr_1_9512?m=A1ZVRGNO5AYLOV&qid=1653130360&refinements=p_6%3AA1ZVRGNO5AYLOV&s=electronics&sr=1-9512,EGP 45.00,,,
"Dragon Ceramic Anti-Fingerprint Screen Protector for Samsung Galaxy Note 10 Lite, 6.7 Inches, Pack of 3 - Black",/-/en/Dragon-Ceramic-Anti-Fingerprint-Protector-Samsung/dp/B08ZNTYCDF/ref=sr_1_9513?m=A1ZVRGNO5AYLOV&qid=1653130360&refinements=p_6%3AA1ZVRGNO5AYLOV&s=electronics&sr=1-9513,EGP 80.00,,,
Nikon AF-P DX NIKKOR 70-300mm f/4.5-6.3G ED Lens for Nikon DSLR Cameras,/-/en/Nikon-NIKKOR-70-300mm-4-5-6-3G-Cameras/dp/B098BJKKSK/ref=sr_1_9514?m=A1ZVRGNO5AYLOV&qid=1653130360&refinements=p_6%3AA1ZVRGNO5AYLOV&s=electronics&sr=1-9514,"EGP 4,750.00",,,
High Quality Set of 2 Glass Screen Protectors For Samsung Galaxy S20 - Clear,/-/en/Quality-Screen-Protectors-Samsung-Galaxy/dp/B09R5MXV9H/ref=sr_1_9515?m=A1ZVRGNO5AYLOV&qid=1653130360&refinements=p_6%3AA1ZVRGNO5AYLOV&s=electronics&sr=1-9515,EGP 47.42,,,
9D Glass Screen Protector For apple iPhone 7 8,/-/en/9D-Glass-Screen-Protector-iPhone/dp/B093FSCF35/ref=sr_1_9516?m=A1ZVRGNO5AYLOV&qid=1653130360&refinements=p_6%3AA1ZVRGNO5AYLOV&s=electronics&sr=1-9516,EGP 11.00,,Limited time deal,
Dual Layer Hard Back Cover with Stand and Finger Holder for Samsung Galaxy Note 10 Pro - Black,/-/en/Layer-Finger-Holder-Samsung-Galaxy/dp/B08X69Y1KV/ref=sr_1_9517?m=A1ZVRGNO5AYLOV&qid=1653130360&refinements=p_6%3AA1ZVRGNO5AYLOV&s=electronics&sr=1-9517,EGP 19.00,,,4.5 out of 5 stars
Slim Hard Back Cover with Slide Camera Shield for Samsung A10/M10 Pink,/-/en/Cover-Slide-Camera-Shield-Samsung/dp/B09FKD7JP5/ref=sr_1_9518?m=A1ZVRGNO5AYLOV&qid=1653130360&refinements=p_6%3AA1ZVRGNO5AYLOV&s=electronics&sr=1-9518,EGP 62.75,,,
Dragon Anti-Fingerprint 5D Glass Screen Protector for Honor 20 Pro - Black,/-/en/Dragon-Anti-Fingerprint-Glass-Screen-Protector/dp/B08WJMZM8C/ref=sr_1_9519?m=A1ZVRGNO5AYLOV&qid=1653130360&refinements=p_6%3AA1ZVRGNO5AYLOV&s=electronics&sr=1-9519,EGP 48.00,,,
Moxom MX-SK05 Wireless Bluetooth Speakers - Black,/-/en/Moxom-MX-SK05-Wireless-Bluetooth-Speakers/dp/B0976DBWYJ/ref=sr_1_9520?m=A1ZVRGNO5AYLOV&qid=1653130360&refinements=p_6%3AA1ZVRGNO5AYLOV&s=electronics&sr=1-9520,EGP 198.00,,Limited time deal,
Dragon Anti-Fingerprint Nano Screen Protector for Huawei GR5 2017 - Clear,/-/en/Dragon-Anti-Fingerprint-Screen-Protector-Huawei/dp/B08WJMR6QQ/ref=sr_1_9521?m=A1ZVRGNO5AYLOV&qid=1653130360&refinements=p_6%3AA1ZVRGNO5AYLOV&s=electronics&sr=1-9521,EGP 32.00,,,
Yamaha PA-150 Power Adapter,/-/en/Other-PA-150B-Yamaha-PA-150-Adapter/dp/B073WN3B4P/ref=sr_1_9522?m=A1ZVRGNO5AYLOV&qid=1653130360&refinements=p_6%3AA1ZVRGNO5AYLOV&s=electronics&sr=1-9522,EGP 358.39,,,
"Hoco C88A - Star Round Dual Ports Charger, Set With USB-A To Lighting Cable (2.4A - 5V - 1M) Compatible with iPhone Samsung Xiaomi Huawei Oppo - Black",/-/en/Hoco-C88A-USB-Lighting-Compatible/dp/B09R4L6SHP/ref=sr_1_9523?m=A1ZVRGNO5AYLOV&qid=1653130360&refinements=p_6%3AA1ZVRGNO5AYLOV&s=electronics&sr=1-9523,EGP 61.51,,,
Hoco W24 - Enlighten headphones with mic set,/-/en/Hoco-W24-Enlighten-headphones-mic/dp/B083TRKGFR/ref=sr_1_9524?m=A1ZVRGNO5AYLOV&qid=1653130360&refinements=p_6%3AA1ZVRGNO5AYLOV&s=electronics&sr=1-9524,EGP 223.86,,,
"21D Full Screen Glass Protector, Flexible Nano-Gelatin Ceramic Anti-fingerprint Matte For Samsung Galaxy M51 Full Adhesive 10H Technology, Unbreakable or Scratched - Black",/-/en/Protector-Nano-Gelatin-Anti-fingerprint-Technology-Unbreakable/dp/B08X5XFBZP/ref=sr_1_9525?m=A1ZVRGNO5AYLOV&qid=1653130360&refinements=p_6%3AA1ZVRGNO5AYLOV&s=electronics&sr=1-9525,EGP 22.79,,,
Recci REB-P01 Fantasy Bluetooth Earphone - White,/-/en/Recci-REB-P01-Fantasy-Bluetooth-Earphone/dp/B07N488418/ref=sr_1_9526?m=A1ZVRGNO5AYLOV&qid=1653130360&refinements=p_6%3AA1ZVRGNO5AYLOV&s=electronics&sr=1-9526,EGP 147.00,,,
Soft Touch Transparent Hard Back Cover With Colored Silicone Edges For Oppo Realme 2 Pro - Black Red,/-/en/Touch-Transparent-Colored-Silicone-Realme/dp/B08X64QB36/ref=sr_1_9527?m=A1ZVRGNO5AYLOV&qid=1653130360&refinements=p_6%3AA1ZVRGNO5AYLOV&s=electronics&sr=1-9527,EGP 19.00,EGP 51.00,,
SAMSUNG HW-Q700A 3.1.2Ch Soundbar 2021,/-/en/SAMSUNG-HW-Q700A-3-1-2Ch-Soundbar-2021/dp/B09NTZNPRZ/ref=sr_1_9528?m=A1ZVRGNO5AYLOV&qid=1653130360&refinements=p_6%3AA1ZVRGNO5AYLOV&s=electronics&sr=1-9528,"EGP 8,820.49",,,
Moxom MX-SK05 Wireless Bluetooth Speakers - Black,/-/en/Moxom-MX-SK05-Wireless-Bluetooth-Speakers/dp/B0976DBWYJ/ref=sr_1_9529?m=A1ZVRGNO5AYLOV&qid=1653130361&refinements=p_6%3AA1ZVRGNO5AYLOV&s=electronics&sr=1-9529,EGP 198.00,,Limited time deal,
Yamaha PA-150 Power Adapter,/-/en/Other-PA-150B-Yamaha-PA-150-Adapter/dp/B073WN3B4P/ref=sr_1_9530?m=A1ZVRGNO5AYLOV&qid=1653130361&refinements=p_6%3AA1ZVRGNO5AYLOV&s=electronics&sr=1-9530,EGP 358.39,,,
Hoco W24 - Enlighten headphones with mic set,/-/en/Hoco-W24-Enlighten-headphones-mic/dp/B083TRKGFR/ref=sr_1_9531?m=A1ZVRGNO5AYLOV&qid=1653130361&refinements=p_6%3AA1ZVRGNO5AYLOV&s=electronics&sr=1-9531,EGP 223.86,,,
CELEBRaT D2 Magic Earphone Premuim Quality With Microphone - Red,/-/en/CELEBRaT-Earphone-Premuim-Quality-Microphone/dp/B09RG5V96B/ref=sr_1_9532?m=A1ZVRGNO5AYLOV&qid=1653130361&refinements=p_6%3AA1ZVRGNO5AYLOV&s=electronics&sr=1-9532,EGP 44.11,,,
"21D Full Screen Glass Protector, Flexible Nano-Gelatin Ceramic Anti-fingerprint Matte For Samsung Galaxy M51 Full Adhesive 10H Technology, Unbreakable or Scratched - Black",/-/en/Protector-Nano-Gelatin-Anti-fingerprint-Technology-Unbreakable/dp/B08X5XFBZP/ref=sr_1_9533?m=A1ZVRGNO5AYLOV&qid=1653130361&refinements=p_6%3AA1ZVRGNO5AYLOV&s=electronics&sr=1-9533,EGP 22.79,,,
Recci REB-P01 Fantasy Bluetooth Earphone - White,/-/en/Recci-REB-P01-Fantasy-Bluetooth-Earphone/dp/B07N488418/ref=sr_1_9534?m=A1ZVRGNO5AYLOV&qid=1653130361&refinements=p_6%3AA1ZVRGNO5AYLOV&s=electronics&sr=1-9534,EGP 147.00,,,
Soft Touch Transparent Hard Back Cover With Colored Silicone Edges For Oppo Realme 2 Pro - Black Red,/-/en/Touch-Transparent-Colored-Silicone-Realme/dp/B08X64QB36/ref=sr_1_9535?m=A1ZVRGNO5AYLOV&qid=1653130361&refinements=p_6%3AA1ZVRGNO5AYLOV&s=electronics&sr=1-9535,EGP 19.00,EGP 51.00,,
SAMSUNG HW-Q700A 3.1.2Ch Soundbar 2021,/-/en/SAMSUNG-HW-Q700A-3-1-2Ch-Soundbar-2021/dp/B09NTZNPRZ/ref=sr_1_9536?m=A1ZVRGNO5AYLOV&qid=1653130361&refinements=p_6%3AA1ZVRGNO5AYLOV&s=electronics&sr=1-9536,"EGP 8,820.49",,,
"zidwzidwei Tempered Glass Screen Protector for Redmi Note 8 2021, 9H Hardness Film Protection, Anti-Scratch, Bubble-Free, Clear Cover Screen Protector for Redmi Note 8 2021 [Pack of 3]",/-/en/zidwzidwei-Redmi-2021-Anti-Scratch-Bubble-Free/dp/B099ZLCRQD/ref=sr_1_9537?m=A1ZVRGNO5AYLOV&qid=1653130361&refinements=p_6%3AA1ZVRGNO5AYLOV&s=electronics&sr=1-9537,EGP 39.95,,,
"KabelDirekt – 20m HDMI cable – 4K HDMI cord (HDMI to HDMI – 4K@60Hz for stunning Ultra HD, High Speed with Ethernet, HDMI 2.0/1.4 – Blu-ray/PS4/PS5/Xbox Series X/Switch, white)",/-/en/KabelDirekt-stunning-Ethernet-Blu-ray-Switch/dp/B00FK0YVEG/ref=sr_1_9538?m=A1ZVRGNO5AYLOV&qid=1653130361&refinements=p_6%3AA1ZVRGNO5AYLOV&s=electronics&sr=1-9538,EGP 755.49,,,4.5 out of 5 stars
Dragon Privacy Screen Protector for Xiaomi Redmi Note 9 - Tinted,/-/en/Dragon-Privacy-Screen-Protector-Xiaomi/dp/B093WWX6ZP/ref=sr_1_9539?m=A1ZVRGNO5AYLOV&qid=1653130361&refinements=p_6%3AA1ZVRGNO5AYLOV&s=electronics&sr=1-9539,EGP 48.00,,,
Lenovo 530 Wireless Mouse - Grey,/-/en/Lenovo-530-Wireless-Mouse-Grey/dp/B08CVDHCGL/ref=sr_1_9540?m=A1ZVRGNO5AYLOV&qid=1653130361&refinements=p_6%3AA1ZVRGNO5AYLOV&s=electronics&sr=1-9540,EGP 444.00,EGP 718.20,,
Soft Touch Hard Back Cover With Colored Silicone Edges For Huawei P20 Lite 2019 / Huawei Nova 5i - Red Black,/-/en/Touch-Cover-Colored-Silicone-Huawei/dp/B08X6KZNRP/ref=sr_1_9541?m=A1ZVRGNO5AYLOV&qid=1653130361&refinements=p_6%3AA1ZVRGNO5AYLOV&s=electronics&sr=1-9541,EGP 19.00,,,
"Samsung Watch 4/Classic, Sports Band, S/M, Pink",/-/en/Samsung-Watch-Classic-Sports-Band/dp/B09BL5SD7L/ref=sr_1_9542?m=A1ZVRGNO5AYLOV&qid=1653130361&refinements=p_6%3AA1ZVRGNO5AYLOV&s=electronics&sr=1-9542,EGP 564.14,,,
X-Level Metallic Back Cover For Huawei Mate 20 Pro - Red,/-/en/X-Level-Metallic-Back-Cover-Huawei/dp/B08WJJBCBS/ref=sr_1_9543?m=A1ZVRGNO5AYLOV&qid=1653130361&refinements=p_6%3AA1ZVRGNO5AYLOV&s=electronics&sr=1-9543,EGP 87.50,,,
Mobile Screen Ceramic Anti FingerPrint Soft 111D Screen Protector For Samsung Galaxy A20,/-/en/Mobile-Screen-Ceramic-FingerPrint-Protector/dp/B09239XGPV/ref=sr_1_9544?m=A1ZVRGNO5AYLOV&qid=1653130361&refinements=p_6%3AA1ZVRGNO5AYLOV&s=electronics&sr=1-9544,EGP 26.28,,,
"KabelDirekt – 10m 270° Angle HDMI Cable 4K compatible with (HDMI 2.0a/b, 2.0, 1.4a, HDMI to HDMI, 4K@60HZ,1080p FullHD, UHD, Ultra HD, 3D, High Speed with Ethernet, ARC, PS4, XBOX, HDTV)",/-/en/KabelDirekt-Angle-compatible-FullHD-Ethernet/dp/B00B1C8FIK/ref=sr_1_9545?m=A1ZVRGNO5AYLOV&qid=1653130361&refinements=p_6%3AA1ZVRGNO5AYLOV&s=electronics&sr=1-9545,EGP 328.70,,,4.3 out of 5 stars
"Full Screen Coverage Tempered Glass Protector Compatible with Samsung Galaxy A72 5G - Precision Engineered, Case Friendly, Touch Sensitive and Bubble Free Installation",/-/en/Coverage-Tempered-Protector-Compatible-Samsung/dp/B09229VND2/ref=sr_1_9546?m=A1ZVRGNO5AYLOV&qid=1653130361&refinements=p_6%3AA1ZVRGNO5AYLOV&s=electronics&sr=1-9546,EGP 32.86,,,
Silicon Back Cover With Metal Ring Holder For Oppo Reno - Red Clear,/-/en/Silicon-Back-Cover-Metal-Holder/dp/B096L5BV2B/ref=sr_1_9547?m=A1ZVRGNO5AYLOV&qid=1653130361&refinements=p_6%3AA1ZVRGNO5AYLOV&s=electronics&sr=1-9547,EGP 88.02,,,
Pavareal PA-PB66 15000 Milliampere 3 Charging Ports Wired Power Bank for Mobile Phones - Grey,/-/en/Pavareal-PA-PB66-Milliampere-Charging-Mobile/dp/B091NXFTQ9/ref=sr_1_9548?m=A1ZVRGNO5AYLOV&qid=1653130361&refinements=p_6%3AA1ZVRGNO5AYLOV&s=electronics&sr=1-9548,EGP 308.70,,,
XO TZ12 Car Charger 18W With Micro Cable - Black,/-/en/XO-TZ12-Charger-Micro-Cable/dp/B09GQJ6B6S/ref=sr_1_9549?m=A1ZVRGNO5AYLOV&qid=1653130361&refinements=p_6%3AA1ZVRGNO5AYLOV&s=electronics&sr=1-9549,EGP 66.88,,,
Nano Ceramic Anti FingerPrint Soft Screen Protector For Y5p,/-/en/Nano-Ceramic-FingerPrint-Screen-Protector/dp/B08X66XD65/ref=sr_1_9550?m=A1ZVRGNO5AYLOV&qid=1653130361&refinements=p_6%3AA1ZVRGNO5AYLOV&s=electronics&sr=1-9550,EGP 13.20,,,
Tempered Glass Screen HD Protector For For For Samsung Galaxy S20 Ultra - Black,/-/en/Tempered-Screen-Protector-Samsung-Galaxy/dp/B08X65T3G6/ref=sr_1_9551?m=A1ZVRGNO5AYLOV&qid=1653130361&refinements=p_6%3AA1ZVRGNO5AYLOV&s=electronics&sr=1-9551,EGP 72.50,EGP 80.00,,
ABBRi kx0137 Cable Clips - Multi Color,/-/en/ABBRi-kx0137-Cable-Clips-Multi/dp/B095PZ3B65/ref=sr_1_9552?m=A1ZVRGNO5AYLOV&qid=1653130361&refinements=p_6%3AA1ZVRGNO5AYLOV&s=electronics&sr=1-9552,EGP 43.12,,,
"VGUARD [2 Pack] Screen Protector for Honor 20 Lite/Honor 10 Lite/Honor 20e / Huawei P Smart Plus 2019 / Huawei P Smart 2020, Premium Tempered Glass",/-/en/VGUARD-Screen-Protector-Premium-Tempered/dp/B07L4XXWLQ/ref=sr_1_9553?m=A1ZVRGNO5AYLOV&qid=1653130362&refinements=p_6%3AA1ZVRGNO5AYLOV&s=electronics&sr=1-9553,EGP 32.00,,,
Screen Protector 5D Full Glue For Huawei Honor 8X Black,/-/en/Screen-Protector-Huawei-Honor-Black/dp/B08Y8Y4SXZ/ref=sr_1_9554?m=A1ZVRGNO5AYLOV&qid=1653130362&refinements=p_6%3AA1ZVRGNO5AYLOV&s=electronics&sr=1-9554,EGP 28.80,,,
High Quality Glass Screen Protector For Samsung Galaxy A32 - Clear Black,/-/en/Quality-Screen-Protector-Samsung-Galaxy/dp/B09R51X8N1/ref=sr_1_9555?m=A1ZVRGNO5AYLOV&qid=1653130362&refinements=p_6%3AA1ZVRGNO5AYLOV&s=electronics&sr=1-9555,EGP 29.18,,,
Armor Back Cover For Xiaomi Mi 8 Se - Black,/-/en/Armor-Back-Cover-Xiaomi-Mi/dp/B0937DGPVX/ref=sr_1_9556?m=A1ZVRGNO5AYLOV&qid=1653130362&refinements=p_6%3AA1ZVRGNO5AYLOV&s=electronics&sr=1-9556,EGP 29.00,,,
5D screen protector for samsung A10,/-/en/5D-screen-protector-samsung-A10/dp/B08XS39KCC/ref=sr_1_9557?m=A1ZVRGNO5AYLOV&qid=1653130362&refinements=p_6%3AA1ZVRGNO5AYLOV&s=electronics&sr=1-9557,EGP 17.50,EGP 24.00,,
"Dl3 Mobilk for Realme 3 (6.22 inch) Tempered Glass Screen Protector - Scratch Resistance, Non Slip Grip, Quick and Easy Installation Protective Screen Protector",/-/en/Dl3-Mobilk-Realme-Tempered-Protector/dp/B091C46TC7/ref=sr_1_9558?m=A1ZVRGNO5AYLOV&qid=1653130362&refinements=p_6%3AA1ZVRGNO5AYLOV&s=electronics&sr=1-9558,EGP 29.00,,,
Apple Adapters for Computers - White,/-/en/Apple-Adapters-for-Computers-White/dp/B008ALA6DW/ref=sr_1_9559?m=A1ZVRGNO5AYLOV&qid=1653130362&refinements=p_6%3AA1ZVRGNO5AYLOV&s=electronics&sr=1-9559,EGP 690.00,"EGP 1,760.00",,
Proda PD-B15i Fast Charging Lightning Cable - White,/-/en/Proda-PD-B15i-Charging-Lightning-Cable/dp/B07WNXG41G/ref=sr_1_9560?m=A1ZVRGNO5AYLOV&qid=1653130362&refinements=p_6%3AA1ZVRGNO5AYLOV&s=electronics&sr=1-9560,EGP 27.20,,,
"Xiaomi Redmi Note 8 Pro, Screen Protector (2 packs) HD Clear Anti-Scratch Anti-Fingerprint No-Bubble 9H Hardness Tempered, Beukei.",/-/en/Protector-Anti-Scratch-Anti-Fingerprint-No-Bubble-Hardness/dp/B08Y8X9KLX/ref=sr_1_9561?m=A1ZVRGNO5AYLOV&qid=1653130362&refinements=p_6%3AA1ZVRGNO5AYLOV&s=electronics&sr=1-9561,EGP 34.37,EGP 40.00,Limited time deal,
High Quality Glass Screen Protector For Huawei Nova 8 - Clear Black,/-/en/Quality-Glass-Screen-Protector-Huawei/dp/B09R52XP3Z/ref=sr_1_9562?m=A1ZVRGNO5AYLOV&qid=1653130362&refinements=p_6%3AA1ZVRGNO5AYLOV&s=electronics&sr=1-9562,EGP 29.18,,,
Soft Touch Transparent Hard Back Cover With Colored Silicone Edges For Vivo Y50 - Dark Green Orange,/-/en/Touch-Transparent-Cover-Colored-Silicone/dp/B08XS1JYL6/ref=sr_1_9563?m=A1ZVRGNO5AYLOV&qid=1653130362&refinements=p_6%3AA1ZVRGNO5AYLOV&s=electronics&sr=1-9563,EGP 19.00,,,
Zero High Performance In Hd Tv High Quality Vga Cable 5 M - White Blue,/-/en/Zero-High-Performance-Quality-Cable/dp/B09P5J7H8L/ref=sr_1_9564?m=A1ZVRGNO5AYLOV&qid=1653130362&refinements=p_6%3AA1ZVRGNO5AYLOV&s=electronics&sr=1-9564,EGP 51.54,,,
Dragon Anti-Fingerprint Glass Screen Protector for Huawei P8 Lite - Clear,/-/en/Dragon-Anti-Fingerprint-Screen-Protector-Huawei/dp/B08WJNBYS3/ref=sr_1_9565?m=A1ZVRGNO5AYLOV&qid=1653130362&refinements=p_6%3AA1ZVRGNO5AYLOV&s=electronics&sr=1-9565,EGP 28.80,,,
Lens camera screen protector Nano anti shock for Xiaomi note 9s - Clear,/-/en/camera-screen-protector-shock-Xiaomi/dp/B08X6R21YK/ref=sr_1_9566?m=A1ZVRGNO5AYLOV&qid=1653130362&refinements=p_6%3AA1ZVRGNO5AYLOV&s=electronics&sr=1-9566,EGP 55.12,EGP 56.00,,4.5 out of 5 stars
Nillkin Qin Flip Leather Case Cover For Apple Apple iPhone 11 Pro - Black,/-/en/Nillkin-Leather-Cover-Apple-iPhone/dp/B07XR88FQ1/ref=sr_1_9567?m=A1ZVRGNO5AYLOV&qid=1653130362&refinements=p_6%3AA1ZVRGNO5AYLOV&s=electronics&sr=1-9567,EGP 262.32,,,4.7 out of 5 stars
Hoco CA51A - Tour Gravity Linkage Air Vent Car Holder Compatible with iPhone Samsung Xiaomi Oppo Huawei (Suitable for Mobile 4 - 6.5 inch) - Black,/-/en/Hoco-CA51A-Gravity-Compatible-Suitable/dp/B09SF9X9NG/ref=sr_1_9568?m=A1ZVRGNO5AYLOV&qid=1653130362&refinements=p_6%3AA1ZVRGNO5AYLOV&s=electronics&sr=1-9568,EGP 116.78,,,
Zagg iPhone 8/7/6S/6 Invisible Shield Glass - Privacy Screen Protector,/-/en/Zagg-iPhone-Invisible-Shield-Glass/dp/B01M12VN67/ref=sr_1_9569?m=A1ZVRGNO5AYLOV&qid=1653130362&refinements=p_6%3AA1ZVRGNO5AYLOV&s=electronics&sr=1-9569,EGP 122.19,,,
"UGREEN USB C Cable, Nylon-Braided USB-C to USB-C 2.0 Cable (C to C) Compatible for iPad mini 6 2018 iPad Pro 12.9""/11"", New MacBook, Galaxy S21+, S21Ultra, Huawei P30 P20, Xiaomi 11Ultra, etc-1Meter",/-/en/UGREEN-Nylon-Braided-Compatible-S21Ultra-etc-1Meter/dp/B07PLSDPYN/ref=sr_1_9570?m=A1ZVRGNO5AYLOV&qid=1653130362&refinements=p_6%3AA1ZVRGNO5AYLOV&s=electronics&sr=1-9570,EGP 100.67,,,4.6 out of 5 stars
For Xiaomi Mi 9T Lens Camera Screen Protecor Nano Flexable HD 0.42m - Clear - 2725607900208,/-/en/Xiaomi-Camera-Screen-Protecor-Flexable/dp/B0966S499L/ref=sr_1_9571?m=A1ZVRGNO5AYLOV&qid=1653130362&refinements=p_6%3AA1ZVRGNO5AYLOV&s=electronics&sr=1-9571,EGP 19.15,,,
Boter Printed TPU Silicon Back Cover For Oppo Realme 6 - Multi Color,/-/en/Boter-Printed-Silicon-Cover-Realme/dp/B08X68QCHT/ref=sr_1_9572?m=A1ZVRGNO5AYLOV&qid=1653130362&refinements=p_6%3AA1ZVRGNO5AYLOV&s=electronics&sr=1-9572,EGP 19.00,,,
Spigen Classic C1 Back Cover For apple IPhone 8 - Clear Turquoise,/-/en/Spigen-Classic-Cover-apple-IPhone/dp/B07D4NBG49/ref=sr_1_9573?m=A1ZVRGNO5AYLOV&qid=1653130362&refinements=p_6%3AA1ZVRGNO5AYLOV&s=electronics&sr=1-9573,EGP 546.03,,,
810004-BK (SPEAKER SPEEDLINK TWOXO BLK),/-/en/810004-BK-SPEAKER-SPEEDLINK-TWOXO-BLK/dp/B097T8KN3T/ref=sr_1_9574?m=A1ZVRGNO5AYLOV&qid=1653130362&refinements=p_6%3AA1ZVRGNO5AYLOV&s=electronics&sr=1-9574,EGP 183.60,,,
Boter Printed TPU Silicon Back Cover For Samsung Galaxy S20 Plus - Multi Color,/-/en/Boter-Printed-Silicon-Samsung-Galaxy/dp/B08X6L6GK6/ref=sr_1_9575?m=A1ZVRGNO5AYLOV&qid=1653130362&refinements=p_6%3AA1ZVRGNO5AYLOV&s=electronics&sr=1-9575,EGP 56.00,,,
Xiaomi Poco X3 Full Screen Protector Black Frame - By Dl3 Mobailk,/-/en/Xiaomi-Screen-Protector-Black-Frame/dp/B093FV8612/ref=sr_1_9576?m=A1ZVRGNO5AYLOV&qid=1653130362&refinements=p_6%3AA1ZVRGNO5AYLOV&s=electronics&sr=1-9576,EGP 25.65,EGP 32.83,,
UGREEN 3.5mm Male to 2 RCA Male Audio Cable 3m (Gray),/-/en/UGREEN-3-5mm-Male-Audio-Cable/dp/B00B2HOXN0/ref=sr_1_9577?m=A1ZVRGNO5AYLOV&qid=1653130363&refinements=p_6%3AA1ZVRGNO5AYLOV&s=electronics&sr=1-9577,EGP 127.31,,,
"SUPCASE Unicorn Beetle Pro Series Case Designed for Airpods Pro, Full-Body Rugged Protective Case with Carabiner for Apple Airpods Pro (Dark Green)",/-/en/SUPCASE-Designed-Full-Body-Protective-Carabiner/dp/B085W18F75/ref=sr_1_9578?m=A1ZVRGNO5AYLOV&qid=1653130363&refinements=p_6%3AA1ZVRGNO5AYLOV&s=electronics&sr=1-9578,EGP 396.68,,,
Auto Focus Silicone Back Cover Slim Case with 5D Anti-Fingerprint Screen Protector for Samsung Galaxy M30S - Navy,/-/en/Auto-Focus-Silicone-Anti-Fingerprint-Protector/dp/B091NYPYR3/ref=sr_1_9579?m=A1ZVRGNO5AYLOV&qid=1653130363&refinements=p_6%3AA1ZVRGNO5AYLOV&s=electronics&sr=1-9579,EGP 19.00,,,
Slim Hard Back Cover with Slide Camera Shield for Samsung A81/M60S/NOTE10 LITE Black,/-/en/Cover-Camera-Shield-Samsung-NOTE10/dp/B09FKC917L/ref=sr_1_9580?m=A1ZVRGNO5AYLOV&qid=1653130363&refinements=p_6%3AA1ZVRGNO5AYLOV&s=electronics&sr=1-9580,EGP 62.75,,,
Slim Hard Back Cover with Slide Camera Shield for Iphone XR Black,/-/en/Cover-Slide-Camera-Shield-Iphone/dp/B09FKBQF9W/ref=sr_1_9581?m=A1ZVRGNO5AYLOV&qid=1653130363&refinements=p_6%3AA1ZVRGNO5AYLOV&s=electronics&sr=1-9581,EGP 62.75,,,
Kaiyue Flip Cover For Huawei Y5P - Pink,/-/en/Kaiyue-Flip-Cover-Huawei-Y5P/dp/B091J3LYKP/ref=sr_1_9582?m=A1ZVRGNO5AYLOV&qid=1653130363&refinements=p_6%3AA1ZVRGNO5AYLOV&s=electronics&sr=1-9582,EGP 72.00,,,
