Name,Link,Price,OldPrice,BestSeller,Stars
Dual Layer Hard Back Cover with Stand and Finger Holder for Huawei Nova 4 - Red and Black,/-/en/Layer-Cover-Finger-Holder-Huawei/dp/B08X67Y9RH/ref=sr_1_9583?m=A1ZVRGNO5AYLOV&qid=1653130363&refinements=p_6%3AA1ZVRGNO5AYLOV&s=electronics&sr=1-9583,EGP 19.00,,,
Tempered Glass Screen Protector For Huawei Y9 2018 Black,/-/en/Tempered-Glass-Screen-Protector-Huawei/dp/B08Y8Z2V7L/ref=sr_1_9584?m=A1ZVRGNO5AYLOV&qid=1653130363&refinements=p_6%3AA1ZVRGNO5AYLOV&s=electronics&sr=1-9584,EGP 28.80,,,
Nillkin Acme Sleeve for Apple MacBook 16 - Multi Color,/-/en/Nillkin-Acme-Sleeve-Apple-MacBook/dp/B091J5LP8W/ref=sr_1_9585?m=A1ZVRGNO5AYLOV&qid=1653130363&refinements=p_6%3AA1ZVRGNO5AYLOV&s=electronics&sr=1-9585,EGP 517.50,,,
Boter 3D Glass Hard Back Cover With Silicone Edges For Samsung Galaxy S20 Plus - Multi Color,/-/en/Boter-Glass-Silicone-Samsung-Galaxy/dp/B08ZNRBLY6/ref=sr_1_9586?m=A1ZVRGNO5AYLOV&qid=1653130363&refinements=p_6%3AA1ZVRGNO5AYLOV&s=electronics&sr=1-9586,EGP 19.00,,,
King Kong Mirror Back Hard Case With Anti Finger Print Ceramic Screen Protector for Xiaomi Redmi 8A - Clear,/-/en/King-Kong-Mirror-Ceramic-Protector/dp/B091NZ3NPP/ref=sr_1_9587?m=A1ZVRGNO5AYLOV&qid=1653130363&refinements=p_6%3AA1ZVRGNO5AYLOV&s=electronics&sr=1-9587,EGP 19.00,,,
Fashion Auto Focus Rubber Back Cover With Metal Ring Button For Xiaomi Redmi 6 Pro - Navy,/-/en/Fashion-Focus-Rubber-Button-Xiaomi/dp/B08WJKYN6R/ref=sr_1_9588?m=A1ZVRGNO5AYLOV&qid=1653130363&refinements=p_6%3AA1ZVRGNO5AYLOV&s=electronics&sr=1-9588,EGP 19.00,,,
Fashion 360 Full Protection Magnetic Phone Back Cover For Samsung Galaxy A20S - Multi Color,/-/en/Fashion-Protection-Magnetic-Samsung-Galaxy/dp/B08Y8XYDGB/ref=sr_1_9589?m=A1ZVRGNO5AYLOV&qid=1653130363&refinements=p_6%3AA1ZVRGNO5AYLOV&s=electronics&sr=1-9589,EGP 19.00,,,
Back Cover Magnatic For iphone 6 and 6s Silver,/-/en/Back-Cover-Magnatic-iphone-Silver/dp/B08Y8XNMZ7/ref=sr_1_9590?m=A1ZVRGNO5AYLOV&qid=1653130363&refinements=p_6%3AA1ZVRGNO5AYLOV&s=electronics&sr=1-9590,EGP 19.00,,,
Boter 3D Back Cover Hard Slim Case For Huawei Nova 7i - Multi Color,/-/en/Boter-Back-Cover-Hard-Huawei/dp/B08X67VHVB/ref=sr_1_9591?m=A1ZVRGNO5AYLOV&qid=1653130363&refinements=p_6%3AA1ZVRGNO5AYLOV&s=electronics&sr=1-9591,EGP 19.00,,,
Anti Shock Four Angles Protection Transparent Hard Back Cover With Colored Silicone Edges For Samsung Galaxy A10 & Samsung Galaxy M10 - Clear & Red & Black,/-/en/Protection-Transparent-Colored-Silicone-Samsung/dp/B08X64S39S/ref=sr_1_9592?m=A1ZVRGNO5AYLOV&qid=1653130363&refinements=p_6%3AA1ZVRGNO5AYLOV&s=electronics&sr=1-9592,EGP 19.00,,,
9H Tempered Glass Back Cover with Magnetic Frame for Vivo Mobiles V17 and V19 - Red,/-/en/Tempered-Glass-Cover-Magnetic-Mobiles/dp/B091NXK2DY/ref=sr_1_9593?m=A1ZVRGNO5AYLOV&qid=1653130363&refinements=p_6%3AA1ZVRGNO5AYLOV&s=electronics&sr=1-9593,EGP 19.00,,,
Xiaomi Redmi 6A Tempered Glass Screen Protector For Redmi 6A - Clear By Muzz,/-/en/Xiaomi-Redmi-Tempered-Screen-Protector/dp/B091NXSVPV/ref=sr_1_9594?m=A1ZVRGNO5AYLOV&qid=1653130363&refinements=p_6%3AA1ZVRGNO5AYLOV&s=electronics&sr=1-9594,EGP 24.00,,,
"HOCO Exquisite Steel Micro USB Cable, 1.2M, White (U42)",/-/en/Exquisite-Steel-Micro-Cable-White/dp/B07LFLHN6S/ref=sr_1_9595?m=A1ZVRGNO5AYLOV&qid=1653130363&refinements=p_6%3AA1ZVRGNO5AYLOV&s=electronics&sr=1-9595,EGP 56.50,,,
Slim Hard Back Cover with Slide Camera Shield for Samsung A20/A30/M10S Gray,/-/en/Cover-Slide-Camera-Shield-Samsung/dp/B09FKDRN6M/ref=sr_1_9596?m=A1ZVRGNO5AYLOV&qid=1653130363&refinements=p_6%3AA1ZVRGNO5AYLOV&s=electronics&sr=1-9596,EGP 62.75,,,
Auto Focus Silicone Back Cover Slim Case with 5D Anti-Fingerprint Screen Protector for Realme 6 - Black,/-/en/Auto-Focus-Silicone-Anti-Fingerprint-Protector/dp/B091NYRWKH/ref=sr_1_9597?m=A1ZVRGNO5AYLOV&qid=1653130363&refinements=p_6%3AA1ZVRGNO5AYLOV&s=electronics&sr=1-9597,EGP 48.00,,,
hoco. - X20 mciro cable 2m black,/-/en/hoco-X20-mciro-cable-black/dp/B07YV9RS7F/ref=sr_1_9598?m=A1ZVRGNO5AYLOV&qid=1653130363&refinements=p_6%3AA1ZVRGNO5AYLOV&s=electronics&sr=1-9598,EGP 37.41,,,
Slim Hard Back Cover with Slide Camera Shield for Samsung Note 20 Pink,/-/en/Cover-Slide-Camera-Shield-Samsung/dp/B09FKD3SMC/ref=sr_1_9599?m=A1ZVRGNO5AYLOV&qid=1653130363&refinements=p_6%3AA1ZVRGNO5AYLOV&s=electronics&sr=1-9599,EGP 62.75,,,
Yesido CA-49 TYPE-C to Lightning 18W PD Fast Charging Data Cable for IPhone 1.2m-White,/-/en/Yesido-TYPE-C-Lightning-Charging-1-2m-White/dp/B096DCT6LW/ref=sr_1_9600?m=A1ZVRGNO5AYLOV&qid=1653130363&refinements=p_6%3AA1ZVRGNO5AYLOV&s=electronics&sr=1-9600,EGP 135.20,,,
